"CandidateID","Additional-Info","Skills","Work-Experience__Company","Work-Experience__Job-Description","Work-Experience__Job-Duration","Work-Experience__Job Title","Location","Education__Institute","Education__School-Duration","Education__Qualification","Resume-Summary"
"13","Additional Information Technical Skills:  Windows:  • Installing and configuration of Windows Desktop and Server Products  • Assembling & disassembling a Desktop & Server  • Troubleshooting and maintenance of desktop & Server hardware  • Troubleshooting and maintenance of all LAN and workstation network connectivity  issues  • Installing and Troubleshooting User Desktops, Remote Site connectivity through third party  tools, Online troubleshooting of client OS like Windows 7, Windows Vista, Windows XP.  • Working with File Systems and Disks & Disk Management  • Installing, configuring and managing Symantec endpoint antivirus for desktops and patch  management for Windows 2003 server, Windows 2000 and Windows XP  • Configuring POP3 and IMAP Mail Accounts in Outlook Express  • Installing and managing application software  • Providing technical, functional and operational support to users in the implementation and  use of software applications  • Installation and configuration of network printers and scanners  • Configuration of DHCP & DNS Servers  • Configuration and maintaining Active Directory, Group Policies, Users, Computers.  • Configuration of Hardware and software RAID's  Roles & Responsibilities  • System Admin for all the servers in the off hours. Responsible for server resource  availability for the applications & databases, and troubleshooting of various OS errors  • Working on tickets based on severity and tickets receiving via Service desk for various  requests from the field and project team.  • Managing Users & Groups  • Configuring and managing Logical Volume Manager  • Adding disks to volume groups and creating file system  • Installing, configuring and troubleshooting the Software RAID  • Administration of Symantec Antivirus Corporate Server Edition on Windows server.  • User Administration, Resource management, Hardware troubleshooting & Disk Space  availability, on all the servers.  • Network Printer configuration and management.  • Backup taking and restoring on OS utilities.  • Managing customer service operations for rendering and achieving quality services,  ensuring compliance with Service Level Agreement.  • Working with File Systems and Disks & Disk Management  • Configuring POP3 and IMAP Mail Accounts in Outlook Express  • Providing technical, functional and operational support to users in the implementation and  • Installation and configuration of network printers and scanner.    MY COMPLETED PROJECT    • PALLAVAN GRAMA BANK SERVER MIGRATION,  WINDOWS 2012 SERVER AND BANKLINKS CONFIGURATION  (KRISHNAGIRI AND DHARMAPURI DISTRICT).    Programming Skills:    Programming Languages: C, C++ and CORE JAVA.  Database: SQL and Oracle.  Operating sys: Red hat Linux, Windows XP and Windows 7.  Server: Windows 2003, 2008 Server and Red hat Linux.  Packages: MS Office 2007.","Windows Server Administration (4 years)","HCL Services Ltd - Coimbatore, Tamil Nadu && Sri Krishna Agency && HCL Services Ltd - Coimbatore, Tamil Nadu && HCL Services Ltd - Coimbatore, Tamil Nadu && None","Oct 2015 onwards working in HCL as Associate Engineer  Roles and Responsibilities  • User administration (setup and maintaining account)  • Maintaining system  • Verify that peripherals are working properly  • Quickly arrange repair for hardware in occasion of hardware failure  • Monitor system performance  • Create file systems  • Install software  • Create a backup and recover policy  • Monitor network communication  • Update system as soon as new version of OS and application software comes out • Implement the policies for the use of the computer system and network  • Setup security policies for users && None && None && None && None","October 2015 to Present && June 2014 to October 2015 && June 2014 to September 2015 && April 2013 to June 2014 && April 2013 to June 2014","Customer Support Engineer && Shoolagiri has System Support Engineer && System support Engineer && Customer Support Engineer && Coimbatore has Customer Support Engineer","Krishnagiri, Tamil Nadu","New Little Flower Maticulation School Chennai","2009 to 2012","MCA in Computer Science","• Having 3+ years of Experience in IT Industry, with hands-on experience on branded  Servers like HCL, DELL, HP.  • Core strengths are implementation and administration of windows servers.  • Outgoing, dedicated, hardworking and goal oriented person. I believe in Team work and  consider myself as an effective team member."
"14","Additional Information Key Responsibilities in previous company:     Responsible for the performance of 25 support agents (voice, chat and email)   Evaluate transactions as per the QA guidelines   Deliver feedback to the associate based on the observations   Assist the team on the identified areas of opportunity and improve the Quality of transaction   Conduct internal and external calibrations with the client   Process clarifications with inputs on variance   Analysis of data based on trends identified - Customer satisfaction, Agent behavior, and other necessary root cause analysis   Audits to ensure compliance of agreed action plans   Interact with the client for process updates"," Excellent verbal communication skills  Good logical reasoning & analytical skills  Clear understanding of the Quality role  Good interpersonal skills  Knowledge of Spread sheets & presentations (4 years)","Knoah Solutions Pvt Ltd - Hyderabad, Andhra Pradesh","Two years and eight months of experience as a Quality Assurance Specialist (Oct 2013 to June 2016) in Knoah Solutions:   As a Quality Assurance Specialist for   o Huawei & Honor USA Tech Support  o Evaluated voice, chat and email transactions  o Analyzed Customer satisfaction and First contact resolution opportunities  o Coached associates for better customer service  o Provided suggestions to client for change of process and policy  o Choice hotels (Sales process)  o Evaluations and Analysis of voice and chat transactions    ~ One year of experience as an e-Support Officer (Sept 2012 to Oct 2013) in Knoah Solutions:     As a Tech support for Samsung Telecommunications America  o Assisted customers on troubleshooting of Samsung Android phones  o Assisted fellow associates on product and process knowledge  o Acquired excellent customer satisfaction and issue resolution skills     Hands-on experience in tools like KnoahsARK (Internal tool for evaluating transactions, monitoring Voice transactions and coaching associates), Live Person, Live Chat and WebQA   Excellent working knowledge of MS tools like Excel, Word, PowerPoint    Possess capability of managing & retaining of resources, under the management limits and instructions   Delivered quality controls and enhancements to proactively address problems and improved customer satisfaction and bottom-line results   Regular business reviews (weekly, monthly and yearly) with the higher management and client   An eye to improve and innovate - Proven ability to bring about changes that increase efficiency (have optimized and standardized various processes in voice tech support, thereby improving efficiencies) by feedback and coaching from observations    Certifications:   o Total Assurance Certification – A course about Quality and its implementation.    Currently, working in Ship Building Center, Visakhapatnam (SBC) in the Planning Department as an engineer and a coordinator.","September 2012 to June 2016","Quality Assurance Specialist","Visakhapatnam, Andhra Pradesh","Kaushik College of Engineering, JNTU Visakhapatnam, Andhra Pradesh","May 2007 to June 2011","B-Tech in Computer Science","None"
"17","None","Microsoft Office,SEO,SEM (Less than 1 year)","Minacs && Jhaveri Securties Ltd && Enlightenment99 Software Consultants Pvt. Ltd","Knowledge of SEO including On Page optimization, off page Optimization, Search Engine Marketing, DISPLAY Advertising, analytic & Social Media Marketing as well as various online tools such as:  - SEO - On Page: Screaming frog, Keyword planner tool, display planner tool, Alexa, SEO power suite, Google Developer tools  - SEO - Off Page: MOZ, Drop my link, Seo optimizer tools, etc.  -PPC Campaign: Google Analytics (Certified Professional), Google AdWords (certified professional), Bing (Certified Professional) and HubSpot -Inbound Marketing (Certified professional)  - Social Media Tools like Buffer, Sprout, Pagemodo, Tweetdeck, raven, Tweet reach, socialbro, every post && None && None","June 2016 to September 2016 && 2016 to 2016 && June 2014 to January 2015","Customer Support Officer && Customer Support Officer (Online Trading) && VOIP Trainee Specialist","Vadodara, Gujarat","M.S University.","2014","MBA in marketing","To work in an organization where I can learn and enhance my knowledge, put theory into practice and substantially contribute in the development and expansion of the organization."
"18","Additional Information IT SKILLS    • Insightful knowledge of Windows XP, MS Office Suite & Web Services.  • Experience of working with engineering design tools like EASE for acoustic design.  • Good exposure of working with MATLAB during college education.","Product Support,Commissioning, Testing, Product Development, Pressentation (5 years)","Bosch Limited - Chandigarh, Chandigarh && Bosch Limited - Bangalore, Karnataka && Bosch Limited && Bosch Limited && Bosch Limited","Since Jan '16 Assistant Manager (Product Specialist and Technical Support)    Role:  Assistant Manager (Product Specialist and Technical Support):  • Ensuring that the assigned products & product lines consistently resonate with current & potential customers  • Managing the overall product life cycle including Conceptualize, Supporting Product Development, Product Manufacturing, Product Testing, Prepare publication of Product Change Notices (PCN), Product Discontinuation Notices (PDN)  • Conducting extensive research and analysis of consumer needs, behaviour and buying decisions to evolve Unique Selling Proposition (USP) of the product    Senior Engineer:  • Managed all aspects of product marketing including market research, competitive analysis, market forecast and product positioning; conducted product portfolio analysis and product life cycle management for LfL (Local for Local) PACO products.  • Provided technical support and site related troubleshooting solutions for major installations like Indian Parliament, Metro Railway and so on.  • Analysed and determined requirements for future products with the aim of achieving higher revenue growth and market share for the business unit.    Highlights:  • Successfully planned and executed:  ◦ Design consultancy for Audio Conference System for Indian Parliament (Loksabha), Madhya Pradesh Legislative Council, and Chandigarh International Airport  ◦ Public Address System for Cochin Metro, Cochin International Airport, and IGCAR Chennai  • Led the product launch of following products:  ◦ CCS700 audio conference system, Mixer Amplifier (PLE-1MExx range), Cabinet and Ceiling loudspeakers by conducting the process of conceptualizing, product design & development, testing and pricing according to Bosch Product Engineering Process (PEP)  ◦ A total of 27 products across different product ranges were released in to market in a span of 4 years.  • Rolled-out product communication strategies such as E mailers, Product Catalogues, Application Notes to ensure high brand recall and product engagement by end-users.  • Lead the sales, product marketing team on design of PA and FIDS system for a major project and also successfully conducted Proof of Concept for the same. && Growth Path: && None && None && None","January 2016 to Present && December 2010 to Present && January 2012 to December 2015 && January 2011 to January 2012 && December 2010 to December 2011","Assistant Manager (Product Specialist and Technical Support) && Assistant Manager (Product Specialist and Technical Support) && Senior Engineer (Product Specialist and Technical Support) && Engineer (Product Specialist and Technical Support) && Graduate Engineer Trainee","Bangalore, Karnataka","Sri Taralabalu Jagadguru Residential School Davangere, Karnataka && Visvesvaraya Technological University Bangalore, Karnataka","2004 && None","Bachelor of Engineering in Technology && None","• A skilled product manager with over 5 years of experience, targeting opportunities in system programming.  • Design, Commissioning and Tech Support for PA system and Audio System for Indian Parliament (Loksabha), Cochin Metro, Cochin International Airport & IGCAR in Government sector  • Hands-on experience in product engineering process with key focus on achieving highest quality.  • Excellent product ans systems knowledge and the capability to contribute as a team player."
"20","Additional Information SKILLS:    ➢ Customer Relationship Management Software  ➢ Managing Data-centers.  ➢ Installation of Leased Line - Internet, VPN & RF links.  ➢ Installation of Windows Active Directory (2000, 2003, 2012R2)  ➢ Installation of Exchange Server.  ➢ Linux Based Servers  ➢ Microsoft Outlook  ➢ Creating in DNS - PTR Records  ➢ Vendor Management.  ➢ Effective problem solver .  ➢ Effective workflow management  ➢ Process improvement specialist    TECHNICAL SKILLS:    Operating Systems: Microsoft Windows Server […]  Directory Services: Active Directory […]    Messaging Systems: Microsoft Exchange […]","Microsoft Active Directory,Exchange server,LAN,WAN Trouble Shooting,Routers. (7 years)","Tikona Infinet Ltd - Chennai, Tamil Nadu && Tikona Infinet Ltd && Tikona Infinet Ltd - Chennai, Tamil Nadu","Chennai    ➢ Investigated and resolved customer inquiries and complaints in an empathetic manner  ➢ Met all customer call guidelines including service levels, handle time and productivity.  ➢ Solved unresolved customer service issues.  ➢ Assumed ownership over team productivity and managed work flow to meet or exceed quality service goals.  ➢ Strong leader of customer support staff.  ➢ Facilitated inter-departmental communication to effectively provide customer support.  ➢ Scheduled staff shifts to cover peaks and problems in customer inquiries.  ➢ Trained staff on operating procedures and company services.  ➢ Followed-through on all critical inter-departmental escalations to increase customer retention rates.  ➢ Resolved associate, tool and service delivery issues revealed by statistical reports.  ➢ Updated customer orders from start to finish in an accurate and timely manner.  ➢ Effective liaison between customers and internal departments.  ➢ Maintained accurate records of past due customer account activity.  ➢ Handling PAN India Customers.  ➢ Developed highly empathetic client relationships  ➢ Maintaining and providing quarterly review of data center standards and maintenance practices  ➢ Managing Datacenter and Manned & Unmanned POP's within Tamil Nadu & Kerala  ➢ Operating and monitoring the data center's critical facilities and functions in order to meet or exceed Service Level.  ➢ Hardware Management of the material lying at Pop's (T.N & Kerala) which are under my surveillance  ➢ Providing Daily & Monthly reports for Higher Level Management on all instances that occurred on all shifts.  ➢ Coordinating for new projects with concerned teams. && 2005. && Tikona Infinet Ltd (Formerly Known as HCL Infinet Ltd), Chennai    ➢ Monitoring & troubleshooting of customer's LAN & WAN Links with Incident Logging System to meet their SLA (99.5%)  ➢ Handling Network related issues in POP setup and customer collocated equipments.  ➢ Coordinating with different teams for the termination of WAN Links of Customer & Backbones  ➢ Coordinating & Troubleshooting with NOC team for solving the problems of the LAN & WAN Links of Customers  ➢ Coordinating & Troubleshooting with Service providers for solving the issues of Customers & Backbones Links  ➢ ISDN & PSTN: Trace the problem by analyzing the status of Network devices like NT/TA or router  ➢ Slow browsing issue: Analyze the cause for the issue with extended ping & trace routes from ➢ Customer router & route-servers for any backbone routing issues.  ➢ Slow Connectivity & packet drops: Analyze the issue by customer interface traffic. If traffic is not  ➢ Exceeding more than the limited Bandwidth will follow further steps by analyzing through extend  ➢ Ping & trace route. Resolve the issue by coordinating with NOCTECH.  ➢ Trace the customer Routing issues & get it resolve with the help of NOCTECH & Etc  ➢ Coordinating with different POP for client technical issues.  ➢ Doing necessary Cabling & wiring for new links commissioning in pop side.  ➢ Handling Technical Related Reports on Daily, Weekly & Monthly basis.  ➢ Handling Lease Lines and coordinating with concern team for link failures  ➢ Coordinating with Customer & get the status of network devices (Modems & Routers) & following with other service providers to make link up.  ➢ Handling backbone & trunks (DS3 Link) . Incase if any down time for these links will trace the problem & resolve the issue by coordinating with related service providers    CLIENTS HANDLED:  ➢ NSE  ➢ Honda Motors  ➢ RMP  ➢ Watanmal  ➢ Univercell mobiles  ➢ JK Fenner India Ltd  ➢ CAMEO Corporate Solutions  ➢ SPIC  ➢ KONE Elevators  ➢ MOBIUS  ➢ CONSIM  ➢ TVS Logistics  ➢ INDEV Logistics  ➢ Shriram Chits - Shriram Trade Finance; Shriram City","2015 to Present && June 2005 to Present && 2007 to 2014","Assistant Manager (Customer Support Operations & Datacenter) && Assistant Manager (Customer Support & Datacenter) && Senior Customer Engineer","Chennai, Tamil Nadu","Manonmaniam Sundranar University Tirunelveli, Tamil Nadu","May 2000 to June 2004","BE in Electronics and communication","11 years of experience in managing Customer Support Operations & Datacenters. Having good knowledge and experience in server building and troubleshooting issues in different environments."
"28","Additional Information Summary:  1. Energetic hands-on engineering professional with extensive 12 years’ experience. 8.6 years’ in design (Sheet metal & Composites) & 3.6 years of experience in Composite Materials & Processes  2. Involved in composite material qualification per ASTM standards  3. Conceptual designer, highly involved in New Product Development and all aspects of structural design with proven ability to complete projects in time  4. Knowledge of DFMEA, A3 Thinking and Six Sigma tool  5. Excellent communicator, actively involved in coordination of Cross functional Team interactions, project strategy & implementation  6. Managing multiple projects at the same time and maintaining project schedule deadlines by ensuring frequent communication with customers and vendors  7. Providing technical support to subordinates and quality checking their tasks before release  8. Supporting & managing Junior Engineers & team members in performing their tasks  9. Enrolling the team members to meet project schedules, initiate weekly coordination meetings and provide weekly updates to the higher management thus facilitating accordance within the team","CATIA V5/V6, ENOVIA & AUTOCAD, Skilled in MS Office (10+ years)","Textron India Private Limited - Bangalore, Karnataka && National Aerospace Laboratories - Bangalore, Karnataka","I joined this company as an Engineer in the Design team and grew to becoming a Technical Specialist in the same team with experience of working on multiple challenging projects in both metals and composite airplanes. I was then given an opportunity to work in Materials and Processes for Composite Materials which I still support.     Accomplishments include. Leading Edge Award for the Quality of delivery, Spot achievers award in Materials and Process department. Been a participant for Innovation award for two consecutive years 2010-11 and 2011-12. && As a junior engineer, I worked for the Structural Design team at C-CADD, NAL. I was involved in designing frames and bulkheads in the non pressurized region of the aircraft, forward of the front pressure bulkhead.","July 2008 to Present && December 2006 to June 2008","Technical Specialist && Junior Engineer","Bangalore, Karnataka","M S Ramaiah Institute of Technology Bangalore, Karnataka && PES Polytechnic Bangalore, Karnataka","September 2000 to June 2004 && April 1997 to June 2000","BE in Industrial Engineering and Management && Diploma In Mechanical Engineering in Mechanical Engineering","None"
"32","Additional Information Technical Knowledge  ♦ Management ♦ Computer Networking    • Networking knowledge  • Project Management  • Project Coordinator  • Good knowledge of RF instruments  • Java  • C, C++  • HTML and CSS  • Cisco router configuration and networking  • Data packet capture and analysis using Wireshark  • Virtual machines, Windows, Linux, and Mac OS  • MS Office and internet applications    Major achievements:  • Member of core team in Campaigning department in Projections14 at Parul Institute of  engineering and technology  • Won first prize in photography contest in Dhoom15 at Parul Institute of engineering and  technology","wireless networking (Less than 1 year), rf instruments (Less than 1 year)","E-Tech","Has worked for SEO too and know the working operations for an SEO specialist    Project Summary:  • Developed hybrid mobile app (Medlab) which can work on all operating system and this  technology is known as Phonegap as B. Tech final year project  • Developed web application (E-school management System) on ASP.NET as last year Diploma  project    Additional Skill & Qualities:  • Management Skills  • Leadership Qualities  • Sales Knowledge  • Customer Service    Communication Ability:","February 2016 to Present","Sales and Technical Support","Vadodara, Gujarat","Gujarat Technological University and secured overall && Gujarat Technological University Vadodara, Gujarat","None && None","Bachelors of Engineering in Computer science && Diploma in Computer Engineering","• Done Computer science and engineering from Parul Institute of engineering and technology  with 7.67CGPA (India)  • Done 3 years of certified diploma in computer engineering as well  • 1 year of working experience with E-Tech which is a knowledge process outsourcing firm  and their biggest client is Verizon  • Worked for Verizon for home phone, TV and Internet services  • Knowledge of SEO (Search engine optimizing) and have also worked for it"
