"CandidateID","Additional-Info","Skills","Work-Experience__Company","Work-Experience__Job-Description","Work-Experience__Job-Duration","Work-Experience__Job Title","Location","Education__Institute","Education__School-Duration","Education__Qualification","Resume-Summary"
"37","None","windows 7, windows 10, office365 (8 years)","Here India Solutions Pvt. Ltd - Airoli, Maharashtra && Vendor Management - Mumbai, Maharashtra && Ugam Solutions Pvt. Ltd && Ugam Solutions Pvt. Ltd - Thane, Maharashtra && Beltronics Consultancy && Beltronics Consultancy - Goregaon, Maharashtra && Alphabetics Computer Service Pvt. Ltd && None","Job Responsibilities:  • Responsible for providing second-level and third-level end-user technical support including  advanced software installation, documentation and special projects as part of the technical  support team.  • Completing assigned hardware related installation and problem tickets and documents ticket  status and resolutions.  • Completing assigned software related installation and problem tickets and documents ticket  status and resolutions.  • Documentation for end-user, installation and other technical procedures.  • Participating in research, testing of new technologies or issues and other special projects.  • Assisting in technical training of staff.  • Incident management: Reviewing remedy tickets workflow of L1 and L2 technicians and resolution within define SLA.  • Vendor Management, Procurement per business requirement inline with budgetary amount.    Technical Skill:  • Installation and troubleshooting of Wintel systems.  • Troubleshooting on in-house applications.  • Office365, Skype for Business installation and troubleshooting  • Hardware troubleshooting for Dell systems i.e. Laptop and workstations, Konica Printers,  • Epson, Dell, View sonic, NEC projectors (LAN) installations and troubleshooting. && 2. Perkins Eastman Design Consultant Pvt. Ltd. January 2013 to May 2016  Job Responsibilities:  • Single point of contact and Overall IT support to the Mumbai (India) office location (overseeing  consultants in Dubai and Shanghai as well), while collaborating with support, systems,  applications and network specialists throughout the firm on technology project design and implementation.  • Committed to enforcing all IT policies, including helpdesk procedures.  • Responsible to respond quickly to emergency support situations.    • Troubleshooting of Microsoft Office 365 outlook  • Excellent problem solving skills including use of remote management systems.  • Vendor Management in terms of ISP, EPABX, PRI phone, Printer AMC, Dell, Lenovo, HP desktop and laptop  • Standard configuration of mobile device and travelling laptop  • Seating rearrangement, new hire setup, network account/security management.  • Server backup and patch management.    Accomplishment:  • Migration of old printers with new Xerox work Center in economic cost and best valuable  service.  • Successfully implementation of Windows 7 image build project to all locations (Mumbai, Dubai and Shanghai) before deadline  • Smoothly organized the project planning and implementation of IT infrastructure setup for  Mumbai office relocation  • Active Participation in other office activities (helping to the Staff for Non-IT work in their  Design competitions)    Technical Skill:  • Server/Workstation installation and troubleshooting (Windows Server 2012/R2, Windows 7/8)  • Active Directory User/Group creation/deletion, cleanup of inactive objects, group policy  implementation  • Virtual Technology (VMWare)  • Mobile Technology (smartphones, laptops, tablet/iPad, etc.)  • Telephony (Desktop & Conference Room Analog, Digital, VoIP systems and solutions)  • Collaboration Tools (File Exchange/Sharing, DFS etc.)  • Business Applications (MS Office, Adobe Creative Suite, etc.)  • AEC applications (AutoCAD, Revit, 3ds Max, Rhino, Sketchup, Newforma-Data Transmission  tool, Adobe CC Packs etc.)  • Microsoft Office 2010 & office 365 end user installation and troubleshooting  • Canon & Xerox business printer troubleshooting  • Wireless printer & projectors troubleshooting & support  • Troubleshooting of branded HP, Dell, Lenovo Desktop, notebooks, tablet book. HP, DELL  Servers  • Setup and configuration of WebEx user account, Meeting setup and technical support for  Conference meeting. && Job Responsibilities:  • Managing Service Desk & Desktop Supports Team (15 members) across 3 Locations through  Remote Support.  • Maintaining License Inventory of various Types of Application & Hardware. (Asset mgmt.)  • Service Desk Monitoring & Special Attendance on Escalation Calls / reports, maintaining IT  Service as per the company's business policies. (ISO Standard)  • Vendor Management i.e. Hardware Warranty, Purchase of new H/W & S/W.  • Managing Engineer's Shift Schedule, recruitment.  • Responsibility to Handle Sr. Mgmt. & Critical Operational Dept. Service calls.  • Managing Network & Data security process,  • Monitoring Daily Checklist of Printers, Video conference & Projectors.    Accomplishment:  • Achieved Internal team award for new Dell desktop deployment for all desired users.  • Active participation of project planning and implementation of IT infrastructure setup for  Mahalaxmi office movement to Thane.  • Great Team player role for pre audit of ISO certificate renew program.    Technical Skill:  • Windows XP and Windows 7 Desktop Operating Systems, MS office 2007 & 2010  • Win 2003 & 2008 server installation & Exchange Server and Active Directory in an enterprise  Environment user and group creation  • Experience supporting remote, home and users.  • Basic knowledge of Cisco Telecoms platform.  • Polycom Audio conferencing applications with experience setting up and troubleshooting.  audio/video calls and presentations  • Installation & Troubleshooting of Business Applications (Client recommended SPSS, Client VPN)  • Maintain license application records sheet.  • Installation & Troubleshooting of Branded Desktops, Laptops, Printers, Scanner HP, Dell, IBM  • Configuration & troubleshooting of Trend Micro Officescan Servers, Clients. Scanning of virus  infected machines & there reports, policies & scan Methods.  • Managing Internet access & Monitoring user's usage, Web-content service. (Cyberoam)  • Support US & other International users through Remote desktop tools (Goverlan)  • Handling the User access management: User creation, modification & deactivation, Email id  creation on exchange server. BES admin, IPhone, Android Active Sync, Email group, user  permission, configuration of some group policies.  • Managing USB, external storage device access control server. && Goregaon.  Managed Role of IT site Incharge for desktop and network support, lead the 3 level 1  engineers. && 5. Alphabetics Computer Service Pvt. Ltd. July 2004 - April 2005.  Worked as a Customer Support Engineer, handled desktop level 1 tickets also worked on  NetBackup for File server, Exchange Server etc.    Highlighted Key Skills:  Team Management:  • Positively leading the team to support the global IT Operations by performing day to day  monitoring & operation of business systems +1500 nationwide nodes, liaising with local service  line & assisting with problem diagnosis and resolution.  • Assigning KRA, monitoring overall performance, mentoring/sharing new trick and technology within Team. Engineer Shift Schedule, Appraisal, escalations and capacity to handle 15-20 size of level 1 and level 2 engineers.    IT Service Management:  • Providing metric reports to upper management regarding helpdesk stats. Maintaining the documentation /procedure to fix known error.  • Deliver IT Services Management (ITSM) solutions based on ITIL best practices that focused on the people, process, and technology, and information perspectives of providing business solutions within the IT infrastructure. This includes all aspects of ITIL best practices and methods from design, planning, implementation, and support.  • Communicate within internal and external team and sending Alerts and Announcements in case of Major IT failure, important notifications or any maintenance activities with proper ETR.  • Centralizing IT asset inventory, asset tagging, updating availability and capacity catalog.  ISO Procedure:  • Adhering the security policies as per ISMF, Participating in DR test, BCP within organization.  • Analyzing and reporting the illegal activities, data security issues, virus infection issues working  closely and covertly with ISO team.  • Following up the Approval metrics as per given by ISMF in terms of new software, 3rd party  application, right and permission as per the business requirement and analyzing the risk factor and provide some alternate solution with the authority of ISO.    Vendor Management:  • Improved Vendor management skill in terms of new hardware/software procurement, licensing,  upgradation of maintenance service/ contract, ISP, PRI related issues, invoice negotiation to match the economic price as per IT budget.  • Coordination with DELL, HP, Lenovo vendor for hardware failure issue, following up with them for solution and parts replacement against system warranty.    IT Audit and Finance budget:  • Reviewing all IT records with CMDB and reports, if needed doing physical checkup.  • Liquidation of outdated systems.  • Adherence of Security policy and Data loss prevention task to successfully complete the ISO  certification and IT compliance audit.  • Collecting the information from customers and finalizing the data for the budget of new  requirement with the confirmation of higher authority.    Date Abhijit Sudhakar Kulkarni.  (Signature) && None && None && None","August 2016 to January 2017 && January 2013 to May 2016 && January 2013 to May 2016 && December 2008 to December 2012 && December 2008 to December 2012 && May 2005 to November 2008 && May 2005 to November 2008 && July 2004 to April 2005","Technical Support Specialist && Perkins Eastman Architect && Single point of contact and Overall IT support to the Mumbai && Sr. Desktop Administrator && Asset mgmt && Sr. F.M. Engineer && Senior Facility Management Engineer && Customer Support Engineer","Navghar, MAHARASHTRA, 401105, IN","TÜV SÜD Akademie GmbH","2012","Certification in Foundation","None"
"41","None","technical support,Operations Manager,Team Lead,Tech Support, Troubleshooting,Tech Sales,Manager,International BPO,Team Management,Team Handling, Business Development, E-commerce (9 years)","Eyetech Pvt Ltd - Noida, Uttar Pradesh && Pandaje Group - Noida, Uttar Pradesh && Intuites Infohub pvt ltd - Noida, Uttar Pradesh && IYOGI Technical Services Pvt. Ltd - Gurgaon, Haryana && Lime Spot Technologies - Noida, Uttar Pradesh && Unisys Global Services India - Bangalore, Karnataka && AGEIS - Bangalore, Karnataka","ROLES AND RESPONSIBILITY:  Taking care of the complete Tech Support center individually, handling team leader's, teams (Technical/ Sales/Customer service Support) providing action plan, monitoring overall performance of services, building service reports. && JOB DESCRIPTION:  PandaJe Tech is a global next-generation computer support service provider and since its inception in 2008, the company is showing high growth in this area. With time, the company has cut through the ranks and has today emerged a center of trust for customers across US.    ROLES AND RESPONSIBILITY:  • Responsible for team's performance on operational metrics.  • Define overall monthly target for Sales (Inbound/Outbound) &Tech Support Team  • Monitor team performance & motivate team to achieve their targets  • Share program updates, concern areas with solutions  • Drive overall project KPI  • Train resources - need based  • Ensure Adherence to reporting timelines both by TL's, TSE  • Ensure all hygiene factors are achieved & maintained  • Proactively sense any future attrition & plan accordingly  • Ensures team is meeting/ surpassing the Targets and Review the performance with the Director /Vertical Head (VH)  • Effectively manage entire shift operations individually. && JOB DESCRIPTION:  Intuites is a leading software development and consulting firm based in New Jersey (USA), techniday is other arm as a DBA of INTUITES dealing in providing Technical Support services to its overseas clients across US/Canada, targeting home and small business users.. Services include Desktop/Laptop related issues, antivirus support, printer, MAC support, data recovery and even more.    ROLES AND RESPONSIBILITY:  Proficient in managing the projects individually for multiple customers, service delivery, technology support and technical troubleshooting under Windows/MAC based platforms and applications. Assignments included Business Development Strategy, Team Management (sales team)    ➢ Keeping the motivation level high within the team.  ➢ Ensuring a healthy and positive work environment  ➢ Participate actively in the appraisal process for team members  ➢ Perform quality checks of team's output to ensure high standard of Quality && PERIOD: November 2009 to September 2012  JOB DESCRIPTION:  IYOGI is a leading organization based in Gurgaon, dealing in rendering Technical and customer support services to its overseas clients; Designated as Technical Specialist the job profile is of rendering the technical support services to the overseas customer for the hardware and software issues.  ROLES AND RESPONSIBILITY:  ➢ Acted as a team member for the Live Escalation team (similar to L3) worked on Escalated technical issues of L1 and L2 teams.  ➢ Also acted as senior tech sales member, subscribe customer to the paid support. && PERIOD: September 2008 to September 2009    ROLES AND RESPONSIBILITY:  ➢ Direct User Support for Lime Exchange & Lime Domains (E-Commerce): Email, chat support and also providing telephonic assistance to get projects from the buyers.  ➢ Product Support: Monitor, report, escalate any product, production issues impacting users, writing blogs and giving new offers to the existing and new customers on daily bases. && ROLES AND RESPONSIBILITY:  ➢ Resolving Engineers queries through emails, after verifying with EMC helpdesk  ➢ Assigning calls, PMO Reports, CSAT Survey  ➢ Good excel skills worked on Vlookup formulas, Pivot tables and charts. && ROLES AND RESPONSIBILITY:  ➢ Provides Customer Care Services for Western Union Money Transfer Worldwide","July 2015 to Present && July 2014 to July 2015 && September 2012 to July 2014 && November 2009 to September 2012 && September 2008 to September 2009 && September 2005 to October 2007 && September 2004 to August 2005","Operations Manager (Sales/Support) && Operations Manager (Sales/Support) && Team Lead (Sales/Support) && Technical Specialist (Tech Sales/Tech Support) && Product Support Specialist (Business Development) && Service Support Representative && Customer Care Officer","New Delhi, Delhi","City College Mysore, Karnataka","2003","BCA in Bank","To seek a career in the area of IT enabled services applying my professional experience, training and educational background."
"42","Additional Information Skill Set    Team Skills: Effectively motivate team members and a good coordinator.    Analytical/Research Skills: Ability to assess a situation, seek multiple perspectives, gather  more information if necessary, and identify key issues that need to be addressed.    Communication Skills: Active listener, Quick learner with effective presentation and  writing skills.    Computer Skills: Proficient with computer basics. Perfectness in Microsoft Excel.    Time Management Skills: Capable of identifying and prioritizing the tasks, allocating time  and doing the tasks on time.  Job Roles and Responsibilities  • To collect all the invoice and expense forms.  • Checking and verifying all the documents related to work for accuracy.  • Carrying out other duties assigned from time to time.","Quality Control (1 year)","Vodafone Process in Vertex Customer","solution Pvt.  Ltd. (7 Months)  • ""Quality Head and Marketing Supporter"" in Kailas-Ganga Polymer Pvt. Ltd.  (9 Months)  • ""Quality Specialists"" for Vodafone Process in TATA Business Support Service  Limited. (1 Year)    Rewards  Won RNR For Vodafone Process in Vertex Customer Solution Pvt. Ltd.  Achieve RNR for Quality Process in Kailas-Ganga Polymer Pvt. Ltd.","None","Bussiness Associate","Pune, Maharashtra","Aurangabad University Aurangabad, Maharashtra","2016","B.Sc. in Computer","To Work in a challenging position with a well-established organization that will lead to a  lasting relationship in the field of computer."
"45","None","Firewall (8 years), ASA Checkpoint , Paloalto, fortinet (8 years), Proxy , Bluecoat Web sense Web filtering, Web sense V10K Zscaler Cloud Proxy (7 years), • Firewall Manager: - Forti Manager, Cisco CSM, Forit Analyser , Checkpoint provider (5 years), F5 (4 years), • Monitoring Tool: - Syslog server, Solar winds, Manage Engine, SIEM tool (NFX), Firemon (6 years)","BT Global Services - Gurgaon, Haryana","The post holder will have ownership of technical elements of the RBS Security Management Platform, including but not limited to detailed design, installation, monitoring and alerting, support, maintenance, and upgrades and patching. This will include the support of new and existing products that come under the responsibility of the team.    • Technical Impact Analyse (TiA) for all change so that impact will less.   • Provide go ahead for TCR (Task change request) after Technical Impact Analyse.  • Provide Support to OPS during Policy push/change requirement basis.  • To meet agreed SLA's and develop additional SLA's where required, in relation to Incident and Firewall Management and proactive and reactive reporting.  • Allocate and work on complex incidents, problems and changes within the Operational environment.  • Provide customer technical advisory services in support of new BT Security Service. Working with the customer and account teams in the technical data requirements capture phase.  • Consult with and provide direction for Project and delivery managers to bring into service security solutions. Ensuring they meet the criteria for ongoing support by BT Security  • Produce and support polices and function configuration builds on the RBS Platform.  • Carry out Security Solutions Technical Consultancy in support of customer project work and the RBS platform.  • Interacting with global client to gather their requirement and provide them a solution as per design process.  • Installation and implementation of new Hardware related to Firewall/Proxy.  • After configuring the devices working closely with SOC team to handover the device to Support.  • Closely working with vendors & Cross Towers in case of Escalations.  • Follow a very well defined change management process.  • Client Interactions on daily basis.  • Incident Management: Handling tickets logged by users for issues with their Network, regarding Network security issues and providing solution for the same.","None","security specialist","Gurgaon, Haryana","SMU Gurgaon, Haryana","None","MBA in Operation","None"
"47","Additional Information COMPUTER SKILLS    • OPERATING SYSTEMS: Windows 7, Windows Vista, Proficient with MS office","Marketing and Application Specialist, Product Specialist, Product & Training Manager, Computer Tomography (CT) , Positron Emission Tomography (PET-CT), Interventional Radiology & Oncology, Brand Manager ,Technical Support, Product Launch","Perfint Healthcare Pvt. Ltd, Chennai, Tamil Nadu - Delhi, Delhi && Biomedical Division - New Delhi, Delhi && Medical Point (India) Ltd. (Hospimedica Group) - New Delhi, Delhi","• Application training during robotic guided interventional procedures in CT / PET-CT environment  • Execute clinical trials and work with doctors towards research papers  • Conduct regular educational sessions at customer site to upgrade customers with new updates   • Serves as a technical advisor to physicians, medical personnel, engineers, administrators, and support staff on proper operation of equipment, planning of new systems, and modification of existing equipment to meet clinical needs  • Assesses customer skill and conducts regular training sessions at the customer site to improve utilization and regularly update them with the latest developments in terms of applications and clinical indications.  • Providing product training to the sales team and working closely with the them to achieve the assigned targets  • Conduct pre and post sales demonstration, presentation and clinical/technical discussions.  • Sales and Product training to the sales & marketing team of the overseas/In land dealers & associates   • Conduct market research, develop key marketing tools, organize marketing campaigns  • Planning and implement the launch program of new products and manage the cross-functional implementation of the same.  • Work with the marketing teams of the customers/dealers for clinical/technical discussion and business development.   • Installation of the robotic guidance device while working together with the service engineer  • Acts as the first line support for repair and technical support issues  • Support to current client base by providing quick and efficient solutions on any requests / needs / queries including parallel working with them on clinical researches and maintaining regular visits.  • Provide regular on-site guidance and support to the doctors and explaining the surgeon/ OT Staff / BMEs about Technical aspects, Installations, Operation and Sterilization of the equipment.  • Research work at current client base towards the development of new products && • Supervising the preparation of tenders and requests for proposal  • Providing the technical support and training  • Preparation and regular update of the technical specifications  • Product branding and implementing launch strategy for the products   • Participation in industry specific conferences and seminars  • Liaison with the foreign principles/suppliers and Dealer / Vendor Management  • Manage the business communication and technical support with foreign principals and dealers  • Devise promotional strategies and managing the advertising & marketing part  • Establishment and maintenance of all the product documentation for promotion  • Designing and development of various sales support materials such as brochures, POS material, business mailers and print inputs for advertising etc.  • Manage private label / Joint branded labels products for key OEMs  • Manage relationships across departments and partners to ensure seamless functioning  • Development of promotional and scientific data to support the sales & Marketing staff  • Monitoring of the regular up gradation of the website and the product profile as well && • Provide applications support & product training to the sales and marketing team  • Development and compiling promotional and scientific data  • Preparation and regular update of the technical specifications  • Managing the Tender & Requests for proposal work and keep track of their status  • Devising product launch campaign and promotional schemes for products  • Preparation of the technical comparatives  • Develop, arrange and update training material and training of the sales team at regular intervals  • Creating and maintaining all product training & promotional documentation  • Work with the service team to confirm the satisfactory working of product prior to installation  • Regular up gradation of the website with updated product information  • Keep track of the training schedules and work towards the effective execution of the same.  • Work with regional offices on sharing prospects and client contact systems.  • Organizing and co-coordinating for the exhibitions and CMEs.  • Participation in trade shows, fellowships, conferences, exhibits and other marketing activities.  • Ensure that product orders are fulfilled in a timely and cost-effective manner, and update customers on their status.","June 2011 to September 2014 && September 2010 to February 2011 && February 2007 to July 2010","Application Specialist && Dy. Manager && Product Support Engineer","Delhi, Delhi","IGNOU Delhi, Delhi && NIOS Delhi, Delhi && NIIT && Kasturba Polytechnic for Women, Board of Technical Education Delhi, Delhi","2012 to 2015 && 2012 && 2010 to 2010 && 2006","B.Sc in Life Science && Class XII in Biology, Maths, Chemistry, English, Computers && Diploma (3 Years Full time) in Electronics ( Specialise in Digital and MIcroprocessor based systems ) && None","With an experience of more than 9 years, I was involved in Application Support, Marketing and Clinical support, Training, Pre and post sales support, Service support, Tender management, Operations management"
