"CandidateID","Additional-Info","Skills","Work-Experience__Company","Work-Experience__Job-Description","Work-Experience__Job-Duration","Work-Experience__Job Title","Location","Education__Institute","Education__School-Duration","Education__Qualification","Resume-Summary"
"3","None","* Sales & Service operations management * Leadership & mentoring * Team- management * Customer Service * Process improvement * Cross functional coordination * Quality adherence * Process knowledge expertise * Soft-skills & Behavioural trainer * Content development * Strong interpersonal &communication skills","Yes Bank Ltd && Citibank N.A && Citibank N.A && Convergys India Services","Responsible for development and maintenance of a customer-focused culture through Quality assurance of Phone banking & E-mail channel.  * le &Duties  * Preparing monthly targets as per Quality Process note guidelines.  * Monitoring & managing performance of the team.  * Sharing Quality feedback with Operations manager on Unit's performance.  * Preparing MIS for publishing Unit's (Phone banking & e-mail) Quality Scores & Errors.  * Evaluating and conducting RCAs for complaints received at Grievance Redressal desk.  * Maintaining data for analytical purposes.  * Conducting calibrations between Team leaders, Managers & Evaluators for uniformity in understanding of Quality parameters.  * Ensuring critical failures do not breach the threshold as per bank's guidelines.  * Sharing identified gaps in process & procedures to Training team for training of operations team.  * Coordinating with various units for ORM reporting.  * Conducting Quality & Process notes training with New hires.  * Remote-handling for setting up of Quality framework of other LOB's (Credit cards, Digital banking & Inclusive social banking.)    Process notes designed:    * Escalation handling at Phone banking.  * Promised call back  * Line disconnect    Programs developed & conducted:    * Service First - Basics of telephone etiquettes & communicate effectively  * Raise the bar - Handling difficult customers & power of perception && As a Team leader contributed in shaping and taking forward objectives of the organization by meeting monthly Sales & Service targets.    * Ensuring that service delivery standards are maintained.  * Promoting & maintaining awareness and compliance of Information Security in accordance with best practice.  * Leading & developing the team in all aspects of excellent customer service.  * Training, coaching & mentoring junior staff as required.  * Managing all performance and governance activities.  * Monitoring weekly performance against targets.  * Establishing and maintaining Roles and Responsibilities for the officers in the team.  * Delivering regular team communications and organizing monthly meetings.  * Ensuring high RSAT for team members and constant improvement in the NPS.  * Ensuring timely update of Payroll inputs for the Officers.  * Nominating officers for the Client Excellence award on a Monthly/Quarterly basis. && * Making outbound calls for convincing customers on Loan on Phone (LOP) product.  * Making daily MIS.  * Achieving monthly Sales targets. && * Solving billing queries for AT & T process  * Cross selling Local Toll and Long distance services    Training/Workshops attended:    * Planning & Time Management  * Addictive Customer Experience  * Exceed Customer Expectations  * Coaching for Results  * First Time Managers","December 2014 to Present && April 2012 to July 2014 && October 2006 to April 2012 && March 2003 to January 2004","Operations Service Delivery Manager (Quality) && Assistant manager && Senior Customer Care Officer (LOP Specialist) && Customer Care Associate","Gurgaon, Haryana","Delhi University Delhi, Delhi && Mount Carmel School New Delhi, Delhi && Sikkim Manipal University && Polytechnic for Women","2002 && 1999 && None && None","B.Com in Pass && M.B.A && Diploma in Information Technology && None","* A result oriented professional with over 10 years of experience in the field of Customer service with leading organizations.  * An exemplary communicator with rich expertise in client interaction for both Sales & Service fields.  * Detailed knowledge of Quality guidelines for voice processes.  * Successfully developed and led a team of 20 people.  * Expert in Data Analysis & MIS generation.  * Hands on experience in developing Process notes & Content development.  * Proven skills in writing scripts & e-mail templates.  * Expertise in training of Soft -skills & overall grooming.  * Demonstrated abilities to motivate & mentor the team by handling customer complaints and teach them by Show and Tell methodology."
"12","None","Microsoft office and well known basic system knowledge (1 year)","RSL infotech - Krishnagiri, Tamil Nadu","Data Entry Field:  I am Worked to Data Entry Field in One Year then my Designation is Data Entry Operator and Quality Checking    Finance Field:  Now, I am Working in Finance field 8 month onwards my Designation is Wealth Manager means System Work and Field Work","February 2015 to March 2016","Data Entry Operator","Krishnagiri, Tamil Nadu","Sona College of Tech Salem, Tamil Nadu && Sri vidya mandhir Arts & Science College Erode, Tamil Nadu && Muthamiz Govt.Hr.Sec.School && Muthamiz Govt.Hr.Sec.School","2015 && 2012 && 2009 && 2007","MCA && BCA && H.S.C in Arasampatti && S.S.L.C in Arasampatti","To accelerate my pace towards the growth of the organization by riding on my strength and to make innovations with my talented skills."
"29","Additional Information PERSONAL SKILLS  • Comprehensive problem solving abilities.  • Excellent verbal and written communication skills.  • Good Team leadership ability.  • Ability to deal with situations diplomatically and professionally.  • Willingness to learn, work as a team and as well as individual and work hard.","Data Analysis (5 years), Kapow Software (5 years), .NET (Less than 1 year), Research (5 years), Quality Assurance (5 years), Documentation (5 years)","None","Working Sr. Data Acquisition Specialist at Software Incubator Pvt.Ltd for last 4.8 Years (since May 2012) as Technical Team Manager.     Experience in Robotic Process Automation (RPA) using kapow software.  Experience in Research, Identification and Quality Analysing process.  Good knowledge in MY SQL, Database structures, Data Base Management and Data Quality.    Experience in managing team and task analyse.  Have excellent knowledge in Website research with various website structures.    Created a kapow supporting forum (http://kapow.forumsmotions.com) and active member.    Worked as .Net Programmer Trainee at Firm CodeWare solutions LLP (Dec 2011 to March 2012)","May 2012 to Present","Sr. Data Acquisition Specialist","Malappuram, Kerala","Sree Amman Arts and Science College Erode, Tamil Nadu && Bharathiar University Coimbatore, Tamil Nadu && Maharaja Arts and Science College Coimbatore, Tamil Nadu && Sree Vivekananda Higher Secondary School Malappuram, Kerala","2009 to 2012 && 2006 to 2009 && 2004 to 2006 && 2004","Master in Computer Applications && Bachelor in Computer Applications && Higher Secondary Education && Certificate in Higher Secondary Education","None"
"30","None","Mscit (9 years)","Limeroad.com && Deals N You Pvt. Ltd && Fashion N You Pvt. Ltd && Fashion N You Pvt. Ltd - Mumbai, Maharashtra && DHL Express India Pvt Ltd","Reporting to: Quality Manager  Key Responsibilities:  * Maintaining and controlling the quality of products.  * Auditing each and every single unit of products for maintaining quality standard.  * Coordinating with management and supplier for audit time.  * Keeping data base of all auditing products.  * Create awareness of quality amongst the corporate suppliers and other individual customers.  * To manage good relationship with the corporate suppliers.  * Management reporting and planning.  * Assisting dispatch department for dispatching products.  * Arranging dispatch of products as per given instruction.  * Apart from original packing of product maintaining additional packing in such a way that products have additional safely and it does not get damage during transit.  * Follow up on all dispatched item until it's delivered to customer. && Reporting to: Quality Control Manager  Key Responsibilities:  * Maintaining and controlling the quality of products.  * Auditing each and every single unit of products for maintaining quality standard.  * Coordinating with management and supplier for audit time.  * Keeping data base of all auditing products.  * Create awareness of quality amongst the corporate suppliers and other individual customers.  * To manage good relationship with the corporate suppliers.  * Management reporting and planning.  * Assisting dispatch department for dispatching products.  * Arranging dispatch of products as per given instruction.  * Apart from original packing of product maintaining additional packing in such a way that products have additional safely and it does not get damage during transit.  * Checking all products details before dispatch like IMEI no, model no and other accessory details.  * Coordinating with management and courier companies for dispatch time.  * Keeping dispatch details of all dispatched products like mode of transport and courier tracking details.  * Keeping data base of all dispatched products along with customer's necessary details like delivery address and telephone no.  * Follow up on all dispatched item until it's delivered to customer.  * Keeping records of all comments of customer after delivery report received.  * Management reporting and planning. && Reporting to: Quality Control Manager    Key Responsibilities:  * Maintaining and controlling the quality of products.  * Auditing each and every single unit of products for maintaining quality standard.  * Coordinating with management and supplier for audit time.  * Keeping data base of all auditing products.  * Create awareness of quality amongst the corporate suppliers and other individual customers.  * To manage good relationship with the corporate suppliers.  * Management reporting and planning.  * Assisting dispatch department for dispatching products.  * Arranging dispatch of products as per given instruction.  * Apart from original packing of product maintaining additional packing in such a way that products have additional safely and it does not get damage during transit.  * Checking all products details before dispatch like IMEI no, model no and other accessory details.  * Coordinating with management and courier companies for dispatch time.  * Keeping dispatch details of all dispatched products like mode of transport and courier tracking details.  * Keeping data base of all dispatched products along with customer's necessary details like delivery address and telephone no.  * Follow up on all dispatched item until it's delivered to customer.  * Keeping records of all comments of customer after delivery report received.  * Management reporting and planning. && Mumbai  Reporting to: SCM Manager    Key Responsibilities:  * Arranging dispatch of products as per given instruction.  * Apart from original packing of product maintaining additional packing in such a way that products have additional safely and it does not get damage during transit.  * Checking all products details before dispatch like IMEI no, model no and other accessory details.  * Coordinating with management and courier companies for dispatch time.  * Keeping dispatch details of all dispatched products like mode of transport and courier tracking details.  * Keeping data base of all dispatched products along with customer's necessary details like delivery address and telephone no.  * Follow up on all dispatched item until it's delivered to customer.  * Keeping records of all comments of customer after delivery report received.  * Management reporting and planning.  * To manage good relationship with the corporate suppliers. && Reporting to: Store Manager  Key Responsibilities:  * Business development for The DHL Store in India (DHL) global chain of retail business service, shipping and logistics.  * Marketing and branding for The DHL Store in India.  * Responsible for handling sales and also to give business proposals and presentations to corporate clients about the various products and services.  * To create awareness amongst the corporate clients and other individuals customers.  * To manage good relationship with existing key corporate customers.  * One point contact for customers about the products and services offered at the store.  * To tie up with hotels and other business houses.  * Management reporting and strategic planning.","April 2013 to Present && November 2011 to September 2012 && March 2011 to October 2011 && August 2010 to February 2011 && April 2007 to June 2010","Quality Auditor && Quality Auditor / Warehouse Executive && Quality Auditor / Warehouse Executive && Warehouse Executive (SCM) && Store Executive - Retail Store Operation (west)","Mumbai, Maharashtra","Mumbai university Mumbai, Maharashtra","None","B.com.","To Advance in life by hard work, expanding knowledge, by venturing into fields to be  A part of dedicated, goal oriented team."
"33","Additional Information Technical Skills  • CDMS worked on: Oracle Clinical, Clintrial, OCRDC, EDC systems worked - PICTS, Inform & MediData RAVE  • Programming Languages: Basic knowledge of SQL, PL/SQL & SAS  • Applications used: TOAD, SQL developer    Core Competencies  • Comprehensive knowledge of the procedures and clinical practice standards of Federal Drug Administration  • In-depth knowledge of the processes of clinical data management systems, clinical trial methodology, GCP and medical terminology  • Skilled in mentoring, coaching, training internal and external partners  • Outstanding communication and presentation skills  • Possess strong organizational and time management skills  • Ability to work under pressure and meet deadlines  • Possess strong organizational and time management skills  • Positive attitude, good interpersonal skills, ability to face and deal with issues in a mature and professional manner.","Data Management (10+ years), Data Management (10+ years), Oracle Clinical (10+ years), Electronic Data Capture (7 years), Inform ,RAVE platforms (5 years)","Quintiles IMS India Pvt Ltd - Bangalore, Karnataka","Serve as data management project manager, as a project manager involved in study start-up activities such as designing and testing of the database, conduct phase activities and study close out activities.  • Serve as primary point of contact for customer on data management deliverables  With minimal guidance, provide project management expertise working with customer data managers, key decision makers, and internal team members to manage continuous process improvements, issue escalation, workload projections, and provide technical expertise with guidance, provide input for and perform direct negotiations with customer, e.g., timelines, financial, process, resources, maintain strong customer relationships.  • Ensure open communications with customer and Quintiles management to manage and meet contractual obligations.  • Meet with Data Operations Coordinator (DOC) and/or Data Operations team members on a regular basis to ensure milestones meet timelines and quality deliverables, establish strong communications with Data Operations team, functional leads, project managers and all other stake holders.  • With minimal guidance, support DM service delivery with comprehensive DM process and technical expertise in executing projects.  • Serve as the escalation point for unresolved data issues; with guidance, work with client data managers, vendors, and internal team members for resolution.  • Work with functional manager(s) to ensure appropriate resources are assigned to meet project deliverables.  • With guidance, create and/or review and sign-off on all data management plan (DMP) documents.  • Implement proactive quality management plan. Identify any service and quality issues with agreed upon specifications per the DMP and contract/SOW and work with functional manager(s) to resolve.  • With guidance, track service performance and provide leadership to identify root causes of issues and implement remedial action.  • Continuously look for opportunities to improve efficiency of tasks and quality of deliverables.  • Identify compliance issues and work with functional manager(s) to ensure timely follow-up and resolution.  • With guidance, maintain internal tracking databases and systems financial Management/Business Development Support.  • With guidance, ensure service and quality meet agreed upon timelines and deliverables in contract/Scope of Work (SOW).  • Manage SOW/budget - Review financial reports on a monthly basis and participate in project reviews as requested - Identify out of scope tasks and track change orders to completion.  • With guidance, may serve as Project Manager for single service DM projects, including financial tracking, revenue recognition, and invoicing.  • With guidance, participate in and support RFP process (review RFP documents, pricing, attend bid defense).  • Supervise and manage an assigned team of project delivery associates who manage or support studies to ensure quality, time and budget deliverables are met.","December 2005 to Present","Associate Manager & Data Team Lead","Bangalore, Karnataka","Bangalore University Bangalore, Karnataka && Bangalore University Bangalore, Karnataka","2003 to 2005 && 2000 to 2003","Master of Science in Microbiology && Bachelor of Science in Microbiology","• 11.1 years of work experience in Clinical Data Management  • Currently serving as Data Team Lead in global studies and also as an Associate Manager in Clinical Data Management.  • Possess the ability to adapt to any situation and work well with others through effective communication and interpersonal skills  • Experienced with data management tools, processes and therapeutic areas  • Responsible for leading the DM team and for timely delivery of the Data Management deliverables  • Current responsibilities include timely delivery of quality databases that meet customer requirements, managing projects, resource planning & utilization, monitoring of all project deliverables, attending teleconferences, problem solving mentoring and training  • Experience in working in Phase I, II, IIIa & IIIb, IV and Observational studies  • Experience in working on external data such as Lab, ECG, IVRS, Safety data reconciliation  • Have a vast experience over a plethora of therapeutic areas from the project start up to the database release (lock).Worked on various therapeutic areas - Oncology, Neuroscience, Endocrine, Cardiovascular and immunology  • Quality control and basic Project Management in clinical research (FDA) regulations/GCP/basic cGMP)  • Exposure to Project Management in CDM starting from Implementation and Project Execution till successful delivery of Project.  • Supervise and manage an assigned team of project delivery associates who manage or support studies to ensure quality, time and budget deliverables are met."
"36","Additional Information Core Competencies  • ISO requirements  • Internal and external audits  • Lab equipment  • QC tools techniques and practices  • Quality Standards    • G8D, WHY WHY, Problem Solving  • Creation of 3D models  • Scoping & Documentation  • Relationship & Team Management  • SAP    Technical Skills  Category    2D Drafting    3D modeling    Data management    PDM  OS    Software/Tools    AutoCAD,  Canvas, Corel draw, Adobe Photoshop    Pro/Engineer, Catia V5, Solidworks  Nitromation warehouse  Team center Engineering,  Windows 2000, XP    Proficiency    Proficient  Proficient    Proficient    Proficient    End user  Proficient","SQA (5 years), Autodesk Inventor (5 years), Quality Control (5 years), Auditing (5 years), Autocad (10+ years), Pro-E (6 years)","BASF Catalysts India Pvt Ltd - Chennai, Tamil Nadu && Caterpillar India Pvt Ltd - Chennai, Tamil Nadu && Cadd Mission Technologies - Chennai, Tamil Nadu && Visteon Powertrain control Systems India Pvt. Ltd - Chennai, Tamil Nadu && Shanrag Machine Tools - Coimbatore, Tamil Nadu","* Responsible for all levels of quality control  * Reviewing customer requirements and making sure they are met  * Looking at ways to reduce waste and increase efficiency  * Supervise workers engaged in inspection and testing activities to ensure high productivity and high technical integrity.  * Develop and analyze statistical data and product specifications to determine standards and to establish quality and reliability expectancy of finished products.  * Coordinate objectives with production procedures in cooperation with other plant QC teams to maximize product reliability and minimize costs.  * Using relevant quality tools and making sure managers and other staff understand how to improve the business  * Setting up and maintaining controls and documentation procedures  * Responsible for machine drawings and plant drawings.  * Tool development for production requirements.  * To assist training for production engineers for the new machines and new layout change.    Design Engineer in SPBU  Caterpillar India Pvt Ltd, Chennai  On deputation from  GGS Information Services, Chennai && Chennai Nov 08 to May 09  Job Responsibilities  * Worked for hydraulic connectors CRIS.  * To create 3D models and detailed drawings for CAT products.  * the process linked with enhancing of product from existing and latest design, modeling and detailing using pro/Engineer.  * Solely worked for Transmission Business Unit template creation.  * To get data from engineering drawing using HVC.  * Worked on more than 25000 drawings to the template creation.  * Regular Interaction with process-partners to get inputs and updates.  * Fix the issues while opening large assembly files. Possess functional experience in Assembly and disassembling of large Pro/E Files.  * Handled operations in reading and interpret geometrical data into graphics in manual & technical drawing.  * Creation and modifications of drawings or illustrations in Canvas, using Vismockup and Pro/E. Responsible for writing CAT products manual through SIS authoring. && Job Responsibilities  * Responsible for reverse engineering design and development as per requirements.  * Involved in modeling, assembly creation & interchange, drawing generation and detailing ensuring a smooth workflow.  * Executed operations in conversion of 2D part drawings and assembly drawings into 3D drawings for various small-scale industries.  * Part design with 3D solid and surface models.  * Creating 2D drawing views using AutoCAD.  * Assembly creation, Assembly interchange, Drawing generation and Detailing.  * Managing the assembly database (as per assembly sequence) and Maintaining Bill of Materials (BOM)  * Applying GD&T according to standards of the customer.  * Concept development, product strategy and presentation preparation. && Job Responsibilities  * Hands on exposure with Starter Motor -Armature Line (for four wheeler Vehicles) and performance Test rigs of Armature line Starter Motors.  * Resolving issues rose in the process performance of test rigs of Armature line & Armature Dynamic Balancing.  * Perform downtime analysis for accomplishing assigned tasks within time frame.  * Ensure efficiency in the process by establishing standards and develop necessary measures for a seamless operational process.  * Carried out 3c, 5s activities, shift production and drafting relevant pre-despatch checklist ensuring data accuracy. && Job Responsibilities  * Responsible for shift production  * Prepare pre-despatch checklist  * Standardizing a cycle time and prepare process flow chart for machining process.  * Organize daily meeting for updating information about both shifts.","November 2011 to Present && September 2009 to October 2011 && January 2007 to October 2008 && January 2006 to January 2007 && May 2005 to January 2006","Assistant Manager in Quality Control && Junior Engineer in PSID && Junior Design Engineer && Junior Engineer Trainee && Production Supervisor","Chennai, Tamil Nadu","Indian Institution of Industrial Engieering Mumbai, Maharashtra && Shanmugh Polytechnic College Thanjavur, Tamil Nadu","August 2012 to August 2017 && June 2003 to April 2005","BE in Industrial Engineering && Diploma in Mechanical Engineering","Assistant Manager - Quality Control Manager with 11+ years of management and engineering work experience. Knowledge of quality assurance activities including audits recommending and implementing corrective actions providing accurate documentation of statistical reports and ensuring overall compliance. Also having experience in 3D modeling, Drafting, Manufacturing and Technical publication."
