"CandidateID","Additional-Info","Skills","Work-Experience__Company","Work-Experience__Job-Description","Work-Experience__Job-Duration","Work-Experience__Job Title","Location","Education__Institute","Education__School-Duration","Education__Qualification","Resume-Summary"
"6","None","SAP, MS Office, Project Management (10+ years)","Project & Quality - Gurgaon, Haryana && C&S Electric Ltd - Noida, Uttar Pradesh && Spaceage Switchgears Limited && Taneja Auto Private Limited","The Company: - With more than 5500 employees &9 Global Manufacturing Plants, Schneider Electric, The global specialist inenergy management, making energy safe, reliable, efficient and productive for Residential, Commercial & Industrial Buildings as well as for Industrial Process.  Professional Experience:-  • Root Cause Analysis (RCA) of various processes setback/ failures with CAPA.  • Quality Audit to ensure enforces of International standards & To create world class quality standards and improve customer satisfaction  • Consistent data recording and assessment and documentation integrity.  • Project Review & Supporting global practices in manufacturing automation solution.  • Periodic reviews of process flow in areas of Procurement, Commercial, Project Management & Site Management.  • NPS survey, ISO Audit && Duration: From Sep '06 to Aug '08    TheCompany:-M/S C & S Electric Ltdhaving a global presentation and ISO 9001:2000 -Industrial Group is a leading Engineering - Manufacturers of LV Switchgear Panels, ACB's, MCCB's, Switch Fuse Disconnector, HRC Fuse, Current Transformer, MCB&HT/LT Bus ducts, Power Plant Panelsetc    Professional Experience:  • RCA on customer complaints products and further implementation of CAPA.  • Internal Audit of various Deptt.  • Communicate technical concepts to Assembler using layman's terms to facilitate understanding.  • Required modifications/ changes in Drwgs of componentswith heads of relevant product to steer clear of failures of Product  • Routine inspection of products for norms of Quality Assurance.  • Analytical research of product e.g ACB, MCCB, .through LCM  • Testing of Product In - house as well as from External Lab as per International Standard.    Project completed: -Increased the endurance life of ACB by 11.4% (Avg) of mechanical operations & 6.8% of electrical operation in D- Series.    ACHIEVEMENT:  • Customer complaint level reduced to 4947 ppm from 6783 that of in 2005~06.  • 0.8% cost saving in existing product (ACB) with respect to 2005~06.  • First time completed ""customer satisfaction survey"" with the help of Marketing Team.  • Remarkable progress inFTPR (First Time Pass Ratio)    Worked with && The Company:  One of the manufacturers of LV Switchgear such as Air circuit Breaker, MCCB, Lighting Fixtures & Procurement-Construction (EPC) Contractor .etc    Job responsibilities:  • Control, Motivation & Effective use of Manpower in Final & Process inspection.  • Wastage Controls & Analysis.  • Team Leader of Productivity Improvement Action Committee.  • To manage and motivate a team on flour to furnish a proper quality by visual inspection  • To ensure the quality of inward component as per provided drawings & IS.  • To evaluate Vendors regarding quality and to assist them for better improvement.  • Finally responsible for outward product which goes through various calibration & test benches e.g. overload, thermal, magnetic, milli-volt drop, H.V. Test etc.    Worked with && The Company: TAPL is a firm based in Gurgoan which makes major components for HERO HONDA in technical collaboration with TVS-Lucas group.    Job responsibilities:    • To evolve manage and consolidate content delivery to and from clients.  • Responsible to assist technology related issues and initiatives.  • Responsible for customer complain & countermeasure  • To keep eye on under process inspection for maintaining DOL system.  • Responsible for Internal audit as a colleague of Manager (QA) and In-house calibration","September 2008 to August 2010 && September 2006 to August 2008 && December 2003 to August 2006 && April 1999 to November 2003","Manager - Project & Quality && Sr. Engineer -R&D (L.C.M.) && Sr.Engineer (Quality) && Engineer - Quality","Shalimar Bagh, Delhi","Govt Polytechnic Delhi, Delhi","May 1995 to March 1999","Diploma in Electrical Engineering","• As an astute professional with over 16 years of extensive experience demonstrated ability to lead diverse teams of professional to new level of success in highly competitive field of switchgear.  • Impressive record of hand-on & leadership experience in Manufacturing, Strategic planning & operations, Product & Project Management, Quality, After Sales Service, New Product launching & Price based negotiation for import materials.    ➔ Key strength:    • P&L, Inventory control and maintaing profit/ margins.  • Adequate knowledge of business and management principles (budgeting, strategic planning, resource allocation, human resources)  • Familiarity with industry standard equipment and technical expertise  • Driving Operational Excellence.  • Identifying, Analysing and Reviewing the market response/ requirements  • Proficiency to handle the customers of various profiles.  • Ensuring customer satisfaction by achieving delivery & service quality.  • Customer Services/ Care/ Support and After sales services  • Strong Analytical Skills & Process Oriented  • Life Cycle Management of products.  • Cost Effective Production Schedule"
"16","Additional Information • Worked as Management Representative( ISO/TS 16949) and ISO 9000 , responsible to Implement and Maintain function of Quality Management System in group of industries( Corporate QMS activity ).    Also work experience of Asst. Mgr.Q.C and QA  * Manage Quality in process.  * Quality Assurance activity as per ISO TS 16949 .  * Looking after continual improvement projects in Quality Control, Production, Maintenance  * Analyze and Manage (control) company level data.  * Conduct Internal Quality Audits, Process Audit, and Product Audit.  * Attending of Customer Complaints.","QA. QC, QMS","Confidential - Bopal","I'm diploma mechanica engineer andCertified lead Auditor(ISO 9001), Certified IQA for TS 16949 with 9yrs. Experience in the different field like Quality Control,Quality Assurance, Quality management system .    As certified lead auditor I can maintain and also can implement the quality standard whatever the organization or their customers prefer.  Able to plan and perform IQA, thirdparty Audit, Employee onjob training, training for Quality & customer standards, PPAP, PFMEA,    As Asst. Mgr.Q.C.  I am able to resolve the customer complaints with CAPA.   Can design cost and time effective PFD, CP, PP,  Can perform Process audits, Product Audit  Analyse Department wise performance data.  Successfully completed CIP in different area like Quality Control Dept. Production Dept, Maintrnanace, HR, Purchase.","2011 to Present","Manager Quality Control,Quality Assurance","Bopal","TEB Gujarat. Amreli, Gujarat","None","Diploma in Mechanical Engineering","None"
"17","Additional Information PROFESSIONAL SKILLS:  • Have Expertise to operate Universal Radio Communication Tester/RF Machine (Agilent and Rohde & Schwarz CMU200)  • Have Expertise to operate & Maintain Robotic Screw Machine/Driver.  • Knowledge of Soldering Iron Calibration.  • Knowledge of MS office tools namely, MS- EXCEL, POWER POINT, MS- WORD","QA/QC, Product Validation Management (5 years)","C-Exmart pvt ltd - Noida, Uttar Pradesh && BGM TELECOMMUNICATIONS PVT.LTD && BGM HOLDING COMPANY && BGM HOLDING COMPANY","Quality control & Assurance,internal audit && RESPONSIBILITIES:  ⇒ To plan and do the regular Internal Process Audit as per the Control Plans & take appropriate action.  ⇒ New project handling and their documents preparation.  ⇒ Control Plan preparation as per the Operation Standards.  ⇒ Preparation of Master Sample and Limit Sample for Mass Production.  ⇒ To do ""Process Capability Study"" for significant Characteristics of the Product and to take appropriate Action.  ⇒ Handling the Customer Complaints and take effective Countermeasures by using 7 QC Tools.  ⇒ Supplier process audit for process improvements related activities.  ⇒ Modify all concerned documents after taken counter measure.  ⇒ Regular monitoring of Poke-Yoke implemented on assay lines.  ⇒ Responsible for product lay out inspection as per Plan vs. Actual.  ⇒ In house Training for 5'S, Kaizen Techniques and educate the Associates about these activities.  ⇒ Accountable for analyzing the materials requirement in terms of quality & quantity for the various units of the company; procured goods in right quantity, maintained minimum stock level with right margin from the vendors & suppliers while forming the rates contract.  ⇒ Responsible for suggestion and kaizen activities, removing useless work, maintaining discipline according to safety rules and also development of operator through multi skill.  ⇒ Vendors Validation Process to arrange & manage Right vendor for Organization. && RESPONSIBILITIES:  ⇒ Responsible for Data Collection related to process and the customer rejection, analyze it, & how to minimize the process and customer rejection.  ⇒ Give training to new operators.  ⇒ Responsible for calibration & validation & maintain of record.  ⇒ Coordination with production department to solve problem and improve quality of product.  ⇒ Maintaining QA Documentation Like in process Inspection sheet, control plan, process flow diagram, work instruction etc.  ⇒ Controlling of Wave Soldering Machine for its Parameter & Specifications.  ⇒ Actively involved & responsible to maintain 5S activities and provide training to operators related to process.  ⇒ Maintain internal process.    ⇒ Involved in FM, Remote, Electric Meter, Hometheatre, Car Panel, SMT production, assembly & testing unit.  ⇒ Conducting ESD audit on shop floor daily basis.  ⇒ Handle all quality activities of finished products of customer INTEX, BEL, ELSEWEDY.  ⇒ Involved in IQC of component used in SMT unit.  ⇒ Controlling report of repairing cards and keep track of all those cards so as to repaire very soon and can dispatch to customer. && None","October 2016 to Present && June 2015 to Present && June 2012 to May 2015 && June 2011 to May 2012","Quality Manager && QUALITY MANAGER && QUALITY MANAGER && QUALITY ENGINEER","Sitamarhi, Bihar","Polytechnic in Electronic & Communication Engineering && B.I.E.C. Patna, Bihar","2011 && 2006","None && None","To pursue a highly rewarding career, seeking for a job in challenging and healthy work environment where I can utilize my skills and knowledge efficiently for organizational growth."
