"CandidateID","Additional-Info","Skills","Work-Experience__Company","Work-Experience__Job-Description","Work-Experience__Job-Duration","Work-Experience__Job Title","Location","Education__Institute","Education__School-Duration","Education__Qualification","Resume-Summary"
"34","Additional Information REENA D VAIDYA  Phone: […]   E-Mail: reenadv23@gmail.com  Participant ID- […]    PROFESSIONAL SYNOPSIS     Certified SAP ECC 6.0 EHP7 FI Consultant with 88% marks from ATOS – SAP Authorized Training Center, Mumbai   M.Com with 6 years + of experience in Accounting and Other Finance domains.    ACADEMIC CREDENTIALS    2006 - 2008 M.Com  Pune University  2003 - 2006 B.Com  BYK College of Commerce, Pune University, Nasik    SAP CERTIFICATION    SAP ERP Finance, Version ECC 6.0 EHP7  ATOS – SAP Authorized Training Center, Mumbai  (26th Dec 2016 – 03rd Feb 2017)  Modules Covered:  TFIN50- Financial Accounting I  TFIN 52- Financial Accounting II  Non SAP EXPERIENCE   Worked with First Data India Pvt Ltd. from 11 August 2014 till 30 December 2016.  First Data Corporation is a global payment technology solutions company. A global leader in commerce-enabling technology solutions, serving over six million business locations and four thousand institutions in 118 countries.   Key Responsibilities:   Quality Analyst for Merchant Boarding Representatives working in the US.   Checking the detailed financial data about the rates and fees for each and every product. Analysing the same on the applications and making the required corrections, thereby, not financially affecting the First Data clients for any miss outs made by the Boarding Representatives.   Prepare reports to communicate outcomes of quality activities.    Publish QA statistics on a daily, weekly and monthly basis. Collect and compile statistical quality data.   Develop, recommend and monitor corrective and preventive actions. Document internal audits and other quality assurance activities.  Worked with WNS Global Services: WNS Global Services (Nashik) from 17 September 2012 till 08 July 2014:   Worked as a research analyst for a risk intelligence organization- Regulatory Data Corp.    To meet critical client on-boarding and monitoring requirements with extensive international coverage of negative media, OFAC and other government watch-lists, international regulatory authority actions, and more.    To highlight potential vulnerability to malfeasance, organized crime influence and asset fraud.   Access our consulting services to address a range of regulatory, criminal and reputational risks including corruption, money laundering and terrorists financing, sanctions and embargoes, fraud and criminal associations.    Minute to minute screening of terrorist and organized crime figures and groups on international law enforcement watch-lists. Daily monitoring more than 400 global watch-lists with the finest international negative media coverage.    Utilizing the most robust search engine, most configurable database to make sure the client gets the right solution to maximize business efficiencies.    Coding the risk database, or Global Regulatory Information Database (GRID) with accurate, risk-relevant event codes - ranging from money laundering, terrorism, fraud, narcotics trafficking, organized crime, embargoes and sanctions, to PEPs, regulatory watchlists, identity theft, burglary, cybercrime and more.  Key Responsibilities:    Handling a team of 10 and ensuring that the members are motivated towards their performances by giving them a proper feedback for quality and productivity.   Dealing with challenging issues and problems which arise. Mentoring as well as training the junior and new staff.    Preparation of all the monthly performance reports for the managers. Coordinating with the client regarding any process update and informing the team members about the same.   Coordinating with the IT department with reference to any IT issues. Arranging monthly team meetings and preparing MOM of the same.     Application Knowledge:   Worked on Management Analysis and Reporting System (MARS)   Worked on Data Quality Application (DQA)   Google   Whitepages   Behindthename  Extra Activities:   Basics of Lean Six Sigma (BLSS)   ISO awareness   Business Writing Skills   Engage to Excel  Stress Management   Quest   Train to Retain   WNS Global Services (Mumbai) from 07 February 2011 to 31 August 2012:   Key Responsibilities:   Resolving all issues of British Airways Customers.   Coordinating with various departments to resolve customer issues.   To adhere service level and provide resolutions within the prescribed turnaround time. To ensure customer satisfaction by providing proper resolutions.  Worked with VPH Associates (Andheri, Mumbai) from November 2010 to February 2011  Key Responsibilities:  Auditing of Sales and Purchase notes for a chemical industry.  Accounts Reconciliation project for MSEB - Prakash Ganga (Bandra)  Worked with Agrawal Malvade Patil & Associates (Nashik) from January 2009 to October 2009   Key Responsibilities:  Preparation and Finalization of Profit & Loss Account and Balance Sheet   Filing of Income Tax and VAT returns.  Worked on on Tally 9.0    PERSONAL DETAILS  Date of Birth : March 02, 1986   Current Address: A 003, Vasanth Athena, Beside Viviana Mall, Easter Express Highway, Thane 400607   Permanent Address: 1/6, Sadanand Apartments, Tilak Wadi, Sharanpur Road, Nashik 422002","Sap Fico","First Data - Thane, Maharashtra && WNS Global Services Private Limited","None && None","August 2014 to December 2016 && February 2011 to July 2014","Quality Analyst && Research Analyst","Thane, Maharashtra","Pune","None","M.Com","None"
"35","Additional Information SKILLS    • Technology: Data Warehousing/ETL, Database, Reporting  • Primary Skills: IBM InfoSphere Information Analyzer (1 year),  Microstrategy (11 months), SQL, Tableau, trained on SSRS • Database: Oracle, DB2, SQLServer, SAP HANA.","Microstrategy (1 year), Sql (2 years), Information analyser (1 year)","Mindtree Ltd","Duration: Since Dec '14 till now  Project undertaken:    Client 1: AIG (A leading Global Insurance Firm in US)  Project: Data Quality (1 year experience)  Role: - Data Quality Analyst  Responsibilities: -  • Development of rules in IBM IA for the client data.  • Development of SQL queries for data validation.  • Data Quality infrastructure installation.  • Troubleshooting and debugging IA errors.  • Issue Monitoring and Resolution (IMR) on data.  Environment: - IBM InfoSphere  Operating System: - Windows 7  Team Size: - 12  Client 2: Adidas (A leading Sports Wear Manufacturer in Germany)  Project: Reporting (11 months experience)  Role: - Data Analyst  Responsibilities: -  • Development of reports and dashboards.  • Worked on public objects and schema objects.  • Basic functions of Object Manager.  • Development of SQL queries for data validation.  • Making the changes to the reports and dashboards after getting the RFC.  Enviroment: - Microstrategy, SAP HANA  Operating System: - Windows 8  Team Size: - 7","None","Data Analyst","Bangalore, Karnataka","Institute of InformationTechnology and Management Gwalior, Madhya Pradesh && Miss Hill H.S. School Gwalior, Madhya Pradesh","2014 && 2008","B.Tech in Information && Class X in Science","• Data Analyst with 2 years of experience.  • Experience in developing SQL queries for data validation and generating ad-hoc reports.  • Mapping a data model used by the IBM Information Analyzer.  • Experience in development of IA scripts and interacting with IA CLI interface.  • Experience in development of XML scripts for IA.  • Have worked from client location for 1 year.  • Experience in creating reports and dashboards in MicroStrategy.  • Active team member with good analytical, communication and interpersonal skill.  • Trained on Power BI tool, SSIS, SSRS.  • Developed dashboards in Tableau."
"37","Additional Information COMPUTER SKILLS:    Operating system: Windows  Packages: MS-Office, Internet, E-mail Application  Worked over Scala Business Solutions NV, with the latest version i-Scala 2.2 in our company.  * Working with i-Scala routines.  * Entering data in the form fields  * Material Production Control.  * Printing from i-Scala    SAP – PLANT MAINTENANCE FUNCTIONAL CONSULTANT:  Good Knowledge of SAP - PM Module with the following strengths:    Master Data ( Functional Location, Equipment, BOM, Task Lists, Serial Numbers, Work Centres )   Break Down Maintenance   Corrective Maintenance    PM work orders   Order types   Preventive Maintenance ( single cycle plans, counter based plans , strategy based plans, time based plans )   Single cycle plans   Notification types.  As a part of Support team, PM consultant, I can carry out the following :.  • Field selection for notification type.  • Screen selection for notification type.  • Configuring action box to the notification type.  • Configured catalog profiles for the notification type.  • Configured code group and codes for the catalog profile.  • Configured order types for the notification type.  • Configured user status profile for the notification type.  • Configured partner determination procedure.  • Configured order types fully for notification type  • Set up maintenance plan  • Set up maintenance strategy.  • Set up task list for functional locations.  • Set up field selection for functional location and equipment.  • Set up structural indicators","IT (ERP - PLATFORM) SAP - PM (2 years)","AL JAZEA INDUSTRIAL COMPANY - DAMMAM - KINGDOM OF SAUDI ARABIA && NATIONAL INDUSTRIES COMPANY FOR BUILDING MATERIALS - KUWAIT - KUWAIT && COSMOPLAST INDUSTRIES WLL - SHARJAH - U.A.E && AL WASSEL IRRIGATION SYSTEM FACTORY"" Buraidah - BURAIDAH - AL QASSIM - KINGDOM OF SAUDI ARABIA && INTEGRATED THERMOPLASTICS LTD - Hyderabad, Andhra Pradesh","Worked as QUALITY CONTROL MANAGER /ENGINEER at JAZEA POLY ETHYLENE PIPES FACTORY (JPEPICO), DAMMAM , K.S.A since April 2011 to 15-12-2015  A new plant set up for producing the PolyEthylene pipes , applicable for the transportation of water supply(Pressure/non pressure) for different needs.   Started here from the initial stage of the factory set-up, like setting up the Quality Control Department, arranging the testing equipment for the lab, from the standard suppliers of testing equipments in the market. Preparing the related documents for the tests to be carried out.  Also worked over getting the certification of ISO 9001-2008 and certification from SASO and Nsf-61 Certification for our product to our organization. && Worked as a PRODUCTION ENGINEER at ""NATIONAL INDUSTRIES COMPANY FOR BUILDING MATERIALS""-KUWAIT in the HDPE PIPES AND FITTINGS manufacturing section.    Production in our section upholds in manufacturing the pressure pipes for the sizes ranging OD25mm to OD 900mm ranging pressures PN6 to PN16.  Also the corrugated pipes ranging diameters from ID34mm to ID500mm both with inside corrugated and also inside solid wall.  We also produce the Profile pipes from KRAH MACHINE with ranging diameters ID300mm to ID2400mm for the manufacturing of larger profiles of manholes production ranging diameters from ID600mm to ID2400mm.   Worked as Production Engineer in this HDPE section to improve the efficiency in manufacturing by attending towards every minimal breakdowns concerned with production outputs with regular follow-ups technically and effectively towards them && Worked as a PRODUCTION ENGINEER IN PRODUCTION DEPARTMENT  The company was the leading manufacturers in the middle east to produce the larger diameter of Upvc pipes and upholds various processing techniques with separate departments like Extrusion department, Injection molding, Blow molding, Rotational molding, Pre-insulated pipes section, Blow film section which applied for the thermoplastic materials to give the final shape for utilization of consumers for their house-hold needs.  Was working as a production engineer in extrusion department of UPVC pipes.  Production of pipes are applicated for drinking water supplies, drainage facilitations, sewerage pipes, pipes for irrigation purposes, also pre-insulated pipes for oil and gas supply lines etc. && Worked as a Production Supervisor also the Dep’t Head Assistant at “AL WASAIL INDUSTRIAL COMPANY” Buraidah, Al-Qassim.  The Company was one of the leading manufacturers of Polyethylene Pipes Certified with ISO 9002: 1994 with its demanding markets in the Middle East also in the Western Countries.  Products of company were High Density Polyethylene Pipes, Low Density Polyethylene Pipes, and Linear Low Density Polyethylene Pipes. Also the Butt Welded joints like Butt Welded –Tee, Reducers. Production of the polyethylene pipes were ranging from diameters from OD 4mm to OD 630mm produced according to the standards of DIN 8074, Australian Standards (AST), ISO Standards with safety factor-1.25C. && The company was a leading manufacturer of Upvc pipes and fittings in the southern part of India  As a Production Supervisor, i used to handle the production schedules submitted to me from my production engineer.  • Handling the production breakdowns to minimum levels to achieve the targeted production.  • Maintaining the production output to a maximum level by keeping the production within quality standards.  • Minimizing the scrap percentage was the main motto.  =======================================","April 2011 to December 2015 && August 2009 to October 2010 && January 2007 to June 2009 && May 2004 to July 2006 && May 2003 to January 2004","QUALITY CONTROL MANAGER && PRODUCTION ENGINEER && PRODUCTION ENGINEER && Production Supervisor also the Dep't Head Assistant && PRODUCTION SUPERVISOR","Kurnool, Andhra Pradesh","Central Institute Of Plastics Engineering And Technology && Gulbarga university Gulbarga, Karnataka","July 2001 && January 1995 to October 1999","Post Graduate Diploma in Plastics Engineering && Bachelor's of Engineering in Mechanical Engineering","Seeking a challenging position in any organization in order to prove my ability towards improving the organizational goals in the today's competitive market in the most benefit way& to reach peak in the field of Engineering and to utilize my talents and creative ideas for the growth of organization as well as for the individual development."
"39","Additional Information Technical Proficiency  Microsoft Office tools  Trained in Six Sigma methodology using DMAIC  Trained in Lean techniques","Six Sigma, LEAN, Quality Management, Retail Banking","Serco Global Services - Mumbai, Maharashtra && Serco Global Services - Mumbai, Maharashtra && Wipro BPO && Wipro BPO && Adventity","Reporting to the Senior Manager - Operations for Barclays Bank UK - Retail Banking Customer Service  * Managing a span of 28 members - 25 Quality Analysts, 2 Quality Team Leaders and 1 MIS resource  * Improved productive activity of the department leading to a billable increase in team span    Quality Process  * Set out quality standards for various customer metrics, ensuring a high-quality of customer experience, while adhering to the SLAs and work process  * Instrumental in setting up a new Call Quality Monitoring framework in collaboration with Onshore client. This model was replicated across all other India Operations  * Set and maintain stringent controls on call quality and service levels  * Continuously embedded Quality culture across Operations  * Engaged & collaborated with Operations teams in driving results  * Lead Internal Risk & Compliance audits  * Facilitate client Risk & Compliance audits ensuring positive results    Process Improvement  * Monitor the overall functioning of processes & identify improvement areas using Six Sigma and Lean techniques  * Drive process improvement projects using DMAIC methodology and provide support to Business process owners to take their projects to completion  * Coordinate with all stakeholders to ensure that the project progresses in a timely manner  * Ensure that the financial and non-financial objectives of each project are achieved  * Ensure timely and relevant communication to all stakeholders, throughout the project    Client Management  * Work with clients to agree on action plans for performance upliftment  * Ensure client expectations are met with respect to business requirements  * Attend weekly and monthly reviews with clients    Others  * Helped in setting up Call Quality framework for a corresponding process (Barclays UAE)  * Provide intelligence on various MI reports, aiming at focused action areas    Achievements:  ❖ Awarded the 'Excellence Award for Outstanding Contribution' at a Divisional level at the annual PULSE Award ceremony 2013 && Joined as a Team Lead for Retail Banking (Barclays Bank UK)  * Worked in the capacity of a Quality Team Leader for the process  * Managed a team of 15 Quality Analysts    Quality Process  * Lead the team to ensure accurate output from call observations  * Lead Gage R&N Calibrations across Onshore and Onsite teams  * Provide input to Operations for improving performance  * Assist in Internal Risk & Compliance audits    Process Improvement  * Report performance dashboards to stakeholders for effective decision-making  * Assist all stakeholders to ensure that the project progresses in a timely manner  * Ensure timely and relevant communication to all stakeholders, throughout the project    Client Management  * Liaising with Onshore and On-site clients  * Work with clients for knowledge sharing and exchange best practices  * Prepare weekly and monthly decks for client reviews    Others  * Worked to tight deadlines and prioritized a large number of conflicting and frequently changing priorities  * Handled end-to-end managerial responsibilities as the acting AM Quality in the absence of one, for 10 months.    Achievements:  ❖ Received Serco Star award for performance in Nov'12  ❖ Silver accredited in British Council's Coaching Excellence programme && Successfully managed upto 18 associates at a time  * Attained in-depth knowledge of process level metrics and revenue parameters  * Responsible for ensuring team targets are met  * Identify improvement areas, devise solutions and oversee implementation of the same  * Data management and analysis, outlier management  * Hold one-on-one feedback sessions with team members  * Organize team outings, dinners and other fun activities to keep team members engaged  * Identification and management of possible attrition cases  * Trained in Six Sigma methodology  * Lead EWS Effectiveness Improvement project using Six Sigma tools  * Responsible for managing the productivity of the queue  * Maintain the Daily Recordings of the Queue to ensure no deviations from client specifications    Achievements:  ❖ Received Best Team Award for Dec'08  ❖ Placed in the category of top 5 TLs for three quarters in a row && Educate clients (U.S healthcare providers) with member benefits and resolve claim issues  * Research clients' contracts to ensure that claims are processed correctly according to the terms of the contract  * Check coding combinations to ensure appropriate billing is done on claim  * Thorough knowledge of the claim billing system && Inbound Customer Service Executive  * Customer Service and sale of Dish Satellite television to the customer base in U.S  * Selected to be a part of the Outbound Mortgage Pilot process","April 2013 to May 2014 && January 2011 to March 2013 && October 2008 to July 2010 && August 2007 to September 2008 && August 2006 to June 2007","Assistant Manager - Quality && Team Leader Quality && Team Leader Operations && Customer Service Representative && Customer Service Executive","Mumbai, Maharashtra","Institute of Distance Education Mumbai, Maharashtra","April 2009","Bachelor of Commerce","I have worked in customer service departments. I am open to working in varied fields where I can apply my knowledge and skills to bring about improvement in performance."
"41","Additional Information Technical Skills: MS-Office (MS Word, MS PowerPoint, MS Excel) Windows XP, Computer Typing (30WPM), Diploma in Computer Programming","Microsoft office, SAP HCM","AEGIS Limited","Analyst    Roles and Responsibilities:  Have worked in Aegis Intercompany PRR (Specialist ­ Quality Analyst) process for the client HireRight Inc, Irvine, handling the below activities  1. Criminal data verification of applicants through US court database by searching the applicant name in the county/state criminal websites.  2. Giving accurate information of the applicant by matching exact name, DOB, address, SSN & driving license of the applicant  3. Sending results to clients.  4. Preparing daily quality report based on production & errors received  5. Tracking trends in quality, customer satisfaction & complaints, and performance  6. Tracking, monitoring & validating daily errors  7. Providing feedback to the researcher whenever required  8. Complete the work within stipulated time with 100% quality  9. Conducting regular calibration  10. Sending shift end report to the team manager","September 2010 to August 2016","Specialist - Quality","Bangalore, Karnataka","Bangalore University Bangalore, Karnataka && BKS High School Bangalore, Karnataka","2009 && 2004","B.COM in First && S.S.L.C in K.S.S.E.B","Looking forward to secure a position in an Organization as a SAP HCM Functional consultant. With commendable knowledge on SAP-HCM module. I believe I would be able to instantaneously contribute to the growth and development of the organization    Overview of SAP Knowledge    • Effectively trained in SAP HCM on ECC 6.0 Version  • Expertise on various modules of SAP HR such as personnel administration, organization management, time management, payroll-India.  • Knowledge on ASAP methodology, gaps, functional specification, reports, LSMW.  • Knowledge on PCRs and Schemas    Area of Expertise in SAP HCM  Personnel Administration  • Customization of enterprise structure, personnel structure and organizational structure  • Creating features for determining default values and controlling the system processes using feature NUMKR  • Configuration of info menu, info groups, action menu for user groups  • Basic settings to maintain employee master data within the respective info types and to maintain the flow of personnel actions    Organizational Management  • Creation and maintain objects like organizational units, jobs, positions, persons, work centres, and integrated all of these into the enterprises organizational plan using expert mode, simple maintenance and organization & staffing  • Creation of relationships among all the organizational units  • Creating tasks and assigning to jobs and positions  • Creation of organization units as per client requirement & integrating it using plogi switches    Time Management  • Define public holidays, holiday calendar and factory calendar.  • Define break schedules, rules for variant, daily work schedule, period work schedule  • Creating work schedule rule and generating work schedules & defaulting it using feature SCHKZ  • Define absence types and attendance types, absence quota types, deduction rules, counting rules and rounding rules    Indian Payroll  • Good understanding on the payroll process, Schemas and PCR  • Creating period parameters, payroll periods, payroll accounting area and control record  • Defining pay scale structure consisting of pay scale type, pay scale area, pay scale group and pay scale levels  • Creating wage types, wage type model, setting up the permissibility and defining wage type characteristics including direct & indirect valuation methods  • Generation of payroll periods, remuneration statement & knowledge on features like ABKRS & TARIF"
