"CandidateID","Additional-Info","Skills","Work-Experience__Company","Work-Experience__Job-Description","Work-Experience__Job-Duration","Work-Experience__Job Title","Location","Education__Institute","Education__School-Duration","Education__Qualification","Resume-Summary"
"22","Additional Information Tenho excelente comunicação verbal e escrita, sou comunicativa e mantenho ótimo relacionamento interpessoal. Sou atenta e flexível aos desafios do trabalho em equipe, com fácil adaptação a ambientes diversos. Apresento tolerância e habilidade com conflitos e aponto o meu empenho na direção dos resultados, visando o atingimento e a entrega das metas estabelecidas.     Com conhecimento de eSocial, disponibilidade para viagens, estou em busca de uma oportunidade para cooperar com o desenvolvimento/crescimento da organização, disponibilizando minha experiência e minha capacidade de somar conhecimentos e esforços, rumo ao sucesso!    Cargo Pretendido:   • Consultoria em RH   • Coordenação de RH Salário: A combinar","Consultoria de Negócio e Implantação de RH 03 anos e 03 meses, Coordenação de Recursos Humanos 05 anos, Rotinas de Departamento de Pessoal 15 anos, Capacitação e Desenvolvimento (Instrutora) 3 anos, Supervisão de CallCenter 2 anos, Vivência em Indústria 5 anos, SISTEMAS: Cordilheira 6 anos, Softran 1 ano, Senior – Rubi e Ronda (Com certificação) 2 anos e 6 meses , Benner RH 1 ano e 9 meses, Sistemas de controle de Ponto eletrônico 6 anos. (10+ years)","Benner Sistemas S/A - Curitiba, PR && GCI Sênior Consulting - Curitiba, PR && Estrela do Oriente - São José dos Pinhais, PR && Aramepar - Curitiba, PR && Julien do Brasil - Curitiba, PR && Brasil Telecom - Curitiba, PR","Consultora de RH Senior – Negócio e Implantação de Sistema de Gestão de RH:  Atuação como Consultora de Implantação dos Subsistemas de RH, em projetos de informatização e integração de todas as rotinas de administração de pessoal, buscando otimizar e aperfeiçoar os processos pertinentes, a fim de reduzir custos e mitigar erros. Prestando consultoria presencial em vários clientes e Estados como: RS, SC, SP, PR, PE, com ênfase no eSocial (a partir de 2016), com viagens semanais, quinzenais e mensais.    Realização de entrevistas com usuários chave do processo (gerentes e coordenadores das áreas envolvidas), colhendo dados e informações para a implantação de sistemas, além de executar parametrização do sistema e análise dos processos, bem como capacitar/treinar usuários para a utilização do sistema implantado. Participação Individual (auto gerenciamento) e em Equipe, em Projetos de implantação e/ou migração de sistemas integrados de gestão de RH, adaptando a necessidade do cliente ao funcionamento padrão do sistema, atendendo requisitos de Editais e/ou, mapeando customizações necessárias ao atendimento da realidade de cada empresa, bem como prestando atendimentos pontuais presenciais ou via acesso remoto, a usuários do sistema.     Participação ativa em implantação de módulos gerais da área de gestão de pessoas como:     eSocial, Recrutamento e Seleção, Currículo Web, MyPlace, Gestão de Desempenho, Educação Corporativa, Segurança e Medicina no Trabalho, Cadastro de Funcionários, Cargos e Salários, Folha de Pagamento, Controle de Ponto, Plano de Pessoal e Benefícios, seguindo as fases de implantação: Aderência, Setup (Parametrização) dos módulos adquiridos, Protótipo, documentação evidenciando os processos, Homologação de todos os processos em base de Produção e Treinamento para usuário chave e multiplicadores.    eSocial: Diagnóstico de inconsistências da Base de dados e Orientação sobre o Negócio eSocial, dicas e esclarecimentos sobre o MOS 2.2. && Consultora de Suporte/Consultora Cliente Advanced – Gestão de Pessoas: Consultoria de Gestão de Pessoas: atendimento pontual a clientes na utilização de Softwares de Folha de Pagamento, Controle de Ponto, Benefícios, Medicina e Segurança no Trabalho, Recrutamento e Seleção, Quadro de Vagas, Treinamento e Jurídico, esclarecendo dúvidas operacionais nas rotinas supracitadas, bem como buscando soluções nas áreas competentes para customizações e implementações necessárias à realidade de cada cliente; no Atendimento Advanced, participando como desenvolvedora de novo modelo de suporte, com mais flexibilidade e agilidade no atendimento, isentando o cliente de sistemas burocráticos de suporte padrão, com foco intensificado na aproximação e conhecimento do negócio do cliente. && Gerenciamento de equipe responsável pelo DRH matriz, filial e demais empresas do grupo, R&S, gerenciamento de serviços terceirizados da empresa (temporários, limpeza); Coordenação e execução de rotinas gerais do setor; processos admissionais e demissionais, fechamento, conferência e análise de folha de pagamento, acompanhamento controle de ponto eletrônico, benefícios; pagamento de salários; Reestruturação do departamento. Presidência CIPA. && Responsável pelo DRH matriz, filial e demais empresas do grupo, R&S, integração de funcionários, gerenciamento de serviços terceirizados da empresa (temporários, restaurante, limpeza, ginástica laboral); Coordenação e execução de rotinas gerais do setor; processos admissionais e demissionais, fechamento, conferência e análise de folha de pagamento, acompanhamento controle de ponto eletrônico, benefícios; pagamento de salários; Reestruturação do departamento com implantação de sistemas operacionais para otimização dos trabalhos. && Confecção, fechamento e análise da folha de pagamento, Gerenciamento das informações mensais e anuais obrigatórias perante a Previdência Social, Ministério do Trabalho e demais órgãos competentes (GFIP/SEFIP, CAGED, GPS, DARF, RPA, DIRF e RAIS); administração de salários; gerenciamento de arquivos para gráfica; arquivos para bancos; relatórios mensais (p/fechamento contábil); controle assistência médica (com análise de custos); seguro de vida, convênios diversos; administração de benefícios; agendamento e controle de cursos profissionalizantes; desenvolvimento de plano de capacitação dos funcionários; gerenciamento e controle de exames médicos periódicos; controle/cálculo de férias; conferência/ajuste cartão ponto (eletrônico); controle desconto/pagamento de benefícios; programação de pagamentos junto ao financeiro; acompanhamento processos admissionais e demissionais; recrutamento e seleção de pessoal; confecção de manuais de segurança e diretrizes, elaboração e desenvolvimento de sistema de integração de novos funcionários e apresentação da empresa; representante/preposta junto ao TRT (processos trabalhistas), atuando efetivamente nas defesas das ações ajuizadas contra a empresa, junto ao setor jurídico; acompanhamento/atendimento a fiscalizações do MTB; participação de eventos sociais representando a empresa; relacionamento com sindicatos (empregado e patronal); relacionamento com agências de emprego; coordenação e acompanhamento das atividades da assistente do RH (rotina do departamento); Presidente da CIPA (Gestões 2007, 2008, 2009); inspeção dos programas PPRA, PCMSO e CIPA; acompanhamento dos trabalhos terceirizados (SESMT); orientação e informação sobre as 33 NR aos funcionários da empresa com trabalhos de conscientização, projetos de SMS e demais rotinas da CIPA, Supervisão a organização de arquivos. && Especialista em Treinamento: Técnicas de Atendimento; Técnicas de Abordagem; Técnicas de Vendas Avançado; Capacitação e Desenvolvimento; Telecobrança; Excelência no Atendimento; Palestras Motivacionais e comportamentais; Treinamentos Iniciais (fase final do processo seletivo/ identificação de perfil); Integração, Noções de Rede Telefônica; Código de Defesa do Consumidor; aplicação de dinâmicas (vivenciando situações); procedimentos gerais dos setores de Faturas, Serviços e reparos; elaboração de materiais para treinamento e reciclagens sobre assuntos diversos (cortesia, qualidade, liderança).    Supervisora de Call Center: (Tele-cobrança) Gestão de pessoas com administração participativa; gerenciamento de conflitos; resultados acerca de produtividade e comprometimento da equipe com o menor índice de absenteísmo; controle de ponto; monitoração dos atendimentos com ""feedback""; campanhas motivacionais; reuniões.","April 2015 to December 2016 && October 2013 to March 2015 && July 2011 to March 2012 && December 2010 to November 2011 && March 2007 to November 2010 && December 2000 to May 2005","Consultora de RH Senior && Consultora de Recursos Humanos && Coordenadora de RH && Coordenadora de RH && Encarregada de Recursos Humanos && Especialista em Treinamento","São José dos Pinhais, PR","Universidade Braz Cubas São José, PR && Faculdades Machado de Assis Curitiba, PR","January 2015 to December 2016 && 2011 to 2013","Superior Completo in Tecnólogo RH && Superior Incompleto in Gestão de Recursos Humanos","None"
"23","Additional Information Intercambio Londres - UK - maio a julho 2014","Windows Administrator","Porto Seguro Cia && MARS - Guararema, SP && SENAC && Fidelity BPO && DMI Network && Associação Comunidade da Graça && Texto S/A && Stage in Data Processing at the Bank CAIXA - São Paulo, SP","Responsabilidades  Consultor na area de infra-estrutura a servidores    Realizações  VMWARE e Windows server && RESUMO DE QUALIFICAÇÕES  Profissional com 19 anos de experiência na área de TI; Pós Graduação, especializações e certificações em TI, gestão de pessoas e liderança em: orçamentos, projetos e infraestrutura de TI.   Com 54 cursos de especialização. Docente, coordenação, liderança de equipes, projetos e viagens por todos os estados do Brasil e em países como: Argentina, Colômbia, EUA, Rússia, Reino Unido (UK), Suíça, Alemanha, Bélgica, Holanda, Espanha, Franca, Itália e Portugal.     FORMAÇÃO ACADÊMICA  Pós Graduação: MBA em TI – UNINOVE - Conclusão: 2010   Graduação: Gestão de Ambientes Internet e Redes de Computadores – UNINOVE - Conclusão: 2003   Técnico: Processamento de Dados ETE Professor Horácio Augusto da Silveira - Conclusão: 1996     INFORMÁTICA  Gestão de projetos – ITIL / Cobit;  Virtualização de servidores (VMWARE, Hyper-V, XEN);  Especialista VMWARE e ferramentas – VCloud, Vcenter, VCOPS, Chargeback, SRM, DRS, entre outros;  Administração de servidores e redes Windows / Linux;  Windows Server e todas suas ferramentas– 2012, 2008, R2, 2003, 2000 (MCSE);  Switches e Roteadores CISCO / 3COM;  Segurança de TI – GPOs, AD, DNS;  Gerenciamento de storages EMC (NAS, SAN), HP, Fusion IO (alta performance);    EXPERIÊNCIA PROFISSIONAL  MARS INFORMATION SERVICES – Master Food.   Período: 01/04/2014 – 15/05/2014 – PROJETO PONTUAL DE 45 DIAS   Cargo: Analista de TI Senior  Atividades:   Suporte internacional aos servidores em ambiente VMWARE – Fabricas MARS (chocolates, “food” e PET);    PORTO SEGURO CIA DE SEGUROS  Período: 05/08/2010 – 05/02/2014   Cargo: Arquiteto de Infraestrutura de TI  Atividades:   - Liderança na implantação do novo datacenter e virtualização de TI na Porto Seguro;  - Arquitetura de infraestrutura de hardware e plataforma Windows   (AD, DNS, DHCP, Servers, System Center, etc) em diversos projetos de TI;  - Negociação, estimativas, orçamentos e projetos de TI para as áreas da companhia;  - Projetos de virtualização de servidores (VMWARE, Hyper-V, Citrix), storage (EMC);  - Implantação de cloud computing e virtualização (VMWARE, XEN e Hyper-V);  - Virtualização de soluções para URA e telefonia corporativa;  - Projeto storage alta performance – Londres-Inglaterra;     IBTA - FACULDADE  Período: 05/10/2013 – 05/04/2014  Cargo: Professor de TI – Projeto PRONATEC  Atividades:   - Docente em TI;    UNINOVE - UNIVERSIDADE  Período: 05/11/2012 – 05/02/2013  Cargo: Professor de Ensino Superior   Atividades:   - Docente universitário em TI;    SENAC  Período: 01/05/2010 – 01/02/2012   Cargo: Professor de Educação Profissional em TI   Atividades:   - Docente de cursos técnicos e cursos livres em TI;    FIDELITY BPO BRASIL - BANCOS  Período: 01/11/2007 até 02/06/2010   Cargo: Analista de Suporte Sênior – Team Leader IT   Atividades:   - Coordenação e desenvolvimento de projetos em TI para os clientes internos e externos das empresas, atuação com gestão de projetos e pessoas;  - Liderança de equipe; Interação, conferência e contato com as empresas no Brasil e exterior;  - Implantação de sistema de reconhecimento automático de documentos (RAD) no Banco Real / Santander (viagens por todo o Brasil);  - Implantação sistema compensação Banco Santander, liderança em projetos e viagens;  - Experiência em empresas da área financeira, bancos, multinacionais e de grande porte;  - Segurança da informação: Servidores antivírus e proteção de dados;  - Implantação de redes LAN / WAN, incluindo equipamentos de rede, estações e servidores;    DEMAIS PROJETOS REALIZADOS:  - Morei na Inglaterra por 3 meses, durante o intercambio, realização de alguns projetos “freelance”;  - Liderança de equipes de TI no banco Santander e projetos em todo o Brasil e alguns países;  - Experiência de morar em Londres por três meses (maio a julho – 2014);  - Coordenação de projeto de reestruturação de rede de todo o Porto de Santos (SP – Santos - Guarujá);  - Coordenação de migração de servidores e sistema da rede de restaurantes McDonalds;  - Projeto de migração de toda a rede do Grupo Pão de Açúcar e Hospital São Luiz;  - Projeto de migração de toda a rede de computadores de uma das concessionárias BMW;  - Políticas de segurança de servidores Windows (GPO) nas empresas, Active Directory e todas as suas ferramentas;  - Administração avançada em servidores Windows (2000, 2003, 2008R2, 2012);  - Experiência de residência em algumas empresas de grande porte como: Novartis, Dupont, Rhodia, Unilever, MARS, Mcdonalds, Bancos: Bradesco, Itau, Real, Santander, etc;  - Implantação de diversos serviços de servidores Windows (AD, DNS, DHCP, RAS, GPO, etc);  - Implantação de Storages HP e EMC (Clariion – Powerpath – Navisphere), SAN, NAS, VMAX, VNC;  - Inúmeros projetos de TI realizados e viagens por todo o Brasil, Argentina, Colômbia, EUA e Europa (Reino Unido, Rússia, Suíça, Alemanha, Holanda, Bélgica, Portugal, Espanha, Itália, Franca, Reino Unido).    IDIOMAS  Inglês: Avançado - Intercambio em Londres (Mai-Jul 2014)  Espanhol: Intermediário.    CURSOS   2014:   Intercambio Inglaterra – Milner School of English (Londres); MCSA Windows Server 2012; EMC Roadmap;  2013:   VMWARE vCenter 5.1, VCOPS, SRM, Chargeback; Citrix XEN server; EMC VPLEX; Virtualizacao datacenter, redes e storage;  2012:   ITILv3, COBIT 4.1, MCITP Windows Server 2008, Windows Server 2012, Windows 8, TSM – IBM, EMC, VMWare;  2008:   Mac, Linux (LPI), Cisco CCNA, equipamentos Dell e EMC Storage (diversos); Clusterização, Virtualização, servidores antivírus Mcafee ePO, DLP, proteção e segurança da informação), Symantec (ferramentas de backup), ERP, Segurança de Redes, VPN, MS SQL Server, Web Services;  2004:  MCSE Windows 2003, Exchange, System Center,   2000:  MCSE Windows 2000, HP University: Diversos cursos e certificações dos produtos HP (servidores, storages, desktops, softwares, etc); && None && None && None && None && None && None","July 2010 to Present && March 2014 to May 2014 && March 2010 to February 2012 && November 2007 to June 2010 && January 2006 to June 2007 && June 2000 to October 2006 && October 1996 to May 2000 && 1994 to 1994","Senior Support Analyst (IT Architecture) && Analista de TI Senior && Professor of Professional IT Education && Senior Support Analyst - Team Leader IT && Network Administrator && Support Analyst && Support Analyst && Estagiario TI","São Paulo, SP","University Nove de Julho && University Nove de Julho","2010 && 2000 to 2003","MBA && BA in Network Computers","IT Analyst  • Professional with more than 16 (sixteen) years of experience in IT;  • Various specializations and certifications, specialties, people management and project leadership. More than 54 specialized IT courses.  • Lecturer, coordination, leadership and execution of various projects and trips throughout Brazil, Latin America and Europe."
"26","Additional Information • Aplicativos - Pacote Office, Photoshop, Adobe, Notepad ++, Essbase Outline Extractor, WinRAR, WinZIP.  • Desenvolvimento - Minitab, NamoWebEditor 3.  • Sistema Operacional - Windows.   • Para prossecução do idioma espanhol, experiência nos países Argentina, Chile e Paraguai.","Oracle Planning and Budgeting Cloud (PBCS), Hyperion Planning (HP), Hyperion Strategic Finance (HSF), Hyperion Performance Scorecard (HPS), Oracle Scorecard and Strategy Management (OSSM), Web Analysis (WA), Financial Reporting (FR), Oracle Business Intelligence Enterprise Edition (OBIEE), Essbase, Excel Add-In, Smart View for Office e Enterprise Performance Management Architecture (EPMA) (10+ years)","CIS Corporate - São Paulo, SP && Technolab Sistemas de Gestão e Soluções Integradas do Brasil LTDA - São Paulo, SP && Ninecon Consultores Associados Ltda - São Paulo, SP && TO Brasil Consultoria em Tecnologia da Informação - São Paulo, SP && Ninecon Consultores Associados Ltda - São Paulo, SP","Soluções de arquitetura, infraestrutura e desenvolvimento com as ferramentas Oracle Enterprise Performance Management e Business Intelligence, nas áreas de Outsourcing e Projetos.  Soluções de EPM para: Demonstração de Resultados - DRE, Balanço Patrimonial, Fluxo de Caixa Direto, Fluxo de Caixa Indireto, Orçamento de RH, Investimentos, Vendas, Despesa, Projetos, análise de cenários (realizado, orçamento, forecast, business plan) e simulações de cenários.   Participação nos projetos: CEMIG, Algar Agro. && Soluções de arquitetura, infraestrutura e desenvolvimento com as ferramentas Oracle Enterprise Performance Management e Business Intelligence, nas áreas de Outsourcing e Projetos.  Soluções de EPM para: Demonstração de Resultados - DRE, Balanço Patrimonial, Fluxo de Caixa Direto, Fluxo de Caixa Indireto, Orçamento de RH, Investimentos, Vendas, Despesa, Projetos, análise de cenários (realizado, orçamento, forecast, business plan) e simulações de cenários.   Participação nos projetos: Renova Energia, Natura, Prosegur. && Definição de arquitetura e desenho conceitual, construção de testes de prova para clientes, liderança de equipe em projetos para soluções Oracle Enterprise Performance Management e Business Intelligence. Atuação no ciclo de  vendas e geração de novas demandas. Atuação no suporte EPM/BI nivel Brasil.  Soluções de EPM para: Demonstração de Resultados - DRE, Balanço Patrimonial, Fluxo de Caixa Direto, Fluxo de  Caixa Indireto, Orçamento de RH, Investimentos, Vendas, Despesa, Projetos, análise de cenários (realizado,  orçamento, forecast, business plan) e simulações de cenários.  Construção de ciclo de aprovações, lista de tarefas para as ferramentas Hyperion Planning e treinamento para key-  Users.  Participação nos projetos: Leroy Merlin, MPD, M. Dias Branco, ODEBRECHT AGROINDUSTRIAL, Supervia Trens  Metropolitanos, Magazine Luiza, Starbucks Coffee Company. && Soluções de arquitetura, infraestrutura e desenvolvimento com as ferramentas Oracle Enterprise Performance  Management e Business Intelligence.  Soluções de EPM para: Demonstração de Resultados - DRE, Balanço Patrimonial, Fluxo de Caixa Direto, Fluxo de  Caixa Indireto, Orçamento de RH, Investimentos, Vendas, Despesa, Projetos, análise de cenários (realizado,  orçamento, forecast, business plan) e simulações de cenários.  Construção de ciclo de aprovações, lista de tarefas para as ferramentas Hyperion Planning e treinamento para key-  Users.  Participação nos projetos: Edenred - Ticket, Petroquímica SUAPE - PQS, Banco do Brasil. && Soluções de arquitetura, infraestrutura e desenvolvimento com as ferramentas Oracle Enterprise Performance  Management e Business Intelligence. Desenvolvimento de POC's, participação em pré-vendas.  Soluções de EPM para: Demonstração de Resultados - DRE, Balanço Patrimonial, Fluxo de Caixa Direto, Fluxo de  Caixa Indireto, Orçamento de RH, Investimentos, Vendas, Despesa, Projetos, análise de cenários (realizado,  orçamento, forecast, business plan) e simulações de cenários.  Construção de ciclo de aprovações, lista de tarefas para as ferramentas Hyperion Planning e treinamento para key-  Users.  Participação nos projetos: PWC, Unigel, Gol Linhas Aéreas, WTorre, Yamaha, Equipav, C.Vale, Indústrias ROMI SA.","July 2016 to Present && February 2016 to July 2016 && October 2014 to February 2016 && March 2013 to October 2014 && August 2010 to March 2013","Consultora Senior BI & EPM && Consultora Senior BI & EPM && Consultora Senior BI & EPM && Consultora Senior BI & EPM && Consultora Pleno BI & EPM","São Paulo, SP","Fundação Getúlio Vargas FGV Santo André, SP && University of California Irvine, California, US && Fundação Escola de Comércio Álvares Penteado São Paulo, SP","2013 && 2013 && 2005","MBA in Gestão Financeira, Controladoria e Auditoria && MBA in Business and Management for International Professionals && Graduação in Administração de Empresas","Funcional  Domínio em:  • Oracle Planning and Budgeting Cloud (PBCS);  • Oracle Hyperion Planning (HP);  • Oracle Essbase (EAS);  • Oracle Hyperion Strategic Finance (HSF);  • Oracle Hyperion Performance Scorecard (HPS);  • Oracle Scorecard and Strategy Management (OSSM);  • Oracle Hyperion Workspace;  • Enterprise Performance Management Architecture (EPMA);  • Oracle Hyperion Shared Services;  • Oracle Hyperion Financial Reporting (FR);  • Oracle Hyperion Web Analysis (WA);  • Oracle Business Intelligence Enterprise Edition (OBIEE).  • Oracle Financial Data Management (FDM);  • Smart View for Office;  • Excel Add-in;  • Oracle Siebel On Demand.    Conhecimento sobre:  • Microsoft Dynamics CRM;  • Oracle Hyperion Enterprise.    Técnico  Domínio em:  • Oracle Planning and Budgeting Cloud (PBCS);  • Oracle Hyperion Planning (HP);  • Oracle Essbase (EAS);  • Oracle Hyperion Strategic Finance (HSF);  • Oracle Hyperion Performance Scorecard (HPS);  • Oracle Scorecard and Strategy Management (OSSM);  • Oracle Hyperion Workspace;  • Enterprise Performance Management Architecture (EPMA);  • Oracle Hyperion Shared Services;  • Oracle Hyperion Financial Reporting (FR);  • Oracle Hyperion Web Analysis (WA);  • Oracle Business Intelligence Enterprise Edition (OBIEE).  • Smart View for Office;  • Excel Add-in;    Conhecimento sobre:  • Oracle Data Integrator (ODI);  • Oracle Financial Data Management (FDM);  • Oracle Hyperion Interactive Reporting (Query/Results/Pivot);  • Oracle Hyperion Application Link - HAL."
