"CandidateID","Additional-Info","Skills","Work-Experience__Company","Work-Experience__Job-Description","Work-Experience__Job-Duration","Work-Experience__Job Title","Location","Education__Institute","Education__School-Duration","Education__Qualification","Resume-Summary"
"0","Additional Information • Gerenciamento de Projetos  • Análise Orientada a Objetos  • Contabilidade, Folha de Pagamento, e outras rotinas administrativas  Estagiário em Vendas de Imóveis - Lopes Imobiliária, 2016, São Paulo (6 meses)  • Ciência de Dados, Python, Linguagem R (estudante online desde 2016 através do Coursera e edX)","COBOL (10+ years), CICS (10+ years), VSAM (10+ years), DB2 (10+ years), Mainframe (10+ years), Excel Avançado (10+ years), Word Avançado (10+ years), Microsoft Office (10+ years), Análise de Sistemas (10+ years), Contabilidade (10+ years), Digitação (10+ years), HTML Avançado (5 years), Inglês Intermediário (10+ years), Java Intermediário (5 years), JavaScript Avançado (5 years), Marketing Digital (3 years), Office Avançado (10+ years), Power Point Avançado (10+ years), Pacote Office (10+ years), Sistemas de Informação (10+ years), Tecnologia da Informação (10+ years), XML Avançado (3 years)","EMPREENDEDOR INDIVIDUAL - São Paulo, SP && Fidelity Information Service - São Paulo, SP && Banco do Brasil - Brasília, DF && Telemig - Belo Horizonte, MG && TEKSID DO BRASIL LTDA - Betim, MG && Betim Diesel Motores e Veículos Ltda - Betim, MG && FMB Produtos Metalúrgicos Ltda. - Betim, MG","• Criei site de e-commerce baseado na plataforma Magento, integrado a meios de pagamento  • Criei blogs Wordpress para clientes  • Lancei versão experimental de app Android para ajudar a escolher gasolina ou álcool no reabastecimento  • Gerenciei campanhas de Facebook Ads e Google AdWords para meus clientes  • Desenvolvi projeto de SEO - Search Engine Optimization - para clientes de uma agência  • Experiências: Magento, Wordpress, web hosting, Android, PHP, MySQL, Apache, LAMP, CSS, HTML, Javascript && • Analisei, codifiquei e testei mudancas em rotinas on-line e batch do processamento de Cartões de Crédito  • Apliquei melhorias de performance em rotinas obtendo ganhos médios de 30% em consumo de recursos  • Coordenei atividades de equipe de desenvolvimento de software  • Participei da migração de cartões do extinto banco ABN interagindo com equipes dos E.U.A. e Índia  • Participei da implentação, migração de dados,e parametrização de Sistema de Processamento Contábil  • Experiências: Análise Estruturada de Sistemas, Análise de Requisitos, documentação de sistemas, testes, homologação e implementação em ambiente de produção. Ferramentas: D.F.D., M.E.R., U.M.L. Rational Tools. Mainframe: COBOL, CICS, VSAM, DB2, JCL, TSO, ENDEVOR. Sistemas B2K e Vision Plus. && • Analisei, codifiquei e testei mudancas em rotinas on-line e batch do processamento de Cartões de Crédito  • Integrei time de Contabilidade por Eventos - um sistema EIS - Executive Information Systems, que extraiu informações dos mais diversos sistemas bancários, como : folha de pagamentos, tributos, contas correntes, poupança, seguros, operações de crédito, cartões de crédito, leilões, e inúmeros outros  • Desenvolvi soluções customizadas para o processo de Autorizações de transações do Cartão de Crédito  • Experiências: Análise Estruturada de Sistemas, Análise de Requisitos, documentação de sistemas, testes, homologação e implentação em ambiente de produção. Ferramentas: D.F.D., M.E.R., U.M.L. Rational Tools, ER-WIN, BP-WIN. Mainframe: COBOL, CICS, VSAM, DB2, JCL, TSO, ENDEVOR. B2K e Vision Plus Systems. && • Desenvolvi projeto lógico de Data Mining para gerar um Sistema de Apuração Tributária  • Realizei entrevistas com usuários e analistas responsáveis por diversos sistemas corporativos, como Faturamento, Contas a Pagar e Gerenciamento de Contratos.  • Experiências: Análise Estruturada de Sistemas. Ferramentas: D.F.D., M.E.R., U.M.L. Rational Tools, ER-WIN, BP-WIN. Mainframe: NATURAL/ADABAS, JCL, COM-PLETE. && • Implantei melhorias no Sistema de Exportação - SISFATEX  • Integrei o SISFATEX ao sistema de Faturamento em Mainframe   • Implementei geração de novos relatórios gerenciais  • Experiência: Clipper 5.1, Lotus 1-2-3, Redes Novell e Lantastic, STM-400 network, X-25, RENPAC && • Desenvolvi Sistema de Estatísticas do Estoque  • Treinei funcionários no uso de Windows, Word, Excel e no Sistema Corporativo (ERP) da empresa  • Gerenciei controle de manutenção de infra-estrutura de T.I. junto a empresa terceirizada  • Realizei transmissões de dados para bancos no padrão CNAB, em redes como X-25, STM-400 e RENPAC  • Experiências: Clipper 5.1, Dataflex 3.0, Novell network, STM-400 network, X-25, RENPAC && • Desenvolvi Sistema de Controle de Exportação, com funções de apuração de Custo de Distribuição e Variação Cambial  • Integrei departamentos internos (Exportação e Financeiro) com entidades externas (agentes de contratos de câmbio)  • Centralizei informações em uma base corporativa, reduzindo o tempo de cálculo dos resultados  • Realizei transmissões de dados para bancos no padrão CNAB, em redes como X-25, STM-400 e RENPAC  • Instalei e configurei redes Novell e Lantastic  • Experiência: Clipper 5.1, Lotus 1-2-3, Redes Novell e Lantastic, STM-400 network, X-25, RENPAC","September 2014 to December 2015 && November 2006 to September 2014 && October 1997 to November 2006 && January 1997 to October 1997 && April 1995 to September 1996 && September 1993 to April 1995 && September 1991 to June 1992","Web Developer && Analista de Sistemas Senior && Analista de Sistemas Sênior && Analista de Sistemas && Analista de Sistemas && Programador de Computador && Analista de Sistemas","Carmo do Paranaíba, MG","UNIP Universidade Paulista São Paulo, SP && ESULTRA Belo Horizonte, MG && Instituto Adventista de Ensino São Paulo, SP","January 2011 to December 2012 && January 1989 to December 1989 && January 1984 to December 1985","Associate in Associate Degree in Computer Information Technology && Técnico in Análise Estruturada de Sistemas && Técnico in Contabilidade","None"
"3","Additional Information Sou graduada em Publicidade e Propaganda pela Faculdade 7 de Setembro.  Experiências anteriores: Web Analytics - Métricas, Performance e Inteligência na empresa SG Propag, Analista de Marketing (Sênior) na empresa Ovo de Colombo Comunicação Ltda e Supervisora de Marketing na agência de publicidade Clube Fiel Serviços Ltda, onde tive oportunidade de desenvolver e aprimorar habilidades no âmbito do Marketing, atuando em gestões de projeto, planejamento estratégico e inteligência de mercado.  Possuo conhecimento em SEO, Analytics, Google Adwords, Facebook e Instagram ADS, programas de editoração e tratamento de imagens.   Proativa, criativa e dinâmica, objetivo desempenhar meu trabalho de forma eficaz, atendendo as necessidades da empresa.","Inglês Básico, Espanhol Básico, Word, Excel e PowerPoint, Photoshop, Illustrator, SEO, Analytics, Facebook ADS, WordPress, HTML Básico","SG Propag - Fortaleza, CE && Ovo de Colombo Comunicação - Fortaleza, CE && Clube Fiel Serviços Ltda - Fortaleza, CE && NOIX Internet - Fortaleza, CE && Coisas di Maria - Fortaleza, CE && MT Coaching - Fortaleza, CE && Faculdade 7 de Setembro - FA7 - Fortaleza, CE","Desenvolvimento de campanhas estratégicas. Execução, monitoramento e métricas de anúncios patrocinados: Google Adwords, Facebook e Instagram ADS. Análise e relatórios de resultados. Acompanhamento e análise de ações nas Mídias Digitais. Análise da presença de marcas e dos seus devidos concorrentes no âmbito do digital. && Responsável pelo desenvolvido de estratégias digitais para as empresas do grupo CADIS3: SJ Administração de Imóveis, Hotel Verdegreen, iu-á Hotel e Instituto DimiCuida.  Elaboração de texto publicitário para as redes sociais. Análise e desenvolvimento de postagens e anúncios para as redes sociais. Análise de concorrentes no âmbito do Marketing Digital. Planejamento estratégico. Elaboração de relatórios de resultados. Ações de endomarketing e assistência em eventos do grupo de empresas. && Planejamento estratégico mensal, trimestral e anual para se atingir o mercado e público alvo. Desenvolvimento e monitoramento de campanhas patrocinadas: Google Adwords, Facebook e Instagram ADS. Análise de métricas e relatórios de resultados. Comunicação com a cartela de clientes: atendimento e consultoria. Supervisão e monitoramento do trabalhado desenvolvido pela equipe de Analistas a fim de mensurar a qualidade das publicações elaboradas para as mídias sociais. Supervisão da manutenção de sites e redes sociais, planejamento de ações de SEO e análise Analytics. && Responsabilidades  - Planejamento de Marketing Digital  - Análise, estratégia e desenvolvimentos de campanhas   - Análise de Métricas Digitais  - Manutenção de sites e Redes Sociais   - Gerência de páginas e perfis nas Redes Sociais  - Produção de relatórios de resultado   - Produção de conteúdo estratégico para as Redes Sociais   - Ações de SEO (básico)  - Relatórios e análise Analytics  - Planejamento, desenvolvimento e análise de campanhas de Facebook ADS    Realizações  - Campanhas de Facebook ADS  - Análise de presença online e resultados   - Ações estratégicas para o meio digital    Habilidades  - Proatividade   - Competência   - Criatividade   - Responsabilidade   - Organização && Responsabilidades  Desenvolvimento de conteúdo e alimentação de redes sociais. Criação de textos publicitários para veiculação. Acessória e cobertura de editoriais fotográficos. Manipulação edição de imagens. Pesquisa e coleta de dados para materiais de divulgação.    Realizações  - Cobertura Fotográfica   - Tratamento de imagens  - Desenvolvimento de conteúdo para as redes Sociais && Responsabilidades  Desenvolvimento e processo criativo de Mídias Sociais. Desenvolvimento, configuração e envio de e-mail Marketing. Criações de elementos gráficos, manipulação de imagens e afins. Desenvolvimento e análise de estratégias de Marketing para campanhas institucionais e promoções. Criação e Manutenção de peças gráficas para projetos. Análise, acompanhamento e criação de layouts nas redes sociais. && Responsabilidades  Cobertura de eventos da instituição. Tratamento e manipulação de imagens a partir de programas gráficos de vetorização e criação (Photoshop e Illustrator). Auxílio na realização de catálogos e ensaios fotográficos.","2016 to 2017 && November 2016 && October 2015 to July 2016 && January 2015 to September 2015 && August 2014 to October 2014 && September 2013 to June 2014 && February 2010 to December 2010","Web Analytics - Métricas, Performance e Inteligência && Analista de Marketing Sênior && Supervisora de Marketing && Analista de Marketing Pleno && Assistente de Marketing && Estagiária de Marketing && Monitora Fotográfica","Fortaleza, CE","Faculdade 7 de Setembro - FA7 Fortaleza, CE","2010 to 2014","Bacharelado in Publicidade e Propaganda","None"
"4","Additional Information QUALIFICAÇÕES E ATIVIDADES COMPLEMENTARES    • Cursos na área de departamento pessoal, como desoneração folha de pagamento, e-social, empregador web.  • Seminário gestão em tempos de crise -Faculdade Estácio de sá - (2015)  • Curso assistente administrativo - Senai (2006)","word,Excel,Gestão de Pessoas","Senior Contabilidade - Belo Horizonte, MG && Cadar Engenharia Construções && BSP Foods","Principais atividades: Fechamento de folha de pagamento, férias, admissão, rescisão, decimo terceiro, desoneração folha de pagamento, homologação em sindicatos RAIS, CAGED, SEFIP, DIRF e demais rotinas inerentes ao setor. && Principais atividades:Apuração de ponto, fechamento folha de pagamento, férias, decimo terceiro, admissão, rescisão, homologações, controle de aso admissional, periódico, demissional, pcmso, RAIS, CAGED, DIRF, SEFIP e demais rotinas inerentes ao setor && principais atividades: Fechamento e abertura de caixa, controle de estoque, treinamento a novos colaboradores, controle de ponto dos funcionários, fechamento de ponto, controle de aso, atendimento ao cliente.","2012 to Present && 2011 to 2012 && 2010 to 2011","Aux.De Pessoal && Assistente departamento Pessoal && Assistente de Gerencia","Belo Horizonte, MG","Estácio de sa Belo Horizonte, MG","2013 to 2015","Graduação in Recursos Humanos","Sou uma pessoa dinâmica com enorme facilidade de comunicação e assimilação de informação, gosto de trabalhar em equipe e de me relacionar com as pessoas, busco uma oportunidade de trabalho que possa me oferecer oportunidades de crescimento, além de aperfeiçoar os conhecimentos já adquiridos através de experiências profissionais e na faculdade, na área de departamento de pessoal."
"6","Additional Information COMPUTER SKILLS.  C#, Action Script 3, .Net, JQuery, Javascript, Backbone JS, C, Java, PHP,  JSP, Automated Concordion testing, FileNet P8, XML, XAML, CSS,  Windows 8 App, MySQL, SQL, Oracle, SQL Server, Postgres SQL, JSF,  Hibernate, PrimeFaces, Spring MVC, Struts, WebSphere, AngularJS    2","Java (4 years), Java Programming (4 years), PHP (2 years), AngularJS (1 year), .NET (2 years), C# (2 years), Oracle (3 years), SQL (4 years)","Spassu Tecnologia e Serviços - Salvador, BA && Sonda Procwork - Petrobras - Salvador, BA && Solutis Technology - Salvador, BA && C.E.S.A.R - Sorocaba, SP && Reconcavo Institute of Technology - Salvador, BA && MCM Cintra Damião - COMPARATTO - Salvador, BA","Development and maintenance of systems using Java Web, HTML5 and AngularJS.  Primary computer skill used: Java && Development and maintenance of systems with EDM(Electronic  Document Management) technology, using Java web platforms, Swing,  HTML5 and IBM FileNet P8.  Primary computer skill used: Java && Development of web systems for public management, using the .NET and Java platform.  Primary computer skill used: Java && Center for Studies in Advanced Systems of Recife (C.E.S.A.R)  HP Residence in Windows 8. Development of C# applications with  XAML.  Primary computer skill used: C# && Development of educational objects in AS3 integrated with Flash.  Applications using Flex with Java.  Primary computer skill used: Action Script 3 && the ERP system. WEB Module Development in  PHP to aid administrative procedures, database manipulation (Postgres,  MySQL).  Primary computer skill used: PHP","January 2016 to November 2016 && May 2014 to January 2016 && September 2013 to May 2014 && February 2013 to August 2013 && August 2011 to February 2013 && June 2010 to August 2011","Senior Systems Analyst && Full Systems Analyst && Junior Systems Analyst && Software Developer && Software Developer && Technical support","Lauro de Freitas, BA","Federal University of Bahia Salvador, BA && Center for Studies in Advanced Systems of Recife (C.E.S.A.R) Sorocaba, SP && UNIME-FCT Salvador, BA && School of Art. Game and Animation Salvador, BA","2016 to 2018 && 2013 to 2013 && 2008 to 2013 && 2010 to 2011","Master in Computer Science && Software Residency in C# Certification by CESAR && Bachelor in Information Systems && Specialization in Adobe Certification Couse","None"
"8","Additional Information Currículo:  https://docs.google.com/document/d/1xEovtAZZNMbcmdAa7jAA900uDFIS4LGMxoP0C9ZhaRM/edit?usp=sharing","Linguagens: Python, PHP, Shell Script;, Segurança: Normas PCI DSS e ISO, pfSense, iptables, WEB;, Backup: Backula, Amanda, Storages (iSCSI, NFS);, Virtual Machine: VMWare vCenter, KVM, XEN e OpenStack;, Gestão de Projetos: Jira, TRAC, Subversion, PMI, ISO;, Teste de equipamentos: Python e TestLink;, Banco de Dados: MySQL, PostgreSQL e SQL Server;, Monitoramento e benckmark: Zabbix, OMD Distro, Kibana, New Relic, Monitis e Sealion;, Rede: switchs Furukawa (AsGa), HP, Enterasys, BIG IP LTM/GTM e HAproxy;","Catho Online - Barueri, SP","- Participação em planejamento e construção de infraestrutura para  atender à certificação PCI-DSS;  - Manutenção da infraestrutura física e virtual de servidores - WEB, DB,  Cache, Monitoramento e etc - que comportam os produtos  desenvolvidos e comercializados pela empresa;  - Experiência em “Moving” de servidores entre DC;  - Implementação de sistema de monitoramento e benchmark para a  infraestrutura e portal WEB;  - Apoio ao desenvolvimento através de implementação de infraestrutura  de desenvolvimento e benchmarking;  - Elaboração e aplicação de planos de redundância para serviços internos  (AD, Proxys, HAProxy e etc.) e externos (LTM);  - Manutenção de dispositivos de redes (F5 Big IP LTM e GTM);  - Participação em planejamento e execução de políticas de segurança.","May 2015 to Present","Administrador de Sistemas Linux Senior","Barueri, SP","UNIP - Limeira Limeira, SP","2010 to 2011","Superior Completo in Redes de Computadores","Administrador de Sistemas Linux e DevOps"
"9","None","Desktops, Mobiles,Servidores ,Infra e Impressoras HP e Dell Android e Iphone Rede e fluxo de dados Banco de Dados Microsoft SQL até versões 2012 e 2014 Oracle até a Versão 9i Pacote Office 2016 Outlook,Word,Excel,Powerpoint,Access e One Note Programação Visual Fox Pro, nível intermediário. SAP-Abap Foundations Reports – Relatórios Montagem de apresentações em Microsoft Report Apresentações de Visões Administrativas e controles para Diretoria e Gerencia Powerpoint Advanced QlikView – Agrupamentos de Multiplas Planilhas e criação de Dashboards com Exibições Gráficas para Acompanhamento. Software , Processos , Metodologias de Controles SAC , CRM, WORKFLOW , PMO ,BUDGET-ORÇAMENTO POR CENTRO DE CUSTO Atendimento 0800 Net com chamados SLAS e medição dos tempos e métodos. Rede e fluxo de dados Cabeada e Wireless- WIFI -com repetidores e firewell e-Business e E-Commerce Oracle ATG , desenvolvimento e planejamento estratégia de negócios Linx B2C Ambiente Linx - Toda a rotina empresárial, contábil e financeira Implanto, dou treinamento em todos níveis e suporte, se preciso aciono a LINX. Dominio total dos produtos LINX Loja Varejo, Atacado, Logistica de armazéns , Oficinas e PCP. Linx ERP Linx POS Datasynk ETL Linx Microvix – Readaptando e atualizando Linx Franchising Linx B2c Linx WEB Integrados Wise Sale para show room Portais Linx e FFC- Notas Fiscais e Apurações de SPED, Composição de Inventários de estoque por valorização. Apoio nos fechamentos mensais, semestrais e ou anuais e auditorias. (10+ years)","Inbrands SA && Empresa vinculada ao antigo grupo DASLU && Consultoria Linx e-Business","• Responsável Apoio e Suporte na Retaguarda de E-commerce Linx B2C, 10 marcas e Sites  • Workflow - Fluxo de pagamentos e aprovações integrados ao LINX ERP.  • 0800 NET - Manager -Mantenedor -Software de Help Desk, solução de organizações, incluído RH e Financeiro, Cobrança etc. && rede de lojas e retaguarda.  • Loja Conceito, Projeto inovador, Continuidade Glamour && ênfase em expansão, suporte e fechamentos de metas.  • ""Montei a minha própria empresa de prestação de serviços atendendo clientes que utilizavam a plataforma Linx.  • Todo o tipo de suporte e cobrindo os GEPS e Desenvolvendo, formando opiniões e passando as empresas, usuários e gestores os detalhes e complexidades de todos os processos.  • Alguns clientes atendidos nesse período:  • Reinaldo Lourenço, HUIS CLOES, NK Store, Spezzatto, Maria Garcia, Bunnys, Luiggi Bertolli, Octogono entre outras ""","2014 to 2017 && 2012 to 2014 && 2007 to 2012","Analista Senior && Analista de Sistemas Coordenador && Administrador - Analista de Sistemas","São Paulo, SP","FMU","2012 to 2014","Informática","• Analista de Sistemas Senior"
"10","Additional Information Disponibilidade para atuar com autonomia, sem vínculos, free-lance, ou assumir responsabilidades contratuais.","Domínio da Web para usuários, Word, Power Point, Paint, elaboração de Painéis, Posts.","São Paulo, SP && Estrela Azul - Segurança Patrimonial Ltda - São Paulo, SP","Tenho banca própria de Advocacia Empresarial. Assessoria e Consultoria Jurídica no âmbito corporativo, carreira profissional em empresas de porte: Direito Civil, Comercial, Trabalhista, Administrativo, Constitucional, Contratos, Societário, Licitações. Contencioso em todos os ramos.     Gestão de equipes internas de área legal, interface com escritórios externos, representação em órgãos públicos. && Tenho exercido a função de Gerente Jurídico em organizações de porte, em empresas do Grupo Camargo Correa, Grupo Ultra e Estrela Azul. Liderar equipes internas, interface com escritórios externos, assessoria e consultoria empresarial - apoio à Diretoria e Gerências em suas atividades. Generalista, com várias Especializações. Direito Civil, Comercial, Administrativo, Imobiliário, Trabalhista. Contratos em geral, Societário, Marcas e Patentes, Licitações. Contencioso Administrativo e Judicial, em todas as fases e instâncias. Liderar equipes internas. Interface com escritórios especializados externos. Facilidade de redação de Contratos, documentos, compromissos. Análise e avaliação de documentos legais. Emissão de Pareceres, Orientações Legais. Representação em audiências. Representação em órgãos públicos, clientes, fornecedores, funcionários, sindicatos. Habilidades em Negociações.","September 2012 to Present && October 1998 to May 2003","Advogada Senior && Gerente Jurídico","São Paulo, SP","PUC-SP - Pontifícia Universidade Católica de São Paulo São Paulo, SP && FMU, Mackenzie, CEU São Paulo, SP","2000 to 2008 && 1992 to 2000","Especialização em Direito de Empresa - PUC-SP; in Ciências Jurídicas e Sociais && Extensões Universitárias em Direito Imobiliário, Direito do Trabalho, Direito Tributário in Ciências Jurídidas e Sociais","None"
"13","None","Dropwizard, HTML5, CSS, R, Linux, UML, Oracle, PL/SQL, Mysql, JBoss/Wildfly, Tomcat, SOAP-based Webservices, RESTful Webservices, Maven, Jenkins, TDD, Scrum, Python, Redis, EmberJS, Memcached, Docker, Docker Compose, Gradle, Microservices Architecture, Git, Java (8 years), Javascript (7 years), Java EE (JSF, JSP/Servlet, JPA, EJB, CDI, JMS) (7 years), Jquery (7 years), Angularjs (3 years), Spring Framework (MVC, Security) (7 years), AWS (2 years)","Tradier Inc. - Charlotte, NC && DevFactory - Austin, TX && Tradier Inc. - Charlotte, NC && Algar Tech - Belo Horizonte, MG && Sun Microsystems - Belo Horizonte, MG","None && None && None && None && None","July 2016 to Present && December 2015 to July 2016 && March 2015 to December 2015 && February 2010 to February 2015 && March 2009 to February 2010","Senior Software Engineer && Software Architect && Senior Software Engineer && Senior Software Engineer && Sun Campus Ambassador","Belo Horizonte, MG","CEFET-MG Belo Horizonte, MG && UNI-BH Belo Horizonte, MG","2013 to 2015 && 2008 to 2012","Master's in Computational Intelligence && Bachelor's in Computer Science","None"
