"CandidateID","Additional-Info","Skills","Work-Experience__Company","Work-Experience__Job-Description","Work-Experience__Job-Duration","Work-Experience__Job Title","Location","Education__Institute","Education__School-Duration","Education__Qualification","Resume-Summary"
"27","Additional Information Outros objetivos  • Região de trabalho  Preferência pela região de Rio das Ostras, Macaé Aceita considerar propostas de outras regiões.  Aceita viajar pela empresa.    Informações complementares  Sou de fácil relacionamento, tenho iniciativa, sou metódico e com fácil assimilação ao novo• Tenho aprendizagem rápida e eficiente. Administro bem o trabalho mesmo quando sob pressão e busco incessantemente atingir as metas estabelecidas• Excelente habilidade para planejar, organizar e priorizar o trabalho, trabalhando em equipe ou mesmo quando trabalhando sem supervisão.","Perfil profissional • Profissional com 24 anos de experiência na área de informática e área administrativa(RH e Contabilidade), sendo cinco anos em SAP-Modulo PM, MM e BW os anos anteriores na plataforma Mainframe. • Experiência em projetos como consultor SAP-BW:Atividades:levantamento, modelagem completa (Info Objetos, Cubos e ODS), extração, transformação e carga (ETL) das informações. otimização (re-modelagem) de Cubos e ODS. desenvolvimento de queries e web templates com enhancements em Javascript, HTML e CSS. Testes e validação de modelos para a migração técnica para versão 7.0 do SAP Netweaver -BW e dominio de Pacote Office(Word, Excel e PowerPoint). • Formação • Graduação TECNOLOGO EM PROCESSAMENTO DE DADOS, FACULDADE DA CIDADE (concluído em Dezembro/1991). TÉCNOLOGO EM LOGÍSTICA, Unicesumar (cursando até Dezembro/2016). Cursos Complementares Curso de BPM – focado no Gerenciamento de Processos de Negócio. Cursos Complementares Curso de PMDS – Modelagem de Equipamento e Tubulações, Senai-RJ (concluído em Agosto/2014). PROGRAMADOR DE COMPUTADOR, PUC-RJ (concluído em Dezembro/1991). SAP/BW 330, SAP/BW 310, SAP/BW 305, SAP/BW 315 SAP-PM, MM, SAP (concluído em Fevereiro/2006). Histórico profissional • (empresa de grande porte no segmento tecnologia e informática) Analista de Sistemas CLIENTE: PETROBRAS BACIA DE CAMPOS Experiência em projetos SAP modulo PM, MM e SAP-BW:Atividades:levantamento, modelagem completa (Info Objetos, Cubos e ODS), extração, transformação e carga (ETL) das informações. otimização (re-modelagem) de Cubos e ODS. desenvolvimento de queries e web templates com enhancements em Javascript, HTML e CSS. Testes e validação de modelos para a migração técnica para versão 7.0 do SAP Netweaver –BW, SISPAT, CRIAÇÃO DE RT´S e domínio de Pacote Office. • (empresa de grande porte no segmento tecnologia e informática) ANALISTA DE SISTEMAS CLIENTE: PETROBRAS BACIA DE CAMPOS Plataforma IBM: CS/ COBOL/ DB2/ ROSCOE/ TSOPlataforma WEB: HTML/ ASP/ JAVASCRIPT/ VBSCRIPTBanco de Dados: ORACLE/ PL/SQL • (empresa de pequeno porte no segmento tecnologia e informática) PROGRAMADOR SENIOR CLIENTE: PETROBRAS BACIA DE CAMPOS Plataforma IBM: CS/ COBOL/ DB2/ ROSCOE/ TSOPlataforma WEB: HTML/ ASP/ JAVASCRIPT/ VBSCRIPTBanco de Dados: ORACLE/ PL/SQL • (atividade autônoma) PROGRAMADOR PLENO CLIENTE: PETROBRAS BACIA DE CAMPOS Plataforma IBM: CS/ COBOL/ DB2/ ROSCOE/ TSOPlataforma WEB: HTML/ ASP/ JAVASCRIPT/ VBSCRIPTBanco de Dados: ORACLE/ PL/SQL • (empresa de pequeno porte no segmento tecnologia e informática) PROGRAMADOR CLIENTE: PETROBRAS BACIA DE CAMPOS Plataforma IBM: CS/ COBOL/ DB2/ ROSCOE/ TSOPlataforma WEB: HTML/ ASP/ JAVASCRIPT/ VBSCRIPTBanco de Dados: ORACLE/ PL/SQL • (empresa de médio porte no segmento tecnologia e informática) PROGRAMADOR PLENO CLIENTE: PETROBRAS BACIA DE CAMPOS Plataforma IBM: CS/ COBOL/ DB2/ ROSCOE/ TSOPlataforma WEB: HTML/ ASP/ JAVASCRIPT/ VBSCRIPTBanco de Dados: ORACLE/ PL/SQL","Sonda procwork, Spassu informática, DBA informática, Infotec e outras CLIENTE: PETROBRAS Bacia de campos e Rio de Janeiro. - Rio de Janeiro, RJ","Responsabilidades  Manter os sistemas sob minha responsabilidade operantes(manutenções evolutivas e corretivas), levantamento junto aos clientes para tratar futuras evoluções e planejar prazo e custos.","May 2014 to March 2016","Analista de Sistema Senior","Rio das Ostras, RJ","INOVPLAN Rio de Janeiro, RJ && SENAI-RJ Rio de Janeiro, RJ && UniCesumar Rio de Janeiro, RJ","July 2016 to July 2016 && 2014 to 2014 && None","Técnico de Planejamento in Planejamento && Curso PDMS in Projetos && Tecnologo em Processamento de dados e Cursando Logistica in Administração","Novos desafios"
"32","None","Inglês Avançado (6 years), Francês Básico (2 years), Espanhol Avançado (8 years)","IBF INDUSTRIA BRASILEIRA DE FILMES - Duque de Caxias, RJ && None && None","*Prospecção de clientes e envio de amostras;  *Cotação de fretes e seguros internacionais;  *Atendimento de carteira de clientes do mundo com ênfase atual na Europa e América do Norte;  *Análise de carta de crédito e confecção de certificados e documentos específicos, além de documentação padrão de exportação;  *Siscomex Web e Mantra, usuário confecção e manutenção de documentos de exportação - DE, DSE, RE; && como Assistente Comercial Receptivo:  Atendimento e suporte ao cliente instruindo sobre procedimentos de viagem e resolução de questões imediatas à prestação do serviço. Elaboração e negociação de tarifas com os parceiros receptivos, inserção de informações e tarifas no sistema First Class. Auxílio na organização de planilhas tarifárias e atrações do evento Rio Weekend 2012 da rede  hoteleira Club Med. && Suporte ao setor comercial nos sub-setores de pacotes, hospedagem, eventos e  receptivo. Elaboração e manutenção de planilhas tarifárias, com informações relativas  aos empreendimentos hoteleiros e seus serviços oferecidos para consulta e uso-fruto dos  consultores de viagens. Elaboração e inserção de pacotes de viagens com condições  diferenciadas em site específico. Auxílio na organização de planilhas tarifárias e  atrações do evento Rio Weekend 2011 e Exalta Weekend 2011 da rede hoteleira Club  Med. Organização periódica e arquivo de documentos e acordos comerciais, suporte aos  stakeholders da empresa.","March 2012 to Present && 2012 to 2012 && 2011 to 2012","Analista de Exportação senior && Litoral Verde Operadora de Turismo && Litoral Verde Operadora de Turismo como Estagiária Comercial","Rio de Janeiro, RJ","Consorcio Cederj UFF Petrópolis, RJ && IBMR Laureate Universities Rio de Janeiro, RJ && CEFET Petrópolis, RJ","January 2013 to December 2018 && October 2013 to February 2016 && January 2009 to December 2011","Graduação bacharelado in Administração && Pós graduação in MBA em Comércio Exterior e Internacional Business && Graduação in Gestão de turismo","Tenho como objetivo o aperfeiçoamento de meus conhecimentos dos processos  operacionais e logísticos em comércio exterior, assim como maior desenvolvimento das  habilidades e práticas de gestão do processo de negociação internacional."
"33","Additional Information CONHECIMENTOS:   Javascript:  AngularJS  Node.js  GSAP/TweenMax  Redux  RxJS  Gulp  Webpack  Jasmine  Karma  Apache Cordova  TypeScript  Angular2  PHP  Symfony  Doctrine  PHPSpec  PHPUnit  Codeception  Behat  CSS  SASS/SCSS  LESS  Bootstrap 3 / 4  Metodologias / Outros  Scrum  TDD  CI  User Experience  Design Thinking  PWAs  GraphQL","JavaScript Avançado (7 years), PHP Avançado (7 years), Typescript (2 years), Symfony (4 years), Doctrine (4 years), RxJs (1 year), HTML Avançado (7 years), CSS Avançado (7 years), Redux (1 year)","Vivere / Accenture - São Paulo, SP && shape.art - São Paulo, SP && André Godoi comunicação completa - São Paulo, SP","Manutenção de projetos em AngularJS com testes unitários e End-to-End. Arquitetura e desenvolvimento de novos projetos utilizando AngularJS 1.6+ e Angular 2. Desenvolvimento de prova de conceito utilizando GraphQL. && Desenvolvimento de sistemas e aplicações web, sites institucionais, animações, jogos.  Planejamento e criação de MVPs e sistemas para startups.  Implementação e configuração de campanhas de marketing. && Criação de sites, sistemas, animações, banners animados e jogos.  Implementação e configuração de campanhas de marketing.  Administrador do Google Engage ( atual Google Partners)","September 2016 to Present && January 2014 to September 2016 && December 2010 to December 2012","Senior Frontend Developer && Desenvolvedor FullStack && Desenvolvedor Fullstack","São Paulo, SP","SENAC São Paulo, SP","January 2012 to June 2014","Superior in Análise e Desenvolvimento de Sistemas","None"
"34","None","Informática Básica e Avançada e Excel Básico","Stefanini IT Solution - Aracaju, SE && INDRA BRASIL SOLUCOES E SERVICOS TECNOLOGICOS SA - Aracaju, SE && CENTRAL 24 HORAS/ CIOSP - Aracaju, SE && Chagas Ramos Advocacia - Aracaju, SE && ESCOLA PADRAO - Aracaju, SE && INFOPEQ – INSTITUTO DE FORMAÇÃO E PESQUISA LTDA - Aracaju, SE && Projeto PROFAE / SOCIEDADE DE FORMAÇÃO PROFISSIONAL LUZ-SOFOPROL/MINISTÉRIO DA SAÚDE - Aracaju, SE","1. Técnica de Suporte/Manutenção - Coordenadora da Equipe de Técnico de Redes. && 1. Técnica de Suporte/Manutenção - Coordenadora da Equipe de Técnico de Redes.     -Configuração das contas de correio eletrônico (E-mail). Definir controle de acesso de banda à WEB Instalar e manter a comunicação digital. Instalar, configurar e atualizar programas de Anti-Vírus e Anti-SpyWares.     - Criação de procedimentos de restrição do acesso e utilização da rede, como senhas, eliminação de drives.    - Confecção de Projeto Básico na Área de TI.     - Administradora Geral da SSP do Expresso Email e E-Doc.     - Administradora da Intranet/SSP/SE && None && None && None && None && None","November 2016 to Present && September 2013 to November 2016 && 2013 to 2013 && 2012 to 2012 && 2010 to 2012 && 2005 to 2009 && 2004 to 2005","Tecnica de suporte senior && TECNICA DE SUPORTE && Coordenadora de Telemarketing && Estagiária && Diretora Administrativa && Coordenadora Administrativa e Financeira && Auxiliar Administrativa","Aracaju, SE","FASE Aracaju, SE && ESCOLA PADRAO Aracaju, SE && ESCOLA PADRAO Aracaju, SE && COLEGIO GABARITO Aracaju, SE","January 2013 to December 2018 && 2010 to 2012 && January 2008 to December 2010 && 2004 to 2006","BACHARELADO in DIREITO && CURSO TECNICO in TECNICO EM MEIO AMBIENTE && TECNICO in TECNICO EM INFORMATICA && ENSINO MEDIO","None"
"40","Additional Information Oracle Certified Professional 8i, 9i, 10g and 11g   Project Management Professional - PMP  ITIL Foundation Certificate in IT Service Management   COBiT Foundations Certified","Portuguese: Native Speaker, English: Fluent","Ricardo Eletro LTDA | - Belo Horizonte, MG && IBM - Belo Horizonte, MG && Consórcio Gestor da Bilhetagem Metropolitana - Porto Alegre, RS","Responsabilidades  Department Head of Oracle infrastructure & technology. Responsible for 2 senior DBAs, 2 senior ATGs, 100+ databases and 30+ web servers. This infrastructure hosts the following technologies: Oracle AIS with Oracle Forms, Oracle Reports, Oracle Discoverer, Oracle Retail Merchandising System, Oracle SOA Suite and Oracle Enterprise Bussines Suite. Oracle Weblogic hosting OBIEE and Enterprise Manager Grid Control.    Realizações  Department Head of Oracle infrastructure & technology. Responsible for 2 senior DBAs, 2 senior ATGs, 100+ databases and 30+ web servers. This infrastructure hosts the following technologies: Oracle AIS with Oracle Forms, Oracle Reports, Oracle Discoverer, Oracle Retail Merchandising System, Oracle SOA Suite and Oracle Enterprise Bussines Suite. Oracle Weblogic hosting OBIEE and Enterprise Manager Grid Control.  Some relevant tasks:  • Transition of entire datacenter between two locations (500 miles apart) within scheduled  parameters (less than 30 minutes outage).  • Oracle RAC 11g fresh install on Oracle Linux 6.3 with 2 nodes using ASM External Redundancy  to serve the warehouse management system.  • Oracle RAC 10g fresh install on IBM AIX 6.1 with 2 nodes using ASM Normal Redundancy with  2-way mirroring in distinct system storage to serve the Oracle Enterprise Bussines Suite.  • Oracle RAC 10g fresh install on IBM Red Hat 5.3 with 2 nodes using ASM Normal Redundancy with 2-way mirroring in distinct system storage to serve the Oracle Retail Merchandising  System.  • Oracle RAC update from 9i to 10g with 3 nodes to support the sales system used on 1500+  stores. Red Hat 5.3.  • Data Guard Implementation to guarantee high avaliability on the primary site.  • New infrastructure installation of Oracle Business Intelligence.  • Oracle Enterprise Manager Grid Control installation to maximize IT agility and minimize IT  operational costs and complexity.  • Replacement of backup tool CA ARCServe with HP Data Protector; including RMAN scripts  development, schedule and policy definitions.  • Day-to-day: Patch deployments, SQL and application analysis and tuning, system resource  tuning, space and object management, backup and recovery. Storage management and development support. && Responsabilidades  Coordinator for On Call Team. Globally responsible for highest level critical issues 24/7 on 5000+ databases and about 7000TB of data.    Realizações  Some relevant tasks:  • Identify, plan and implement continual improvements to our client's environments, geared towards reducing critical issues based on metrics and forecasts collected during the months.  • Worked on various types of issues including; enviroment restorations, loss of storage arrays, environment clones, backup irregularites, ASM erros, Enterprise Manager Grid Control and Intelligent Agent management.  • Bridge between the customer's database issues and Oracle Support.  • Create and maintain the team support schedule, considering time zones and local/international  holidays. && Responsabilidades  IT Coordinator to rollout the eletronic ticket system of the metropolitan public transportation at Porto Alegre. The IT team had eight people divided into: internal IT support, garage IT support, system analysts and infrastructure analysts.    Realizações  All the project management was carried out by a collaboration tool online where the project phases and milestone were closely monitored by the sponsors. The project initially was estimated at 9 million dollars and aimed to benefit about 400000 people.  The IT infrastructure was consisted by:  • 12 servers - Intel machines running Linux Debian and Oracle XE.  • 12 wan links between the garages and the data center.  • An Oracle 10G two nodes RAC running in AIX 5.3.  • Tomcat application server.  • Backup solution using Tivoli Storage Manager and RMAN  • Data Guard as the DR solution.","April 2008 to July 2009 && March 2007 to April 2008 && None","Department Head of Oracle infrastructure & technology && Oracle On Duty Team Coordinator && DBA and IT Coordinator.","Belo Horizonte, MG","Fundação Getúlio Vargas Belo Horizonte, MG && Centro Universitario de Belo Horizonte Belo Horizonte, MG","2006 to 2007 && 2003 to 2006","MBA in Project Management && Bachelor's degree in Computer Science","More than ten years woking with Oracle Database technologies on various platforms since version 7.3. Performed as the Oracle technologies I.T Project Manager for several enterprise level projects. Duties included environment resizing, new Oracle techologies implementations, database platform migrations, database tuning and management and high avaliability environments implementation."
"45","None","Windows, Office, MS Project, PowerBuilder, MSSQL Server, Sybase, Oracle,PL/SQL, UML, OO, Erwin, EA, Noções em: Java, Delphi; HTML, Oracle Forms Mercado Financeiro (Renda Fixa, Renda Variável, Swap, Futuros e Cotas de Fundo), CMM, ITIL, COBIT, Áreas de Conhecimento PMBOK Inglês - Upper Intermediate","TOTVS Financial Services && Guia Mais - São Paulo, SP && Walar Informática - Alcoa Alumínio SA - São Paulo, SP && ATTPS Informática - Banco BBA - São Paulo, SP","Principais responsabilidades:  Após entrar como analista de desenvolvimento Senior e Coordenador de Eng. e Desenv.(5 anos), atuei por 4 anos como gerente de Engenharia e Desenvolvimento da TFS (Totvs Financial Services) cuidando dos novos desenvolvimentos dos produtos da plataforma SAC, cerca de 20 sistemas, dentre eles:  - MCA (Conciliação de Ativos);  - FRONT (Boletador Client-Server);  - SRC (Copliance Batch e On-Line de Operações);  - WebPlus (Boletador e Emissor de Relatórios na Web);  - SPB (Liquidação);  - MCI (Contábil);  - SWIFT;  - Autômato (Scheduler de Applicações)  - SAT (Satélites);  - SLM (informações Legais e de Mercado)  - SAC;  Atuei também nos na criação e implementação de projetos de atualização e implantação destes produtos nos clientes, como por exemplo: Santander, Bradesco, Itaú, Banco do Brasil, HSBC, BVMF, Mellon, BNP, JP Morgan, Deutsche, CESP, Brasilprev, Bancoob, Sicredi, etc. && Desenvolvimento em diversos módulos do ‘Edithor’, Sistema de Paginação de Listas. Alterações e criação de stored procedures, functions e packages visando otimização de performance e maior componentização no mesmo. Implantação da nova versão do SAC - Sistema de Atendimento ao Cliente no qual me dediquei desde o levantamento de informações, remodelagem, componentização e performance até a melhoria de sua interface gráfica / usabilidade. && Manutenção e novas implementações no ‘SisCom’, sistema comercial do cliente (Powerbuilder 5.0 / 7.0, Oracle). Alterações em stored procedures, functions e packages referentes ao sistema visando correção e otimização de performance no mesmo. Levantamento junto aos usuários / analistas de negócio das melhorias e correções necessárias. De 11/2001 a 04/2002 líder de desenvolvimento de toda interface busca de dados do novo módulo utilizando PL/SQL com HTML e javascript. && Desenvolvimento e manutenção de Stored Procedures em MSSQL Server 6.5, para sistemas diversos atuando principalmente na área de modelagem de dados, consistindo as informações a serem inseridas na base corporativa do banco. Desenvolvimento, manutenção e administração do sistema “Integra” (Powerbuilder 6.5 / MSSQL Server 6.5) o qual consistia informações geradas por outros sistemas (Open Market, TRF, SWAP, FIANÇA, etc.) atualizando a base corporativa do banco e disponibilizando as informações para o Sistema de Risco do mesmo. Anteriormente atuei como estagiário com Programação direcionada a sistemas empresariais e bancários Desenvolvimento alocado na PMC (Pasteur Merrier Conaught), e na ATT para a Sodexho, BBA, Banco Pontual entre outros. Programação voltada também a ambientes interativos com largo uso da tecnologia de smart cards.","March 2003 to May 2016 && April 2002 to March 2003 && March 2000 to April 2002 && August 1998 to March 2000","Gerente de Desenvolvimento && Analista de Sistemas ( desenvolvedor) && Analista de Sistemas Sênior ( desenvolvedor ) && Analista de Sistemas Pleno (desenvolvedor)","Guarulhos, SP","FIA-FEA/USP São Paulo, SP && FASP São Paulo, SP && Universidade Braz Cubas Mogi das Cruzes, SP","March 2008 to July 2008 && 2005 to 2006 && 1996 to 2004","Complementar in Formação em Gestão de Projetos && Pós-Graduação in Engenharia de Sistemas && Graduação in Engenharia da Computação","Resumo das Qualificações:    • 13 anos trabalhando com Engenharia e Desenvolvimento de software para mercado financeiro na área de administração de carteiras, com produtos de Front, Middle e Back Office (boletagem client-server e web, mensageria SPB, Compliance, informações legais e de mercado, mensageria SWIFT, base de dados gerenciais, satélites integradores de legados entre outros);  • Participação ativa em desenho, implementação e implantação de novos produtos e projetos;  • 4 anos gerenciando as equipes de Engenharia e Desenv. destes produtos com aprox. 35 profissionais;  • 5 anos coordenando as equipes de Engenharia e Desenv. nos produtos com aprox.12 profissionais;    Projetos:    • Gerenciamento de desenvolvimento e implantação de grandes projetos nos maiores players do mercado financeiro nacional como:  • Troca da plataforma de Boletagem Web (Oper) Santander Custódia (2015 e 2016);  • Implementação de comunicação Totvs X Bloomberg para boletagem na plataforma Global do Santander Asset (2015 e 2016);  • Atualização da plataforma de Boletagem Web na BVMF (2015 e 2016);  • Preparação para tombamento HSBC X Bradesco (2015 e 2016);  • Incremento dos Módulos de Compliance e Conciliação Bradesco (2016);  • Atualização da plataforma de Back Office (SAC) no Santander Custódia (2012 e 2015);  • Implementação e atualização da plataforma de Back Office com foco para Off Shore no Itaú (2015);  • Desenvolvimento e implantação das soluções para investidores não residentes (INR) no Back Office Santander Custódia (2012);  • Implantação, atualização e complementação dos sistemas de Compliance Bradesco (2010, 2012 e 2016);"
