"CandidateID","Additional-Info","Skills","Work-Experience__Company","Work-Experience__Job-Description","Work-Experience__Job-Duration","Work-Experience__Job Title","Location","Education__Institute","Education__School-Duration","Education__Qualification","Resume-Summary"
"15","Additional Information Sou dinâmica, pró ativa, comunicativa, inovadora e focada em resultados. Tenho ampla experiência na área de Logística, conhecimento nas áreas de Gerenciamento de centro de distribuição Gestão Estoque, Expedição, planejamento, CTE, manifesto despacho, de carga e descarga, armazenagem geral, Monitoramento no processo rodoviários e ferroviários de celulose, controle de transportadoras, fretes, diárias, atendimento e prazos de entrega, Inbound, Outbound, Inventario mensais e anuais auditoria e análise, melhorias no departamento, cumprir e fazer cumprir as metas e procedimentos da política de qualidade, planejar a logística da empresa, participação no desenvolvimento de estudos e implantação de alternativas e melhoria continua e KPIS. Participação e elaboração de não conformidades, vencimentos de licenças de exames e veículos, revisão de procedimentos, treinamentos, dentro da certificação do SASSMAQ e ISO e assegurar que a qualidade seja cumprida pela empresa. Conhecimento SAP R/3/ WebAs e Inglês","Banco de dados Interfase, SQL Server Programação Java Script, HTML, Java Gráficos/Web CorelDraw, Macromedia Fireworks, Macromedia Dreamweaver, Macromedia Flash, Adobe Photoshop, Macromedia Freehand Aplicações de EscritórioStarOffice, Microsoft Outlook, Microsoft Access, Microsoft Word, Microsoft PowerPoint, Microsoft Excel, Open Office Sistemas Operacionais Linux, Solaris, Windows Outros programas Servidores Web, SAP, ERP, CRM, Servidores de E-mail (5 years)","Panalpina LTDA - São José dos Campos, SP && DSR Soluções e Inteligência Logística - Jacareí, SP && JSL - Jacareí, SP && Heineken - Jacareí, SP","Responsável por registrar e distribuir informações relevantes á operação, propiciando controle,transparência e visibilidade a todos envolvidos. Registrar as operações no sistema Panalpina e Ericsson, para perfeito controle de operações e inventário. Enviar informações gerenciais para o responsável por KPIS para a devida analise e relatório. Identificar oportunidades de melhorias visando o aumento do nível de serviço prestado e a redução do custo do cliente e também da Panalpina. Acompanhar e dar suporte á equipe de almoxarifes para atendimento das exigências operacionais. Acompanhamento do inicio ao fim de todas as operações e backup do coordenador. && Responsável por prestar atendimento aos clientes atendidos na modalidade de frete CIF e Fob no modal rodoviário das Unidades de Jacareí e Três Rios – Rio de Janeiro Realizar agendamentos e acompanhamento do inicio até a entrega ao cliente final, cumprindo as condições acordadas entre o comercial e o cliente final no modal rodoviário. Responsável por relatórios diários dos acompanhamentos dos modais para que não ocorra nenhum desvio sem ser detectado a tempo de termos uma ação imediata, apresentação dos resultados aos clientes sobre os KPIS, emissão de cte e manifestos, treinamentos a novos funcionários. Sistema Utilizados SMO, SmrRast,Pamcary e SAP. Emitir CTes das cargas,Averbar cargas e enviar arquivos para contabilidade.Programar roteirização de coleta e entrega de materiais,otimizando os processos de movimentação. Realizar acerto de viagens dos Agregados. Acompanhamento para controle da jornada de trabalho do motorista, envio de discos tacógrafos para leitura.Acompanhar faturamento (fechamentos), emitir e organizar notas fiscais e separar documentos.Fechamentos e emissão de faturamentos, envio de CTE’s para conferência destinos, receber CTE’s assinadas, manifestar em sistema, gerar planilhas de pedágios versus faturas, gerar arquivos para envio convisint, gerar arquivos xml’s e enviar faturas para os clientes.Atuar com toda a rotina administrativa e operacional do setor de logística, fazer agendamento / solicitação de coletas e entregas com clientes. Organizar malotes dos motoristas contendo toda a documentação necessária para a viagem. Leitura de tacografo.Elaboração de planilhas de controles no operacional e administrativo da logística. Monitoramento e acompanhamento da produtividade dos veículos em carregamentos, descargas e paradas de viagem, contribuindo com a eficiência nos resultados da operação.  Elaborar, implantar, analisar KPI’s de controle de viagens, produção de veículos por KM, jornada de trabalho dos motoristas, receita, custos operacionais, controle de tacógrafo e alimentar dados nestes KPI’s.Realizar atendimento aos motoristas e identificar necessidades dos clientes durante toda a operação.Inventários e controle de estoque, cotação de diversos materiais.Negociação de fretes.Responsável pela qualidade do SASSMAQ, realizando treinamentos, inovação de KPIS e procedimentos,controle de manutenção e vencimentos de licenças de funcionamento da transportadora e dos veículos. && Responsabilidades  Responsável por prestar atendimento aos clientes atendidos na modalidade de frete CIF e Fob no modal rodoviário das Unidades de Jacareí e Três Lagoas – Mato Grosso do Sul e pelo atendimento no modal ferroviário. Realizar agendamentos e acompanhamento do inicio até a entrega ao cliente final, cumprindo as condições acordadas entre o comercial e o cliente final no modal rodoviário e ferroviário. Responsável por relatórios diários dos acompanhamentos dos modais para que não ocorra nenhum desvio sem ser detectado a tempo de termos uma ação imediata, apresentação dos resultados aos clientes sobre os KPIS, entrevistas com novos funcionários, treinamentos específicos para as áreas da expedição de celulose. Sistema utilizado SAP    Habilidades  Ampla experiência na área de logística, sou dinâmica, pró ativa, comunicativa , inovadora e focada em resultado Tenho conhecimento na áreas de Gerenciamento de centro de distribuição Gestão Estoque, Expedição, planejamento, despacho, de carga e descarga, armazenagem geral, Monitoramento no processo rodoviários e ferroviários de celulose, controle de transportadoras,fretes,diarias, atendimento e prazos de entrega, Inbound,Outbound,Inventario mensais e anuais auditoria e análise, melhorias no departamento, cumprir e fazer cumprir as metas e procedimentos da política de qualidade, planejar a logística da empresa, participação no desenvolvimento de estudos e implantação de alternativas e melhoria continua e KPIS.Conhecimento SAP R/3/ WebAs e Inglês && Responsabilidades  Responsável pelo atendimento de consumidores e da comunidade nas manifestações recebidas por e-mail, 0800, cartas, fax e redes sociais, visando atender com qualidade e eficiência de acordo com as normas da empresa e CDC - Código de Defesa do Consumidor do Brasil. Gerir procedimento de trocas de produtos, encaminhando orientações à empresa responsável pelo trabalho. Formular relatórios analíticos quantitativos e qualitativos das manifestações recebidas dos consumidores e comunidade. Controlar junto ao CQ - Controle de Qualidade - os trabalhos de análise dos produtos reclamados. Lançamento e acompanhamento das notas fiscais no SAP.","May 2015 to November 2016 && January 2015 to May 2015 && April 2013 to July 2014 && November 2011 to April 2013","Analista de Logistica Senior && Assistente de Logística && Analista de Transporte && Assistente de Atendimento","Jacareí, SP","Universidade Anhanguera Jacareí, SP","2010 to 2012","Superior in Logistica","None"
"16","Additional Information Sou um profissional com sólida experiência nas áreas Administrativa e Financeira nos segmentos Bancário e Automotivo, em Crédito Atacado e Varejo, Relacionamento junto à rede de concessionárias de montadora, Cobrança Administrativa e Judicial, Consórcio e Gestão Financeira, Serviços aos clientes, estando plenamente atualizado em assuntos relacionados à Ouvidoria.    Minhas atribuições mais recentes são:    Analista Sênior junto ao Depto. De Operações do Consórcio tendo como responsabilidade o gerenciamento do processo de assembleias dos grupos, atendimento de solicitações relacionadas aos clientes junto a central de atendimento e analise e pagamento de processos de pagamento dos créditos aos clientes.    Analista Sênior junto ao Depto. de Operações do Consórcio tendo como responsabilidade o controle e suporte ao Depto. Jurídico e Ouvidoria para as demandas abertas junto ao PROCON e BACEN.    Ouvidor, responsável pela implantação da Ouvidoria e pelas demandas abertas pelos clientes junto a 0800 específico, buscando solução entre as áreas e resposta final aos clientes;    Elaboração do relatório de Ouvidoria e apresentação a Diretoria das demandas e soluções apresentadas, bem como validação de preposições para correção de processos, mantendo disponível para eventual consulta do BACEN;    Analista do setor de Crédito Varejo, cuidando da recepção, implantação, análise e decisão de propostas de crédito encaminhadas pela rede de concessionárias.    Coordenação de equipes responsáveis pela abertura e fechamento de grupos, administração das vendas de produto, agendamento, realização e definição de Assembléias de Consórcio.    Processamento e administração das vendas, pós-vendas, assim como a assistência de vendas às concessionárias e representantes.    Participação na implantação de software de gerenciamento de sistema de consórcio, bem como a revisão e implantação de sistemas de normas, procedimentos e fluxos.    Revisão de processos, objetivando melhorias na qualidade de atendimento, cuidando inclusive da elaboração de layout, compra de equipamentos, desenvolvimento e revisão de processos.    Participação ativa na reestruturação administrativa do Banco General Motors, com centralização das atividades desenvolvidas por 11 filiais e 5 escritórios regionais.     Para tanto, fico ao seu dispor para uma entrevista, onde poderei melhor detalhar minha carreira profissional, bem como meus objetivos.","Microsoft Office; Word, PowerPoint, Corel Draw, Excell","Banco GMAC S.A && Banco GMAC S.A - São Paulo, SP && Banco GMAC S.A - São Paulo, SP && Banco GMAC S.A && Banco GMAC S.A && Banco GMAC S.A && Banco GMAC S.A && Banco GMAC S.A && PRENSAS SCHULER S.A - Diadema, SP && BENFICA AGÊNCIA DE TURISMO LTDA","Responsável pelas áreas de Coordenação de Assembléias e Grupos de Consórcio,  Contabilidade de Grupos e Cobrança Administrativa;  • Gerenciamento do processo de assembleias;  • Desenvolvimento e administração de projeto de recuperação de consorciados não  contemplados inadimplentes;  • Responsável pela automação do processo de vendas de cotas pela internet;  • Responsável pela elaboração de comunicados destinados a rede de concessionárias;  • Responsável pela revisão e elaboração de procedimentos internos;  • Responsável pelo pagamento de comissão de vendas e demais comissões para a rede de concessionárias e representantes homologados; && Principais atividades desenvolvidas: && de Consórcios Ltda;  • Acompanhamento das demandas abertas pelos clientes;  • Participação na solução e elaboração das estratégias de mudanças junto aos departamentos  que deram origem as demandas;  • Elaboração de Relatório para apresentação a Diretoria com o detalhamento dos processos  tratados pela Ouvidoria;  Curriculum Vitae  • Participação na elaboração dos treinamentos relacionados ao atendimento dos clientes na  Ouvidoria;  • Participação no projeto de terceirização de determinadas atividades;  • Avaliação de desempenho dos analistas da Ouvidoria. && Responsável pela emissão e publicação de procedimentos e comunicados internos e  destinados à rede de concessionárias;  • Responsável pela criação e publicação de formulários eletrônicos destinados a rede de concessionárias e processos internos do Banco GMAC; && Responsável pela equipe de atendimento ao cliente que efetivavam os processos de substituição de garantia e cessão de direitos e obrigações dos contratos de CDC, Leasing e  Consórcio encaminhados pela rede de concessionárias;  • Responsável pela equipe terceirizada que emitia boletos de parcelas mensais e em atraso, para os produtos CDC, Leasing e Consórcio;  • Responsável pela equipe que emitia instrumentos de liberação (papel moeda) e em seguida realizava baixa eletrônica junto ao Sistema Nacional de Gravames (MEGADATA); && Crédito Varejo, Crédito Atacado e Dealer Credit;  • Cobrança Administrativa e Legal; && Procedimentos e Métodos; && Contabilização de parcelas, realização de assembléias, formação de grupos, processamento de substituição de garantias e cessão de direitos e obrigações. && Área Administrativa; && Mar'79 a Ago'79)  ✔ Área Administrativa;    CURSOS DE EXTENSÃO, APERFEIÇOAMENTO, SEMINÁRIOS E CONGRESSOS  • Marketing e a Engenharia de Vendas - FEI - ESAN  • Análise do Valor - ESAN  • Desenvolvimento de Recursos Humanos - ESAN  • Matemática Financeira - Financiadora GM  • Visita técnica à filial GMAC - Flint, Michigan - USA.  • Processo de Aperfeiçoamento da Qualidade - General Motors do Brasil  • Resgatando Talentos para Ação Gerencial - Banco General Motors  • Eficácia Gerencial / Administração de Tempo - Banco General Motors  • Como Cobrar de Clientes Inadimplentes - Adriano Blatt - Banco General Motors  • Técnicas de Apresentação - GMAC  • Certificação Plena para exercício das funções de Ouvidor - Res.3477/CMN - FGV  • Curso de Web Design - EMINF - SCS  • Curso de Corel Draw - EMINF - SCS (em andamento)","August 2010 to March 2016 && July 1983 to March 2016 && September 2007 to July 2010 && August 2006 to August 2007 && June 2002 to August 2006 && September 1990 to September 2000 && December 1988 to August 1990 && July 1983 to December 1988 && August 1979 to June 1983 && March 1979 to August 1979","Analista Senior Administrativo && Analista Administrativo && Ouvidor && Coordenador Administrativo && Coordenador de Atendimento && Analista Sr. de Cobrança && Analista Administrativo && Escriturário && Escriturario && Marketing e a Engenharia de Vendas - FEI - ESAN","São Caetano do Sul, SP","Escola Superior de Administração","1987","Graduação in Administração de Empresas pela ESAN","Sólida experiência na área administrativa e financeira na elaboração e suporte na implementação de  procedimentos, bem como concessão e recuperação de crédito, com ênfase no mercado  automobilístico.    • Liderança  • Habilidade em relacionamento interpessoal e gestão de processos;  • Rapidez de raciocínio;  • Característica pró-ativa;  • Objetividade e clareza na condução e apresentação dos trabalhos e relatórios;  • Dinamismo, flexibilidade e comunicabilidade."
"18","None","Virtualização (4 years), Cloud Computing (3 years), ITIL (5 years), WINTEL (10+ years), LINUX (3 years), ITO (6 years), Storage (5 years), Network (6 years), Messaging & Collaboration (4 years), SDN (2 years)","Hewlett Packard Enterprise - São Paulo, SP && Citibank - São Paulo, SP && Citibank - São Paulo, SP && Libbs Farmaceutica - São Paulo, SP","Desenvolvi soluções integrando componentes de infraestrutura e processos de negócios, desde a fase da definição de requerimentos e escopo com o cliente, passando pelo desenho da solução nos domínios arquiteturais requeridos, até a entrega de artefatos e propostas de projetos a serem implementados e promovidos aos times de operação nas seguintes duas empresas:    1. CVRD - Companhia VALE DO RIO DOCE (Terceira maior mineradora do mundo)    • Participei como arquiteto e engenheiro de hosting, no redesenho dos serviços de colaboração e correio eletrônico, atendendo a requerimentos complexos de segurança, operações geograficamente dispersas e coexistência com ambientes legados em iniciativas que resultaram na melhoria da disponibilidade e colaboração para aproximadamente 16.000 usuários em ITABIRA e CARAJÁS, além da migração de aproximadamente 30.000 caixas de e-mail para outros usuários do Brasil e Canada, e ainda uma nova infra-estrutura interna de Autoridade de certificados;    • Idealizei arquitetura de alta disponibilidade para aplicações multi-camadas, avaliando pontos simples de falha e desenhando as camadas de balanceamento de carga, WEB, aplicação e Banco de Dados, para mais de 20 aplicações;    • Atuei como integrador e arquiteto, implementando aplicações em ambiente de acesso seguro (SSL VPN) e autenticação simples, elevando sensivelmente o nível de segurança no processo de gerenciamento de identidade e acessos a centenas de usuários externos a aplicações críticas da companhia;    • Participei no desenvolvimento de soluções para adoção de serviços de cloud computing reduzindo o tempo médio de provisionamento de servidores suportados em até 70 %, num conjunto de iniciativas que viabilizaram implementações hybridas integrando infra-estrutura local e computação em nuvem, incluindo federação e sincronização de serviços de diretório;    2. GRUPO BIMBO Bakeries USA (Maior Empresa de panificação do mundo)    • Como líder de oportunidades, iniciei a avaliação do perfil da companhia e sua infraestrutura para recomendar soluções de cloud com custo efetivo da Amazon Web Services;    • Desenvolvi soluções de alta disponibilidade e baixo custo, desenhando infra-estrutura VMWARE e cluster ESXi, com virtual appliances Store Virtual e tecnologias de Backup para disco HP StoreOnce, reduzindo em aproximadamente 20% o custo de capital com hardware em localidades remotas da companhia. && • Responsável pelo Suporte técnico do principal sistema de atendimento de agências do banco, coordenando equipe de profissionais encarregados de prover estabilidade ao ambiente que dobrou de tamanho em número de agências, entre os anos de 2003 e 2007 no Brasil.    • Entre várias iniciativas, reorganizei o ambiente de atualização de bases de dados na plataforma baixa, e apoiei a reescrita da aplicação estudando o redimensionamento de servidores compartilhados;    • Atuei em diversas iniciativas de transformação, incluindo migrações do mainframe local e regionalmente, e migração do Data Center localmente;    • Atuei nos projetos de recuperação de desastres do Citibank, nas fases de desenho, implantação, e operacionalização, bem como nos exercícios de ativação dos processos de continuidade de negócios, num conjunto de projetos que atingiu 42 departamentos e 64 aplicações dos segmentos de banco corporativo e varejo da instituição. && • Atuei como líder técnico nas fases de desenho e implementação de projetos regulatórios do Banco no Brasil, incluindo o SPB (Sistema de Pagamentos Brasileiro), tendo participado na homologação do ambiente pelo Banco Central, e posteriormente assumido o suporte técnico deste ambiente;    • Atuei como expert da plataforma de integração de sistemas suportando o desenvolvimento da arquitetura de comunicações de aplicações em substituição a soluções baseadas em VAN (Value-Added Network), reduzindo sensivelmente o custo de integração de sistemas e troca de arquivos, com aumento da segurança e confiabilidade do processo que fôra automatizado para suportar o crescimento no volume de transações em bolsa de valores por corretoras parceiras do banco no período.    • Atuei no gerenciamento de serviço e coordenação de TI, monitorando, coordenando e resolvendo problemas em infra-estrutura, criando políticas de backup e recuperação para aplicativos críticos, interagindo com service desk e outros grupos em diversas iniciativas de governança corporativa, gerenciamento de risco, gerenciamento de mudanças e compliance incluindo processos de auditoria, atuando para corrigir não conformidades, prevenindo apontamentos e habilitando a instituição a alcançar marcos regulatórios. && Administração de ambientes NOVELL e Windows suportando serviços de infra corporativos (Printing, DHCP, WINS, DNS, Security, Patching) e suporte de primeiro a terceiro nível para aplicações de negócios;  • Participação no planejamento de tecnologia do grupo LIBBS para implementação de infra e tecnologia no complexo de eventos ALMENAT, suportando definições nas áreas de telecomunicações do empreendimento e infra/tecnologia suportando hóspedes e dependencias do empreendimento.","September 2010 to September 2016 && December 2003 to September 2010 && June 2000 to November 2003 && February 1997 to June 2000","Arquiteto de Soluções Senior - HP (Technical consultant) && TI - Coordenador de Infra-Estrutura e Operações Senior && Administrador de sistemas && Administrador de Redes","Guarulhos, SP","Administração de Empresas Escola de Pós Graduação FGV São Paulo, SP && Faculdade de Ciências e Administração Santa Rita de Cassia São Paulo, SP","2011 && 2001 to 2004","Pós Graduação && graduação in Tecnologia e redes Ciencia da computação","• Coordenador de infraestrutura e suporte técnico, qualificado por mais de 20 anos de trabalho contínuo utilizando todas as disciplinas do gerenciamento de serviço e operações de TI (ITO), para prover entregas consistentes em processos de continuidade de negócios e modernização de Data Centers entre outras;    • Consultor de TI, autor de desenhos técnicos e líder de implementação, tendo integrado diversos elementos de infraestrutura e processos corporativos, garantindo também vantagem competitiva para empresas de diversos segmentos, pela utilização de tecnologias de virtualização e serviços de computação em nuvem;    • Arquiteto experimentado no desenvolvimento de soluções corporativas, tendo conduzido ciclos de arquitetura nos domínios de negócios, dados, aplicações e tecnologia para criar baselines, roadmaps, referências, artefatos de solução e propostas apresentadas em fórums globais de arquitetura e em reuniões com clientes.    • Consistente líder de projetos, apoiando o escritório de projetos no gerenciamento de Programas & Portfolios, criação de modelos de custo, estruturação de preços de serviços e formulação de SLAs para diversas soluções.    • Graduado em Tecnologia e Redes de Dados, certificado ITIL, e fluente no idioma Inglês."
