"CandidateID","Additional-Info","Skills","Work-Experience__Company","Work-Experience__Job-Description","Work-Experience__Job-Duration","Work-Experience__Job Title","Location","Education__Institute","Education__School-Duration","Education__Qualification","Resume-Summary"
"3","Additional Information Twenty six years of experience notably in Information Technology and Telecom areas, working for the following companies: Oracle Systems, PromonLogicalis, and FITEC (Lucent R&D in Brazil).    Projects and products presentation, Leadership, Communication, Team’s coordination, Training elaboration, Teaching ability, Didactic, Flexibility, Innovation, Learning ability.    Excellent self-assessment to identify when other resources are needed in Technical Support and Customer Services; engage and collaborate effectively with others to resolve complex problems and follow customer success.","Extended Software Development experience: Waterfall, Object Oriented Software Development Methodology Unified Modeling Language (UML) and Agile Development XP/Scrum. (5 years), Languages: Javascript, awk, perl, C, C++, Python, CSS, HTML, XML, SQL, PL/SQL, tcl, Unix shell script (5 years), - Protocols experience: TCP/IP, HTTP, SOAP, REST, FTP, ARP, RARP, DHCP, RIP, SNMP, RADIUS, LDAP, PPP, SLIP, L2TP/L2F, Frame Relay, X.25 (4 years), - Operating Systems experience: Windows server, Unix (HP-UX, Solaris, Linux) (5 years)","Oracle Systems - São Paulo, SP && FITECT (Lucent R&D in Brazil) - Campinas, SP && DBA Engenharia de Sistemas LTDA - São Paulo, SP && PromonLogicalis - São Paulo, SP && Universidade do Espirito Santo do Pinhal (UNIPINHAL) - Espírito Santo do Pinhal, SP","- Support of global Oracle customers for the following Oracle CRM solutions: Sales Cloud, Marketing Cloud, Mobile Sales, CRM Outlook and Siebel CRM.    - Support of Oracle Sales Cloud (SaaS) product suite:    - Account, Opportunity & Lead Management  - Sales Mobile Apps on iOS, Android and Blackberry  - Sales Cloud for Microsoft Outlook  - Configuration using Application Composer  - Sales Predictor  - Oracle Social Network  - Sales Cloud Integrations  - Web Services (Oracle SOAP, Oracle ADF, HTTP, XML)    - Support of Oracle Siebel Enterprise CRM applications focusing in integration of Oracle Siebel applications to third-party products like: SMTP/POP3 servers, RADIUS servers, FTP servers, Fax Servers, CTI (Computer Telephony Integration); Siebel Marketing and Siebel CRM Outlook applications.    - Troubleshooting and debugging software or database-related performance issues related to Oracle Siebel CRM applications and Oracle SaaS/Cloud environments, Log reading and analyzing, SQL querying, SQL tuning, Groovy Scripting and Javascript.    - Quality Assurance Tests for new releases of Oracle Siebel CRM and Oracle Cloud CRM applications.    - Elaborate and Revise Oracle Technical Documents (FAQs, Alerts, Troubleshooting Steps, Functional and Design Documents) within the Oracle Technical Support Portal. && - Requirements specification and functional architecture definition for an integrated VoIP platform (Media Gateway NGN) based on the protocols TCP/IP, SIP and RTP developed for Lucent Technologies.    - System Tests for ADSL platform for Lucent Technologies. && Elaboration of technical RFP for ADSL service application for Telefonica service provider && - Pre Sales and response to RFP for the Management of IP services of Brazilian Telecom service providers BrasilTelecom, Telefonica, Embratel and Oi with Cisco and HP OSS/BSS solutions.    - Suggest architectural design and improvements for the Management of IP services of Brazilian Telecom service providers BrasilTelecom, Telefonica, Embratel and Oi with Cisco and HP OSS/BSS solutions.    - Configuration, integration and tests of Cisco Routers for Dial-up and ADSL IP services.    - Develop Network Mgmt applications for Brasiltelecom and Oi Telecom service providers with integration of the following technologies:   Object Oriented Software Development Methodology Unified Modeling Language (UML), Software Languages: Java Script, AWK, Perl, C, C++, Python, CSS, HTML, XML, SQL, PL/SQL, TCL, Unix Shell Script and Protocols: TCP/IP, HTTP, SOAP, REST, FTP, ARP, RARP, DHCP, RIP, SNMP, RADIUS, LDAP, PPP, SLIP, L2TP/L2F, Frame Relay, X.25. && Software Engineering Teacher.  Responsible for the implementation of Computer Engineering department at the University UniPinhal: http://www.unipinhal.edu.br/curso.aspx?computacao#1  Management activities: Course Program elaboration, Teachers Recruitment, Laboratories Implementation.","March 2005 to July 2015 && October 2003 to February 2005 && November 2002 to June 2003 && January 1989 to September 2002 && January 1989 to December 1999","Principal Technical Support Engineer && System Engineer && Telecom Consultant && Solution Architect Engineer && University Director","Sorocaba, SP","Universidade de Sao Paulo (USP) São Paulo, SP && Universidade Estadual de Campinas (UNICAMP) Campinas, SP","2014 to 2014 && 1983 to 1988","Pos Graduation in Innovation Management && Bachelor in Computer Science","None"
"5","Additional Information COMPUTER SKILLS    Experienced in DOS and Windows operating systems. Programming skills in C++, Pascal, and Basic.  Knowledge of the following software packages: Microsoft Word, Access, Excel, Solid Works, Catia V4.0,  WordPerfect, Autodesk Inventor and plotting packages. Limited experience in the use of data and base  software packages.    FORMAL ADDITIONAL TRAINING    2016- NDT INTRODUCTION 2015- TPE331 BOROSCOPY  Aeross Manutenção Ltda. Aeross Manutenção Ltda    2014- OVERHAUL APU GTCP-36 2013- OVERHAUL ENGINE VIPER  Gespi Aeronautica ltda. Gespi Aeronautica ltda.    2013- OVERHAUL ENGINE T58 2012- OVERHAUL ENGINE TPE331  Gespi Aeronautica ltda. NFS - NATIONAL FLIGHT SERVICES-OH    2011- PROJECT OF GAS TURBINE 2010- FDA - FILTER DEBRIS ANALYSIS  ITA - Instituto Tecnologico de Aeronautica ITA - Instituto Tecnologico de Aeronautica.    2010 - GAS TURBINE ENGINES 2009 - AUTODESK INVENTOR RELEASE 11  ITA - Instituto Tecnologico de Aeronautica. Gespi Aeronautica Ltda    2009 - SPRAYS AND EJECTORS FOR TURBINES 2009 - MAINTENANCE OVERHAUL T58  ITA - Instituto Tecnologico de Aeronautica. Gespi Aeronautica Ltda  2008 -GAS TURBINE AND COMBUSTER CHAMBER  ITA - Instituto Tecnologico de Aeronautica.    2008- MAINTENANCE AND OVERHAUL OF JT3D ENGINE  Gespi Aeronautica Ltda.    2008 -COMBUSTION ELEMENTS 2007 - LABVIEW  ITA - Instituto Tecnologico de Aeronautica. ITA - Instituto Tecnologico de Aeronautica.    Aircrafts, with curse of: maintenance, operation and support for customers (include engine and  avionics).    • Embraer 170 and 175  • EMB 314 ALX  • EMB 312 Tucano  • EMB 312F French Tucano  • ERJ 145 and Family  • ERJ 135  • Legacy  • AM-X (A-29)  • EMB 120 Brasilia  • EMB 121 Xingu","Pacote Office incluindo MS Project (10+ years), Catia, Autodesk Inventor e Autocad (10+ years), Overhaul motores TPE331 (6 years), Overhaul motores PT6 (5 years), LABView (7 years), Manutenção em extintores de halon (10+ years), Projetos e aplicação de STC (10+ years), Reparo em aeronaves, incluindo material composto (10+ years)","Aeross Manutençao Aeronáutica Ltda && Gespi Aeronautica Ltda && Gespi Aeronautica Ltda && Gespi Aeronautica Ltda && Tucano EMB312, French Air Force - Paris (75) && Brazilian Fighter Jet - AM-X - Glasgow, MO && None && None","Apply STC, support engineer team, new business development, quality and customer. && Gas turbine maintenance, fuel control units, auxiliary power units, and customer support.  Managed 6 engineer. && Implemented quality control program, development of intranet work order flow.  Managed 12 repair shop and supervised of 85 technicians. && Responsible for garage support and control && 2003-2000), Embraer  Interfaced with Systems and Maintenance Engineering, organized maintenance teams,  flight test support. && Embraer && 1998-1996), Embraer  Manufactory of the Legacy and ERJ family    Overseas field support technician (1995), Embraer  Technical support for the Tucano EMB312, French Air Force (Paris, France) && Flight test, Minimum Unstick (VMU) and Speed Margin and Minimum Velocity  Control Groundspeed for the Embraer ERJ 145 (Three months).    USA - Phoenix, AZ. Certification of auto-pilot cat 3 (Two months). Honeywell Hangar.    USA - Moses Lake, WA. Minimum Unstick (VMU) Speed Margin and Minimum Velocity Control  Groundspeed for the Embraer Legacy (Three months).","2014 to Present && 2003 to 2014 && 2004 to 2004 && 2003 to 2003 && 1988 to 2003 && 1998 to 2000 && 1996 to 1998 && 1988 to 1994","Chief Engineer && Chief Engineer (2010) && Quality Control Manager && Quality Control Engineer && Flight test support engineer && Field support technician && Electrical technician && Technician","São José dos Campos, SP","ITA Instituto de Tecnologico de Aeronáutica São José dos Campos, SP && Industrial Mechanical Engineering School São José dos Campos, SP","2010 to 2012 && 1998 to 2003","Master in Propulsion && Bachelor of Science in Mechanical Engineering","I have a broad knowledge of Mechanical Engineering and particular interest in Science and Technology. I  have developed strong experience with propulsion with airframe integration, communication with FADEC,  troubleshooting and more 15 years in certification FAR. I have communication skills and the ability to  actively participate in team work through my hands-on experience and group assignments. I am quick  learner, responsible, flexible, highly motivated, and goal orientated. I enjoy new challenges and look  forward to different learning opportunities"
"10","None","Windows Server (2003, 2008&R2, 2012&R2) (10+ years), Linux (5 years), Virtualização (VMware vSphere e Microsoft Hyper-V) (5 years), Microsoft Exchange Server (1 year)","WIPRO - Curitiba, PR && Trade Technology - Maringá, PR && Sicoob - Central Unicoob - Maringá, PR && Dimension Data - Curitiba, PR"," Configuração de Servidores Microsoft Windows Server (2008 R2, 2012 R2) – Active   Directory, Terminal Services, Gestão de usuários/OU, Administração de GPO’s;    Criação de servidores Hypervisor (VMware ESXi);    Criação e configuração de servidores virtualizados (VMware);    Monitoramento de Ambiente via Zabbix;    Monitoramento de atividades de backup (IBM Tivoli Storage Manager, IBM Library);    Confecção de relatórios de desempenho/status dos clientes;    Suporte técnico remoto em servidores Windows, Linux, FreeBSD. &&  Gerenciamento de usuários no Windows Server 2012 R2 (Active Directory, File Server   com Permissões NTFS de acesso e Replicação DFS, Criação e aplicação de GPO);    Montagem de servidores Windows Server 2012 R2 e inclusão na floresta de Active   Diretory e configuração de replicação do File Server;    Instalação, configuração e troubleshooting de firewall Dell Sonicwall;    Instalação e manutenção em servidores HP MicroServer Series, IBM X3200 Series e   Supermicro (RAID via hardware);    Configuração de Office 365 ao usuário final (Instalação de Office 2016, Skype for   Business, Exchange);    Monitoramento de links, roteadores e servidores através da plataforma Zabbix;    Gerenciamento de usuários nos sistemas internos Sicoob (Criação, alteração,   exclusão, permissões de acesso);    Vivencia em metodologia ITIL;    Atendimento ao usuário.   Atuação em projetos:    Migração de AD – Unicoob:   o Instalação e Configuração de Windows Server 2012 R2 local nas   Singulares (AD, FS, DFS);  o Instalação e configuração do Sonicwall (Firewall, Bandwidth   Management, VPN);   o Ajuste de permissões de acesso no File Server, Inclusão de   computadores e usuários no AD;   o Mais de 100 PAs visitados e 600 usuários migrados entre os estados do   PR, SC, PA e AP. &&  Alocado em cliente (HSBC do Brasil | HTS | IT Operations | Client Services |   Telecommunication Services | Operação Assistida IPT).    Monitoramento do ambiente VoIP do banco no sistema 24/7 (Escala de turno -   Madrugada).    Vivencia em metodologia ITIL.    Troubleshooting no ambiente em análise de Routers (28xx, 29xx e 38xx series) e   switches.    Operação das ferramentas Cisco Unified Operations Manager (CUOM), Cisco   Unified Communications Manager (CUCM 7.2 e 8.3), em servidores físicos e   virtualizados (VMware ESXi).    Configuração e troubleshooting de Call Manager Express.    Troubleshooting junto a operadoras de telefonia (PSTN) de linhas FXO, Links E1   (ISDN e R2) e MPLS (Dados).    Análise de largura de banda para Voz/Vídeo (QoS).    Troubleshooting e análise de Redes de Dados (Camadas OSI, TCP/IP, VLAN,   DHCP) e Voz (Protocolo H.323, codec G711, G729).    Confecção de MOPs (Manual of Procedure) e documentação de procedimentos   realizados, atuando em todas as agências do Brasil.    Tratativa de chamados com o TAC Cisco em inglês (Via telefone e e-mail).   Atuação nos projetos:    Atualização de IOS - Routers 29xx. (Agencias HSBC Brasil);    Migração Global IPT - HSBC LATAM.   Reconhecimentos/Prêmios:    Live Our Values Everyday Award: Desenvolvimento de uma aplicação de voz para   facilitar o monitoramento de eventos na Operação IPT (IP Telephony) do HSBC,   informando de forma falada os eventos do Cisco Unified Operations Manager. && None","July 2016 to Present && March 2016 to May 2016 && March 2015 to November 2015 && June 2012 to November 2014","Microsoft Exchange Support Engineer && ANALISTA DE SUPORTE && TECNICO DE REDES && ANALISTA DE OPERAÇÕES VOIP","Curitiba, PR","Unicesumar Maringá, PR","2016 to 2018","Tecnólogo in Gestão da Tecnologia da Informação","None"
"11","None","Telecomunicações (10+ years)","HUAWEI SERVICOS DO BRASIL LTDA - São Paulo, SP && Norte&Nordeste && Serviços de Telecomunicações Ltda - EGS - São Paulo, SP && Serviços de Telecomunicações Ltda - EGS - Campinas, SP && Ericsson Serviços de Telecomunicações Ltda - EBS - São Paulo, SP && Marconi Communications Telemulti Ltda - São Paulo, SP && Splice do Brasil Telecomunicações e Eletrônica S/A - São Paulo, SP","São Paulo  Responsável pela implantação técnica nacional da rede PTN e DWDM para a OI no NOC (BRDC). As atividades envolviam link designer, ativação, upgrade, handover fisico, handover lógico e comissionamento de serviços.    Network Engineer - Recife  Responsável pela implantação técnica da rede DWDM e PTN para a OI na região Nrote e Nordeste e support para outras regionais. Bons conhecimentos na configuração de PTn via U2000.  Responsável por parte do desenvolvimento do Handbook Huawei para a tecnologia PTN: FBB Handbook - Optical Cable Parameters - RFI Plan.  - Projeto PTN: Ativação, configuração de serviços, migração de serviços, configurações de tuneis, configuração PW3 (CES and ETH), configuração VPLS, testes de aceitação lógica com o suporte nível 3 do cliente. Criação de link design com topologias de Ips, sincronismo e DCN.  - Linha de produto: OSN500, OSN 550, OSN3500 e OSN7500 II  - Projeto WDM: Ativação, comissionamento de canais, ajuste de amplificadores, janela de manutenção para expansão de novo canal WDM e software upgrade. && em Recife pela implantação dos equipamentos de transmissão Norte&Nordeste envolvendo DWDM, SDH, PTN e Microwave para as operadoras OI, Vivo e Tim. As atividades envolviam gerenciar fornecedores, equipe de projetos, KPIs de implantação e revenue. && Coordenador de Operações de Manutenção  Responsável pela manutenção preventiva e corretiva nos sites da Vivo na área 11 e 13 - São Paulo. As atividades envolviam coordenar um grupo de 114 colaboradores que realizavam manutenção preventiva e corretiva de infra-estrutura abrangendo atividades zeladoria predial, energia, torre, rede celular de acesso nas tecnologias CDMA Lucent, GSM Ericsson, WCDMA Ericsson, meio de transmissão de diversas tecnologias envolvendo rádios PDH. Como destaque, a coordenação do projeto envolvia gerenciar sete supervisores, operação assistida de 3G, elaboração de orçamentos de serviços especiais para o cliente, residentes em três CCCs de grande porte, entre elas a Vivo Sede com 17 técnicos para atendimento 24hs && Supervisor de Operações de Manutenção  Responsável pela manutenção preventiva e corretiva nos sites da Vivo na área 19 - Campinas. As atividades envolviam coordenar 15 equipes que realizavam manutenção preventiva e corretiva de infra-estrutura abrangendo atividades zeladoria predial, energia, torre, rede celular de acesso nas tecnologias BTS Motorola, GSM Ericsson, WCDMA Ericsson, meio de transmissão de diversas tecnologias envolvendo rádios PDH. && Responsável pela elaboração de procedimentos de implantação, suporte e auditoria aos serviços executados pelos fornecedores. Atuei na área de infra-estrutura preparando os containeres para a aceitação nos sites da Vivo Bahia.    Atuei também como coordenador na implantação do backbone Rota Sul, Rota Norte e Rota Sergipe na Vivo Bahia dos equipamentos rádio e multiplex SDH, além de oferecer o suporte imediato a rede existente da Marconi. && Como suporte aos demais coordenadores definia metas, cronograma e apontamentos, além de coordenar a implantação na BRT-RS, Vivo-RS, Sercomtel, Embratel e Vivo-BA. Atuava também como analista de custo, definindo os melhores fornecedores para implantação dos projetos.    Assistente de Engenharia  As minhas competências abrangiam a elaboração de propostas técnicas, estudo de casos, preparar e apresentar aos clientes soluções para topologias de redes utilizando o portfolio Marconi. Tais competências exigiam a familiarização de novas tecnologias, atualização de roadmap e homologação dos equipamentos com os diversos clientes. Atuei também na engenharia de produto, onde, era o responsável pelo desenvolvimento de novos materiais e fornecedores nacionais. && Como coordenador de implantação atuei nos principais projetos de rede SDH, tais como:rede metropolitana de cross connet do país instalada em vinte e dois sites na capital, Osasco, Barueri e nas cidades do ABCD; Copel, 1996 - 1997: Rede determinística e rede SDH em todo o estado. Como destaque a rede SDH foi a primeira a ser implementada no país; menos","April 2010 to 2016 && 2010 to 2014 && March 2008 to November 2009 && May 2007 to March 2008 && May 2006 to February 2007 && June 2001 to May 2006 && April 1991 to June 2001","Network Engineer && Gerente de Projetos && Ericsson Gestão && Ericsson Gestão && Analista de implementação Sr && Coordenador de Implantação && Técnico em Telecomunicações","São Paulo, SP","Uniban Osasco, SP","March 2001 to November 2003","Incompleto in Engenharia em Telecomunicações","Tenho a base do meu conhecimento desenvolvida em vinte e cinco anos de ascendente atuação em empresas nacionais e multinacionais na área de telecomunicações.    Minha experiência técnica abrange desde a realização de site survey, instalação, testes, aceitação, suporte e coordenação na implantação de equipamentos rádios e multiplex dos sistemas DWDM, SDH e PDH. Experiência comercial de cinco anos na elaboração de propostas técnicas, apresentações de portfolios e novas tecnologias. Experiência como coordenador de contrato de O&M na Vivo SP Capital e Campinas, onde, procurava atingir metas de satisfação do cliente. Experiência de quatro anos como gerente de projetos no projeto de transmissão da Oi e recentemente na Tim OTN, TIM MW, Nextel (Roteadores) e Vivo Net (DWDM). Recentemente atuava no NOC (BRDC) como Network Engineer no projeto de transmissão da Oi, principalmente PTN.    Sou uma pessoa com desenvoltura para trabalhos que exijam liderança e comprometimento na resolução de problemas, focando sempre o cumprimento de metas e a excelência no atendimento ao cliente. Habilidade e rapidez no aprendizado de novas tecnologias e o bom relacionamento com os clientes são pontos fundamentais no meu desenvolvimento profissional."
"13","None","LAN-WAN | Microsoft Windows Server | VOIP | Linux | Firewalls | Computer Telephony Integration | Cloud Computing | Router | Switches | Active Directory | DNS | DHCP | VPN | VMware ESX | Proxy Systems | Microsoft Exchange | Datacenter | Antivírus | Storage | Blade | NFS (Network File System) | BGP Protocol | Apache Tomcat | OSPF | Backup Solutions | Extreme Solutions | Siemens/Unify UC | IPS/IDS | Microsoft SharePoint | Citrix Metaframe | TIC | ITIL | IIS | Datacenter | Cooling | PDU | McAfee Solutions | Trend Micro Solutions | Check Point Solutions | Extreme Network Solutions | Unify/Siemens Solutions | (10+ years)","Security and Communications","DENSO do Brasil - (world leader manufacturer of auto parts)  May 2007 - Dec 20016    - Network Administrator of Windows and Linux platforms.  - Network Security Administrator, (Firewall Iptables and Check Point blades), VPN, IDS, IPS  - Management solutions: Active Directory, DNS, DHCP, WSUS, Samba, Proxy, Mail Server,  Antivirus, Storage, Servers, Blade, Backup Routines.  - Management of LAN and WAN networks, Switches, Routing and network assets.  - Management of VOIP environments.  - Management of Virtual Environments and consolidation servers.  - Database administration SQL, Oracle and Progress.  - Annual planning IT budget, manages suppliers and contracts.  - Management of IT Infrastructure and Datacenter projects.  - Management problems and incidents.","May 2007 to December 2016","Senior System Technical Support Engineer","Curitiba, PR","Essei Curitiba, PR && Pontifícia Universidade Católica do Paraná Curitiba, PR","February 2007 to March 2009 && 2007 to 2009","Graduação in Processamento de Dados && Pos Graduação in Redes e Segurança de TI","None"
"16","None","Microsoft Office (3 years), Python Básico, C++ Intermediário, Java Intermediário","Expro - Mossoró, RN","Activities of Operations Supervisor in Bahia, Amazonas and Rio Grande do Norte areas. Responsible for the people management, job planning. Follow up and planning of maintenance. SAP ERP system use to control maintenance, requisition creation, reservation creation. Participation in client meetings.   Maintenance in mechanical and automation system (Fieldbus, instrumentation, IHM/SCADA system).   Project Engineer in a Fiscal Measurement system project following the ANP/INMETRO standards. Main activities:     o define the project scope (project tasks, resources);  o technical specification of instrumentation;  o Support the sales team providing technical expertise;  o Automation project, P&ID design, installation of instrumentation, flow computer configuration, SCADA programming. Startup and commissioning.    Field Engineer in Well Evaluation Tests in Brazil (onshore), Bolívia (onshore) and Angola (offshore) working with data acquisition, surface well test equipment, downhole equipment with wireless technology (DST Surface Read Out). Fiscal Measurement and Appropriation tests operations in Brazil (São Mateus–ES and Catu-BA).","July 2013 to September 2016","Operations Engineer","Natal, RN","Universidade Federal do Rio Grande do Norte Natal, RN","2008 to 2012","Bachelor's in Computer Engineering","None"
