"CandidateID","Additional-Info","Skills","Work-Experience__Company","Work-Experience__Job-Description","Work-Experience__Job-Duration","Work-Experience__Job Title","Location","Education__Institute","Education__School-Duration","Education__Qualification","Resume-Summary"
"1","Additional Information QUALIFICATIONS    Well-accomplished Member of Association for Computing Machinery - ACM, of the Brazilian Computer  Society - SBC and Senior Member of Institute of Electrical and Electronics Engineering - IEEE, with 19+  years of industry experience with systems development for the Internet and heterogeneous systems  integration. Solid experience in modeling of environment and business processes to be represented on  Integration Systems environment (EAI). Solid experience with research & development and incorporating  research results into products. Experienced with distribution and parallelism concerns on the development of  commercial and scientific projects. Fluent in English and experienced in working in multidisciplinary and  geographically distributed teams, delegating responsibilities when necessary. Worked in offshore projects with  USA teams.","Java (10+ years)","BioLogica Sistemas && Centro Universitário La Salle - Niteroi, RJ && Universidade Carioca && Universidade Carioca - Rio, BR && Sakonnet Technology LLC && Electronic Data Systems && Agência Click && Interconection IT S/A","Attributions as Software Architect: Conception and development of biometric and integration products.  ● Defined the architecture for a biometrics middleware product based on C/C++. This product is a plug-in based software to allow for it's fast evolution.  ● Defined the architecture for a biometrics integration product based on Java Enterprise Edition standards. This product has a set of decoupled GUI components that allow the user to create their own forms.  ● Coordinated the developer team.  ● Defined the development process based on agile practices for the execution phase, and traditional practices for the definition phase.  ● Coordinated the creation of a build cell for continuous integration  ● Coordinated the effort to include TDD in the development process  ● Coordinated the effort to automate the majority of acceptance tests, reducing the time and costs associated with functional  regression tests && Attributions as an Associate Professor: Teach system development disciplines for the information systems  undergraduate and advise on final project assignments.  Disciplines: Web Programming with Java, Human-Computer Interaction and Distributed Systems.  ● Started the use of Wiimote accelerometer and Kinect in the Human-Computer Interaction discipline to allow the students to learn the new interaction technologies.  ● Advised students for Final Papers using Kinect and GPUs.  ● Created the Adventures of LaSallinho (available at GitHub), a Löve2D game ported to Android for the celebration of La  Salle Week.    Fundação Trompowsky Independent Consultant Sep/2009 - Sep/2011  Attributions as Systems Architect: Conception and development of web based products for DMS and integration with existing Distance Learning solutions.  ● Defined the architecture and implemented a DMS product based on EJB3, JPA, JSF and Facelets  ● Defined the architecture and implemented a Distance Learning product based on EJB3, JPA, JSF and Facelets  ● Trained and coordinated the developer team  ● Created a patch for NetBeans 6.9 to allow the use of JBoss 6 and IceFaces 2.0  ● Development of specific components: Moodle Single Sign-On, JBoss module for user authentication on remote system and File database persistence to integrate with JPA && Attributions as an Associate Professor: Teach system development disciplines for the computer science  undergraduate and advise on final project assignments.  Disciplines: C Programming, Java Programming, Object Oriented Project Design, Object Oriented Programming, Web  Development with Java, Compilers, Distributed Systems and Information Systems.  ● Advised students on a Final Paper to use of the Wii remote controller in Lua with Löve2D. && Attributions as a Developer: Develop a parallelism solution for a Multi-Agent based Stem Cell Simulation. This project  was part of the ""Computer Science Great Challenges"" initiative. && Attributions as Systems Analyst: Develop integration solutions using ESB concepts.    ● Developed solutions based on JBI using ServiceMix, OpenESB and Fuse as integration platform for Java systems.  ● Developed solutions using Open Source tools and providing corrections when necessary.  ● Developed workflows based on jBPM from JBoss for integration solutions  ● Patched an Apache FTP JBI component for product use && Attributions as Lead Technologist: Act as a technology focal point for the various organization projects.  ● Developed a PoC project to integrate a COBOL Enterprise system with Java EJB components running in a System/Z  Websphere. The development was off-shore based, and needed additional infrastructure for component testing based on  IIOP-over-CORBA  ● Defined the architecture for systems integration  ● Defined technological solutions to support the Application Delivery area  ● Advised and trained a 40 people group to become Java Certified Programmers - the whole group was approved  ● Technical advising for web application development and design pattern usage    Attributions as Systems Analyst: Development of large systems in offshore projects.  ● Development and maintenance of the Ticketing Reservation system for American Airlines.  ● Reformulated the automobile sales management system for USA, Canada and Puerto Rico, from General Motors. Spent  one week at EDS Dayton, OH, for training and modeling meetings, acted as the focal point on the Brazilian team. In this  project my performance and commitment was graded as ""exceeded expectations"" due to my efforts on conducting the  Brazilian team.  ● Development and maintenance of the Engineering Control System for General Motors EUA and Europe based on web  technology. && Attributions: Web systems maintenance.    ● Evolving maintenance of the Brasil Veículos site, changes in the DB2 access management and posterior reorganization of the JSP based system.  ● Evolving maintenance of the White Martins Intranet and Institutional site, mainly JSP and JavaScript && Attributions: Development of Internet systems and integration with medium and large projects.    ● Developed the Luft Carrier order follow up system  ● Developed the TVE show program planning system  ● Developed Santa Catarina's Fire Department help desk system  ● Developed Construbid.com e-Marketplace system (awarded with the third place on the Caché Innovator Awards 2001,  Interconnection was the first company outside USA and Europe to win this award);  ● Developed many components for the Santa Catarina's Justice Court project:  ◦ Control scripts and calculus in JavaScript  ◦ Integration agent between Caché and Zim using client/server in Java  ● Interviewed the client and modeled Ibope's on-line trading system  ● Developed the integration of the legacy systems and BR Petrobrás' site. The result of this project was an EAI product  codenamed SCI, subsequently acquired by Intersystems as the base for the Ensemble product. Developed the following  features of SCI:  ◦ Request Classes creation via web interface that, through reflection mechanisms, created the classes on the  Caché environment  ◦ Auto documentation of the created classes and online documentation consulting using reflection to present the latest version of the Request Class  ◦ Object Layer developed to allow Java and COM consistency  ◦ Perl based SNMP component and MIB descriptor for SCI components  ◦ MQSeries and Java integration  ◦ Architecture definition and maintenance of the RFC SAP R/3 connectors written in C  ● Pilot integration project for the Brazilian Federal Planning Cabinet in Java using SSL support for the integration with XML  Module via secure connection  ● Several meetings with Intesystems' team to present the SCI product and technology sharing  ● Developed a Rational Rose plug-in to allow creation and updating of models from Caché.","August 2011 to Present && August 2011 to December 2016 && February 2008 to December 2011 && May 2008 to May 2009 && September 2007 to April 2008 && December 2002 to September 2007 && October 2002 to December 2002 && October 1998 to September 2002","Software Architect && Associate Professor && Associate Professor && CNPq funded Developer && Systems Analyst && Lead Technologist && Systems Analyst - Freelancer && Systems Analyst","Niterói, RJ, BR","University on Coursera && Unicamp && Pontifícia Universidade Católica Rio de Janeiro, RJ && Universidade Federal Fluminense && Universidade do Estado do Rio de Janeiro","October 2016 && 2015 && 2007 to 2011 && 2003 to 2005 && 1995 to 2001","Certificate && Continuous Education && PhD in Computer Science && Master in Computer Science && Bachelor in Information Technology and Computer Science","Create solutions to real problems by applying information technology and computer science;  Develop my creative potential, using parallelism and distribution techniques, as a Software Engineer."
"2","None","data architecure, information architecture, data governance, data integration design, ETL, Project Management, data mapping","Banorte - MX && TIM Brasil && Bradesco Seguros && BRMalls && Itaú - Unibanco && IBM Brasil - Rio de janeiro, BR && CITEL GROUP - Rio de Janeiro, BR && CITEL GROUP && TIM Brasil && CTIS Tecnologia - Brazilian Supplementary National Health - Rio de Janeiro, BR && IBM Brasil - TIM Brasil - Rio de Janeiro, BR","The client is one of the biggest banks in Mexico. Mr. Rocha was part of a temporary task force acting as project  manager and data architect, with the main responsibilities:    Team management  Financial management and report to the senior leadership  Review of the MDM Architecture    Tools: IBM MDM Enterprise Edition 11.5 && The client is one of the biggest telecom companies in Brazil. The project goal was to design a Metadata and  Security strategy for the client Big Data environment. Mr. Rocha was the project manager and metadata lead, with the main responsibilities:    Design a metadata delivery strategy  Integrate metadata and security workflows  Report progress, issues and risks to the client and IBM account Delivery Project Executive (DPE)    Tools: IBM Information Governance Catalog 11.5 && Bradesco is the biggest insurance company in Brazil and the project was a complete counter fraud solution for  Auto segment with many IBM analytic products such as Identity Insight, Case Manager, ODM and SPSS. Mr.  Rocha was the Data Integration Architect Lead, with the main responsibilities:    Survey of Business Requirements  Data Integration conceptual, logical and physical design to ingest source system data into the target industry  data model  Lead development team  Play a key role as a bridge between all technical teams and final business users    Tools: DB2, Informatica Power Center && Location: Rio de Janeiro, Brazil  Role: Data Integration Architect Lead    BRMalls is one of the biggest players in the shopping mall market in Brazil, with over 40 shoppings spread all over the country. The scope of the project was to build an Enterprise Data Warehouse from the scratch. The  consultant acted as Data Integration Architect Lead with the main responsibilities:    Survey of Business Requirements  Functional Specification with prioritized indicators definition, sources systems impacted and conceptual data  integration model  Technical Specification with the logical and physical data integration model  Support ETL development, ensuring the adhesion of the design implementation of the solution  Support the development of reports and dashboards, ensuring the correct source of information for the indicators construction  Support the construction of the data model, helping in understanding business rules, and the relationship between entities    Tools: Oracle 11g, ODI 11, OBIEE 11 && The client was the largest bank in Latin America. Itau acquired IBM's tool BDW - Banking Data Warehouse v8.5  that enables consolidation of financial data from multiple channels and products, including a rich set of business for projects that promote the collaboration of IT and business requirements for the development, the standardization and implementation. It also has an innovative content to meet the most recent regulatory and  business information.    The consultant acted as a Senior Data Analyst, responsible for the data mapping team with the main  responsibilities:    Survey of Business Requirements with users  Logical and physical mapping from source systems to Banking Data Warehouse IBM Industry model (BDW)  8.5 (Customer, User Experience and Contracts systems), applying ETL and data quality rules.  Mapping from DW model to the semantic/dimensional layer  Support ETL and Testing teams  Support Cognos team    Tools: DB2, DataStage v8.x, Cognos && Rio de janeiro, Brazil && Rio de Janeiro, Brazil && The client is one of the biggest telco companies in Brazil. Mr. Rocha was the Project Manager responsible for the  Business Intelligence factory, using mainly SAS solutions:    Management of development team  Project portfolio administration  Budget and Cost Control for a software factory  SAS BI Solutions Architecture Management  New opportunities prospecting && Location: Rio de janeiro, Brazil  Role: Business Intelligence Architect    Mr. Rocha was responsible for the architecture of all solutions of Business Intelligence factory with SAS BI 9.x    Tools: Oracle 11g, PL/SQL, SAS 9.x (Information Map, EGuide, WebReport, Data Integration Studio, OLAP  Cube Studio) && Rio de Janeiro, Brazil  Agency (ANS)    Participation as a solution architect and developer in the Data Marts implementation program, using Open Source  technologies like PostgreSQL database and JasperETL, iReport and Jasper Analysis as BI tools    Tools: Oracle 11g, PL/SQL, PostgreSQL, JasperETL, iReport, Jasper Analysis && Rio de Janeiro, Brazil  Participation on the whole Data Warehouse development cycle, having as main activities:    Survey of demands requirements with users  Technical Specification of the ETL processes  Multidimensional modeling  Development of the DW ETL using Datastage v 7.5  Development of AdHoc reports using PL/SQL with Shell Script  Unit and integrated tests, as well as User Acceptance Tests  Tools: Oracle 9i, DataStage v7.5, PL/SQL, Shell Script","October 2016 to January 2017 && July 2016 to October 2016 && April 2015 to June 2016 && April 2014 to April 2015 && August 2012 to March 2014 && June 2012 to June 2012 && December 2010 to May 2012 && December 2010 to May 2012 && February 2010 to December 2010 && October 2008 to February 2010 && September 2005 to October 2008","Project Manager / Data Architect && Project Manager / Metadata Lead && Data Integration Architect Lead && Data Integration Architect Lead && Data Mapping Lead && STRATEGY AND ANALYTICS MANAGING CONSULTANT && PROJECT MANAGER && Project Manager && Business Intelligence Architect && SENIOR DATA ANALYST && IT SPECIALIST - BUSINESS INTELLIGENCE","Rio de Janeiro, RJ, BR","Puc-Rio Rio de Janeiro && FGV && Puc-Rio Rio de Janeiro","March 2016 to June 2016 && 2013 && March 2002 to December 2007","Certificate in Big Data & Analytics && MBA in Project Management && Bachelor's in Computer Engineering","None"
"5","None","Java Programming (10+ years), PHP (4 years)","DevFactory - Remote && Ministry of Education - Brasília, DF && CAPES - Brasília, DF && Caixa Seguros - Brasília, DF","DevFactory, Remote    Part of the rapid prototype team, responsible for building and architecting prototypes that will later become actuals products and be developed by a different team.  Create and provisioning a Docker Jenkins machine to deploy new projects.  Create build scripts to build Docker images of the projects and push them to a private registry.  Create Jenkins jobs to deploy created Docker images to a Docker Swarm.  Develop API backend using Spring Boot. && Formulating and developing reference architecture for Java and PHP projects and applications used by the general population, ministry employees and also services consumed by mobile apps.   Defining the methodology and infrastructure to run a continuous integration platform using Jenkins and assessing code quality through SonarQube.  Defining standards for version control, code writing and project layout (including writing hooks for validating commits through Git and SVN). Migrating projects to JBoss EAP 6 from JBoss 5, Tomcat and Glassfish. Defining a deploy standard for development and production environments as standards for the creation of said environments. Support and guidance to  the development team (around 50 developers).   Creating standards for configuration management and guidance for refactoring noncompliant projects to meet the standards.  Part of the devops team using virtualized environments on Linux, Apache, Zend Server and JBoss.   Creating Vagrant virtual machines for the development team in order to emulate the servers settings easing the deployment friction between local and server environments.  Creating Docker machines for integration tests and proof of concept for new tools. && Formulating and developing software architecture for Java applications used by the general public and agency employees. Develop, maintain and upgrade code for Java/JSF applications.   Maintain JBoss and Tomcat servers. Migrate Java projects to use Maven integrated with a local Nexus repository and configuration of such Nexus. Create an API for using jBPM inside the organization business’ context. Develop web services in Java for intercommunication with other government agencies and ministries.   Migrating projects from JBoss 4 and Tomcat to JBoss 5. Migrating over 50 projects to a continuous integration environment using Maven and Continuum. && Develop, maintain and upgrade an in-house developed ERP. RUP analysis and design, elaborating documentation for the software developers.   Develop and maintain COBOL procedures.   Migrate products from the older software platform to the new one.   Refactor routines for long term running procedures in order to decrease execution time and errors generated.","November 2016 to Present && January 2011 to October 2016 && April 2005 to December 2010 && January 2000 to March 2005","Software Architect && Software Architect && Software Architect && Senior Systems Analyst","Brasília, DF","UniCEUB Brasília, DF","1994 to 2007","Bachelor's in Data Processing","None"
"6","None","Middleware, WebLogic, SOA, BPMS, Zachman (10+ years)","VirtuoBiz / Lojas Renner - Porto Alegre, RS && Dell - Porto Alegre, RS && GVT Telecom - Curitiba, PR && Funilarias On Line && NeoGrid - Joinville, SC && BCI - Banco de Créditos e Inversiones - Santiago, MN","Enterprise Architect Consultant leader using Zachman framework with focus on Value Chains / Context Diagrams / Topologies / BPM / OER / OSB. Architect and deploy cross projects, joining Managers, Solutions Architects, Business Analysts, SOA Developers and third-party apps/integrators. Leader Architect of SIM, largest Oracle Retail project in the world (56 systems / 970 integrations) Reports to directory. && Architect and Developer Leader of Brazilian Team at OCTANE Project, one customization of Oracle RTD (Real Time Decisions – Machine Learning) for Sales Offline and SMB (US – EMEA – LA). && Phase 1: Build of Data Services and JPDs (WLI) with BEA Workshop and test with SoapUi; publication in AquaLogic Service Bus (ESB).    Phase 2: Analisys and processes development (Savvion) integrating Siebel, TBS, SGE, Arbor and NEC systems. Architecture used (Telecom Framework): stubs (call the Web Services from ESB), wrappers and adapters to populate Business Objects (Customer Orders – Service Orders – Line Components).    Phase 3: Deploy the BizLogic applications (enviroments installed: development – quality assurance – certification – production); support and monitoring through Portal (reports / dashboards) and logs. && Descrição: Framework de desenvolvimento de aplicações no modelo SaaS  (Software as a Service). Composto de aplicativos totalmente Open Source; sem dependência tecnológica (lock-in). Sobre este framework, foi desenvolvido o Funilarias On Line, um ERP-EAI para o setor automotivo (módulos  administrativo, cadastros, financeiro, pdv e integração com fornecedores). && Description: business hub through Enterprise Collaboration Service, an EAI application integrating collaborative mesh industries and distributors (Supply Chain Management).  Responsibilities: Solution Selling Methodology application (prospects, demos, leads, pipeline, forecasting); assistance in defining the sales policy and distribution channels; creation and technical presentation of the product / service; preparing proposals and contracts; design and technical support deployments. && Analysis of process, architecture and deployment in systems involving J2EE (WebLogic). Results: Improvement in the organization of development, integration, certification and production environments, generating, thus, profits of productivity, security and performance.","June 2011 to Present && October 2010 to August 2011 && September 2007 to August 2008 && August 2005 to October 2007 && September 2004 to June 2005 && October 2003 to August 2004","Enterprise Architect && SOA & Real Time Decisions Architect && SOA – BPMS – J2EE Analyst/Developer && Arquiteto e desenvolvedor J2EE / SaaS && Executive Account && J2EE Analyst-Developer","Londrina, PR","AWU Iowa City, IA","2000 to 2005","BA in Philosophy",". Knowledge in connect Business & IT by Enterprise Architecture (Zachman) and Project Coordination. Focus on Business Process Automation (BPMS), Middleware (SOA/WebLogic), Artificial Intelligence/Machine Learning, Cloud (SaaS/PaaS). Sales Solution with international experience (Chile).   . North: innovative solutions with good results."
