"CandidateID","Additional-Info","Skills","Work-Experience__Company","Work-Experience__Job-Description","Work-Experience__Job-Duration","Work-Experience__Job Title","Location","Education__Institute","Education__School-Duration","Education__Qualification","Resume-Summary"
"34","Additional Information Conhecimento em:   Levantamento de requisitos, elaboração de modelo de dados utilizando EA (Enterprise Architect) e de protótipos de telas utilizando Microsoft Office Visio.   PHP com MVC e MySQL(Básico).  Perfil Comportamental   Boa comunicação.   Capacidade de trabalhar em equipe.   Pró-atividade, com foco em resultado.   Capacidade para assimilar novas informações, tecnologias e ferramentas.   Bom relacionamento interpessoal.   Aptidão na identificação e compreensão de problemas e oportunidades.   Adaptabilidade a mudanças.   Comprometimento.","Desenvolvimento de aplicações web utilizando:  Asp.net + ajax, Web Forms, MVC razor, C#.net e VB.net com SQL Server, Linq, AjaxControlTolkit,  Controle de versão: Team System.Conhecimento em Webservices e WCF. (7 years)","Eco Sistemas - Rio de Janeiro, RJ && Demopart - Rio de Janeiro, RJ","Responsabilidades  Analisar documentação da equipe de requisitos e implementar os sistemas de acordo com estas.    Realizações  Entendimento de regras de negócios, questionamento e sugestões quando necessário afim de que conseguir um melhor produto final e satisfação do cliente.    Habilidades  Desenvolvimento de aplicações para Secretaria de Saúde e Defesa Civil do Rio de Janeiro, web usando asp.net + ajax, C#.net com SQL Server, jQuery. Java script, Nhibernate, Linq, Controle de versão: Team System 2008. Conhecimento em MVC e Entity Framework. && Responsabilidades  Analisar necessidades do Cliente (Partido Social Cristão) e implementar web site de acordo com o entendimento.    Realizações  Entendimento de regras de negócios, questionamento e sugestões quando necessário afim de que conseguir um melhor produto final e satisfação do cliente.    Habilidades  Desenvolvimento de aplicações de mapeamento político para web usando asp, asp.net + ajax, vb.net com SQL Server. Java script, VB.net. Participação em projeto E-Commerce usando asp.net framework 2.0 com c#, desenvolvimento em camadas.","May 2016 && January 2009 to December 2009","Analista Desenvolvedor && Analista Desenvolvedor","Rio de Janeiro, RJ","UniverCidade Rio de Janeiro, RJ","2002 to 2005","Superior in Ciência da Computação","None"
"35","Additional Information ● Managed the migration of the ERP from Windows to Web App running side-by-side with the least amount of stress for the clients and adding functionalities like Push Notifications, Scheduled Tasks and Super versatile searches.  ● Acted as Lead Developer for my team, making me having to learn new technology as fast as I could to establish development standards and teach the team about it.  ● Improved customer support productivity with the software update and online backup request systems, allowing them to use their time with actions that added more value to the company.","VB.Net (10+ years), Asp.Net (10+ years), Asp.Net MVC (4 years), Web API (4 years), Web Services (10+ years), Windows Services (5 years), Hangfire (2 years), Silverlight (8 years), HTML (10+ years), CSS (10+ years), Javascript (8 years), Jquery (4 years), Ajax (4 years), Kendo UI (2 years), Kendo MVVM (2 years), SignalR (2 years), Entity Framework (8 years), ADO.Net (10+ years), Linq (4 years), Microsoft Sql Server (10+ years), TFS (6 years), Team Leadership (8 years), Node.Js (Less than 1 year)","Meta Sistemas e Assessoria - Santos, SP && Instituto Vencer de Desenvolvimento Humano - Santos, SP && Inetx Consultoria - São Paulo, SP && Talent Four Consulting - São Paulo, SP && Meta Sistemas e Assessoria - Santos, SP && Meta Sistemas e Assessoria - Santos, SP","● Architected and Developed several web applications using VB.Net, ASP.NET MVC, Web API, Web Services, Entity Framework, LINQ, KendoUI Components, Kendo MVVM, jQuery, jsLINQ, SignalR for Push Notifications, Hangfire for CronJobs, most of them using MsSQL and others using MySQL.  ● Designed a Single Page Application Framework using jQuery/AJAX to work with ASP.Net MVC.  ● Designed the responsive layout used by the web application using a responsive grid layout, similar to bootstrap, and other techniques to make the apps look like their legacy windows app so it’d be friendlier to the user.  ● An ERP for small business that had integration through Web Services with of the largest Home Fashion Business in Brazil and the government invoicing system that consisting of digitally signing a xml file before sending it through a secure web service.  ● A Software Update Utility that consisted of a web app for the company to control what version goes to which client, a windows service on the client’s server to consume a web service that provides what updates are available working along with a web service to communicate with the web site so we could check if the windows service was running properly.  ● A Database Backup Utility, integrated with the Software Update Website, that consisted of a web service on the client’s server that enabled us to request a fresh backup of the client’s database and sync the backup with our servers.  ● Migrated the Content Management System from Silverlight with MsSQL to ASP.NET MVC with MySQL so it would be cheaper for our clients on the database site and for the application to work on any device, not depending on Silverlight plugins.    ● Architected and Developed several web applications using VB.Net, Silverlight, Web Services, Entity Framework, LINQ, MVVM and MsSQL.  ● A b2b companion app for the ERP for the suppliers to update the status of the client’s purchases.  ● A b2c companion app for the ERP for the clients to use on their websites as a web store.  ● An App for education institutes to control trainers, trainees, courses, print diplomas, id tags and all the documents necessary for the courses. It had an accessory windows server running on the client’s server to handle sending the emails respecting the ISP’s SMTP quota.   ● A Content Management System for web sites. && ● Trained hundreds of people using Neurolinguistics Programming techniques to help them improve their lives and broaden their points of view. && ● Helped developing a Business Intelligence integration for Risk Analysis for a large bank in Brazil using VB.Net and MsSQL Integration Services. && ● Helped elaborating the development patterns and standards for a Foreign Trade System of a large clothing company in Brazil using ASP.Net, ASP.Net AJAX, ADO.NET and DB2 Database. && ● Developed web services integration and web applications for a Credit Union Company in the South Regions of Brazil using ASP.Net and MsSQL.  ● Developed websites using ASP.Net, ASP.Net AJAX, ADO.Net and MsSQL.  ● Architected and Developed a Content Management System for our customers’ websites using ASP.Net, ASP.Net AJAX, ADO.Net and MsSQL. && ● Developed Windows Applications using VB 6, ADO and MsSQL.  ● Joined Senior Analysts in meetings with clients to elaborate business and technical requirements.  ● Helped with Customer Training and Support for the applications we built.  ● Helped the IT department setup and maintain the company’s and client's computer networks.","June 2008 to Present && June 2008 to Present && March 2008 to May 2008 && October 2007 to February 2008 && January 2004 to September 2007 && July 2002 to December 2003","Lead Software Engineer && Neurolinguistics Trainer && Sr. Software Developer && Sr. Software Developer && Software Developer and Junior Architect && Intern","Santos, SP","Santa Cecilia University Santos, SP && College of Industrial Engineering São Bernardo do Campo, SP","2002 to 2005 && 2001 to 2001","Computer Engineering && Engineering","Tenacious and Result Oriented Senior Software Engineer with 14 years of experience. Specialised in .Net Framework but is knowledgeable in several programming. Always tries to find the best possible solution and is not afraid to ask for help or an opinion when feels it’s necessary. Likes to do small brainstorming meeting to define the best approach to solving a problem. Has training in Neuro-Linguistics, which provides a good expertise on human behaviour that gives a tremendous help on user experience designs. Easy-going but focused on results, disciplined and self-taught and can learn fast with just a few examples and a little time. Eager to be part of a team wishing to change the status-quo, grow and learn as much as possible."
"37","Additional Information Summary of skills  • Organized, resilient, hands-on and with business vision, with excellent verbal and written communication.  • Strong experience in IT and results-oriented, working 17 years in the IT market.  • 7 years in leadership positions within IT projects, teams and areas in recent years.  • Four years with insurance market.  • Acting much in the way of cross-IT areas approaching customers to facilitate delivery of projects and services.  • High delivery capacity and in-depth view of the application of technology within the core business of the companies are my characteristics that are appreciated to occupy executive positions both in IT or IT user areas.","Java (10+ years), SOA (7 years), WebLogic (8 years), Oracle Service Bus (8 years), IIB (1 year), ODM (1 year), BPM (5 years), WSRR (1 year), JBoss (5 years), AWS (7 years), Architecture (8 years), JEE (10+ years), Javascript (10+ years), Management (6 years), Leadership Development (7 years), Team Management (6 years), Itil (6 years), ScrumMaster (3 years)","Azul Seguros && Dataprev && Avanti Prima && Decatron && Concrete Solutions","Technological Leader and Reference;  - Long term strategy of technology acquisition, suppliers and provide information and guidance for new projects and initiatives in order to accomplish corporate strategic goals;  - Strategic technology innovation;  Accomplishments:  - Merged the Microfocus COBOL technology with Java SOA approach, paving a road for system integration;  - Increased in more then 150% the integration of systems between the three insurance brands of Porto Seguro Corporation (Holding);  - Leveraged the SOA expertise of IT Office;  - Provided guidance for PoC conduction to support the corporation strategic objectives;  - Increased the use of corporate data when moved them from C-ISAM files to RDBMS;  - Paved the way for Cloud transition;  - Reduced to zero the audit points pending; && Focal point;    Accomplishment:  - Integrally involved on menthoring the troubleshoot team;  - Increased the troubleshooting efficiency team in more then 50%;  - Full commited in attend security issues I was able to provide guidance for proper configuration of a huge WebLogic App Server Cluster.    Products and technologies involved:  - WebLogic Server 11g, VMware 5.1, JBOSS 5.1, Seam, Jenkins && Technological Leader;  - Focal point;  - Integration point;    Accomplishment:  - Integrally involved on delivery of API project (Administration of Real Estate Properties);  - Full commitment in understand the requirements and translate it into software building blocks;  - Full commitment with continual improvement of quality of software delivered for test team. Reduced the test interactions more than 200%.    Products and technologies involved:  - WebLogic Server 11g, JBOSS 5.1, Seam, Jenkins && Accomplishment:  - Development and delivery for Brazilian Army Cyberwarfare Simulator (SIMOC) - Simulador de Operações de Guerra Cibernética;  - Development and delivery of acceptance test for the Warfare Constructive Simulator for Brazilian Army. && - Responsible for the management of the Infrastructure and mobility services in all its specialties;  - Trend analysis, project expectations, training planning for team.  - Head of Architecture team;  - SOA Architect and Cloud Architect;    Results Achieved:  - Expressive growth of customers using amazon cloud (about 300%);  - Amazon partnership development and growth;  - Expressive growth of startups developed by the company using cloud;  - Reduced the cost of maintaining infrastructure for customers using cloud (cost reduction of 60%);    Products and technologies involved:  WebLogic Server 8, 9, 11g; UCM 11g, ElasticPath, AWS, WebLogic Integration    Previous experiences - 5 and a half years as Freelancer  Development of JEE applications and C++ development. Support for Linux, Windows and network.","February 2014 to Present && October 2013 to February 2014 && May 2013 to October 2013 && January 2012 to April 2013 && April 2004 to December 2011","Head of SOA Architecture team && Technological Leader && SOA Architect && Project Management && Chief Service Officer","Rio de Janeiro, RJ","AVM Rio de Janeiro, RJ && UNESA Rio de Janeiro, RJ","2013 to 2014 && 2002 to 2006","Lato Sensu in Venture Analysis && BSc in Engineering","None"
"38","Additional Information Fluent in Spanish, Portuguese, write and speak English.    Excellent Knowledge in Adobe Photoshop, Illustrator, After Effects, Adobe Premiere, Final Cut, Autocad, Vector Works, 3D Studio Max (animation and modeling), Maya and Microsoft Office applications for PC and Mac.    My background includes develop solutions for the projects through of concepts, sketches, renderings, 3D models, illustrations, drawings, technical design (plans, sections and elevations), CAD draughting, virtual simulations and technical liaison between creative teams and suppliers.","Autocad (10+ years), VectorWorks (10+ years), 3D Studio Max (10+ years), Photoshop (10+ years), Final Cut Pro (5 years), After Effects (7 years), Illustrator (10+ years), Office Applications (10+ years), Drafting (10+ years), Drawing (10+ years), Modeling (10+ years), Artlantis (10+ years), Maya (7 years)","P&G scenography - Rio de Janeiro, RJ - Rio de Janeiro, RJ && Opening Ceremony for the 2016 Rio Olympics - Rio de Janeiro, RJ && TV Globo Channel Television && Web-series for Spoleto Group && 1 World Indigenous Games Brazil && Advertinsing National Campaign && Short Film ""A Cantada - The Sung"" && V Conseguro, Brazilian insurance conference && V Conseguro, Brazilian insurance conference && Claro que é Rock - São Paulo, SP && TV Globo Channel Television","Architect and Set Designer with experienced in live event industry, covering architecture, theatre, television and film. I have experience in set decoration, set construction, scenic art, prop management and budgeting. Flexibility, passion, very persistent, attention to details. I have excellent knowledge of production, rigging, video and sound. My background includes develop solutions for the projects through of concepts, sketches, renderings, 3D models, illustrations, drawings, technical design (plans, sections and elevations), CAD draughting, virtual simulations and technical liaison between creative teams and suppliers. && My responsibilities included scenography project coordinator and managing, during the construction, assembly, rehearsal up and maintenance of the main stage (Box City) until the show. Development mechanical systems for curtains, fans and Supervisor of assembly for mixed structure. && and  Project analysts.    SHORT COURSES && Location Choice, set decoration and developed arts. && 2015 Education 360, event about the future of education in Brazil. && Location Choice, set decoration, developed arts for props and actors costumes. && Developed drawings, supervised the construction and assembly of scenography for the studio and location. && Selection and set decoration, developed art for props, actors costumes and coordinated teams involved with the studio and location. && about building colapse Palace II in 1998 with 8 people died ""Poeira nos Olhos - dust in the eyes""  Director and Producer  Research, script, establish the visual style of the film and coordinated teams. The  film was select in the most important Brazilian festivals Film. && Create illustrations for approving the sets, develop textures for printed floors and windows, develop drawings and supervise construction and assembly for the  studio and scenographic city for the Soap Opera ""The kiss of Vampire"".    TEACHING    IATEC course of Event Design since july 2015 until now  http://iatec.com.br/cursos/evento/cenografia-para-eventos-culturais/    Teaching event design, passing for all processes of a large scale production for the beginners architect and set designers. && None","November 2002 to Present && January 2016 to September 2016 && August 2016 to August 2016 && June 2015 to June 2015 && 2015 to 2015 && July 2014 to July 2014 && 2011 to December 2011 && 2009 to January 2009 && 2008 to January 2008 && 2005 to 2005 && 2002 to 2002","Set designer && Set designer | Architect && (Backlots) for Executive Supervisor of exterior sets && Art Director && Set designer and supervisor && Art Director && Assistant of scenography && Art Director and Producer && Director and Producer && Freelance art department && Assistant of set designer","Rio de Janeiro, RJ","University Estácio de Sá && Fundation Getulio Vargas, RJ, Brazil Rio de Janeiro, RJ && University PUC && University Gama Filho","2011 && August 2008 to August 2009 && 2005 && 1999","Bachelor's of Film in RJ, Brazil && Master's in MBA Executive Production in Film and Television && Film Animation && bachelor's in Architecture","Architect and Set Designer with experienced in live event industry, covering architecture, theatre, television and film. I have experience in set decoration, set construction, scenic art, prop management and budgeting. Flexibility, passion,  very persistent, attention to details. I have excellent knowledge of production, rigging, video and sound.    My background includes develop solutions for the projects through of concepts, sketches, renderings, 3D models, illustrations, drawings, technical design (plans, sections and elevations), CAD draughting, virtual simulations and technical liaison between creative teams and suppliers."
"40","None","Scrum Agile (1 year), MS Project (7 years), ITIL v3 (7 years), Project (7 years), IT Consultant (10+ years), CBoK BPM (1 year), OSS Provisioning Process (1 year), OSS environment (10+ years), Inventory Management (10+ years), Software Develoment Lifecicle (10+ years), IT Network and 3G/GSM/UMTS telecomunications, (10+ years)","Everis brasil consultoria - Rio de Janeiro, RJ && NTT Data Brasil - Rio de Janeiro, RJ && NTT Data Brasil - Rio de Janeiro, RJ && BRASIL FOODSERVICE GROUP - Rio de Janeiro, RJ","Transport Network Inventory Unification Project: aims to unify the telecom transport network inventory (DWDM, SDH and PTN) in a single inventory system (NRM Amdocs). To accomplish this, I performed functions typically of PM, elaborating project management plan, communication plan, risks, changes, schedule, status report, RACI matrix, resource mobilization and contracting, conducted executive committee meetings with the senior management of the client. PM support, prepared executive presentations containing dashboards and KPI. We adopted Scrum agile for all deliveries. I performed key role in the analysis of AS-IS business processes for many network areas, gap analysis and redesign of process ""To-Be"", based on best practice BPM / CBOK. && I have successfully planned and conducted the transition from an IT governance agreement to TIM BRASIL. I started with a team of 11 project managers (full level), and together we reorganized the 15 projects that were underway in the OSS area, reviewing timelines and milestones, risk mitigation plan, etc. I developed a new consolidated status report for committee meetings. Coordination of simultaneous projects with budgets and negotiation of deadlines with suppliers.    I highlight the most relevant projects: Systems integration between BSS Systems (Siebel/Clarify) and OSS Systems • ANATEL Regulatory • OSS systems consolidation • Implantation of ITIL processes and design of supporting software • Roadmap for IT applications • LIVE TIM • synergy (automatic BA) between Telecom Companies • Adaptation of OSS systems to IT security standards • SOX compliance • Consolidation of trouble ticketing systems • Discontinuation of legacy systems and data migration to new systems • Managed Services OSS with SLA • Microstrategy KPI reports for OSS.    Result: After 2 months the transition was 100% complete, without loss to the client and the projects of the area. Established new and more effective governance of IT projects. && I have planned and managed a portfolio with more than 50 service assurance projects of low, medium and high complexity for telecommunications customers, which together generated revenues of over BR$15 million.    Key Projects: Integration of BMC ARS Remedy (xTTS) request fulfillment system with SAP HR for automatic granting and removal of access to systems in the SOX perimeter • Integration with Clarify and Siebel CRM for opening and directing customer calls to IT / Network • Inventory And Network Discovery • Consolidation and Deployment of single ITIL process support system: Incident and Problem Management, Change Management, Request Fulfillment, Service Catalog, SLA, Knowledge Management.    Responsible for organizing, directing and managing many project activities in software factory. Before 2010 I also worked as Senior System Analyst, making analysis and functional specifications for web and mobile applications, as well as integrations with (ARS Remedy ITSM). Preparation of test plan and defect control report. && As IT Coordinator, I managed the daily activities of the IT area. I have planned and coordinated projects for the implementation of CRM systems (MS Dynamics) and ERP Systems, negotiation of deadlines and costs with vendors to maintenance services contract, such as network and IT equipment. Elaboration of contingency plans, aiming at security at data levels, accesses, audits and the continuity of IT services, prepare management reports of the operation for IT senior manager. Ensure strategic alignment between IT and core business.  Previous position: Senior Support Analyst: Responsible for administration and support of MS Windows 2000/2003 networks, Interconnection of stores with contracted datacenter (via dedicated links, fiber), Installation, configuration and maintenance of: Active directory, Firewalls / Proxy, Servers Linux, Apache, TCP / IP, SQL Server 2000 Database, Terminal Server, MS Dynamics CRM, ERP RM Systems, Remote Client Support, Systems Migration, Installation and Configuration of Network Security Protocols and Commercial Automation Systems. Backup and restore ArcServer data. Requirements survey using Enterprise Architect (UML, use case modeling, object orientation and diagrams).","July 2015 to August 2016 && June 2014 to June 2015 && October 2006 to May 2014 && March 2002 to September 2006","Project Manager - PMO && Project Coordinator && Project Manager && IT Coordinator","Rio de Janeiro, RJ","UFF Rio de Janeiro, RJ && UNIVERSIDADE ESTACIO DE SA Rio de Janeiro, RJ && IBMEC Rio de Janeiro, RJ","August 2015 to September 2017 && June 2000 to June 2015 && August 2011 to June 2013","MBA in Telecomunications && Bachelor degree in Computer Science && MBA in PROJECT MANAGEMENT","PROJECT MANAGER, PMO, IT CONSULTANT , IT CORDINATOR, TECHNICAL LEADER"
