"CandidateID","Additional-Info","Skills","Work-Experience__Company","Work-Experience__Job-Description","Work-Experience__Job-Duration","Work-Experience__Job Title","Location","Education__Institute","Education__School-Duration","Education__Qualification","Resume-Summary"
"26","Additional Information Especialista na indústria de Tecnologia de Informações, tendo atuando em vários cargos de liderança como programador, analista de requisitos e mais recentemente na área de gerência de projetos de software. Experiência na área de Big Data e Business Inteligence. Experiência no mercado de Telecom, em processos de Fraud Risk Management e Revenue Assurance e Interceptação Legal de Dados","LINGUAGEM DE PROGRAMAÇÃO C C++ (10+ years), BANCO DE DADOS ORACLE (10+ years), PERL (10+ years), HADOOP (1 year), R (1 year), SOA (1 year), JAVA (10+ years), Python (Less than 1 year), Inglês Avançado (10+ years), Espanhol Fluente (10+ years), Alemão Intermediário (2 years)","Hewlett-Packard Enterprise - São Paulo, SP && Convergys IMG - São Paulo, SP && YKP Serviços em Informática - São Paulo, SP && Anal. de Sistemas","Anal. de Sistemas  • Escritório de Gerência de Projetos: elaboração de plano de projetos e de alocação de recursos, ligação entre a equipe de desenvolvimento e o cliente para facilitar as atividades do projto, comunicação de status report, gerenciamento de satisfação com o cliente;  • Technical Consulting: Fraud Risk Management(HP ERM ) Delivery: Levantamento e desenho de processos, levantamento de requisitos, desenho funcional e técnico de soluções, planejamento de testes;  • Information Architect-Communication Midia Services: análise de pré-vendas, montagem de soluções, análise e levantamento de requisitos, elaboração de propostas técnicas, planificação de recursos e montagem de estrutura analítica de projeto, respostas para RFPs  • Information System Analyst: anáise de pré-vendas em Outsourcing e Business Process Management, desenho solução técnica, elaboração de propostas, elaboração de modelos de recursos e custos, assessment, atividades de due dilligence.  • Business Analyst: levantamento de requisitos para projeto de Nota Fiscal Eletrônica na AVON, elaboração de desenho funcional, interface com a fábrica de software da Cognizant na Índia, desenho de WebServices, levantamento e desenho de processos, implantação de melhorias no portal de revendedoras (SIR)  • Team Leader e System Administrator - Enterprise Content Management/Financial Group: planejamento de migração de dados, suporte de nível 2, break-fix da solução, pequenas melhorias, gerenciamento de SLAs, administração do sistema, monitoramento estatístico da plataforma, elaboração e capacity plan e Quality Assurance  • Processos de auditoria de sistemas e revisão de códigos && Desenvolvimento de interfaces de ETL, análise e reconciliação de dados, mapeamento de dados && Migração de Sistema de OSS/Billing e consolidação de dados, na Vivo: Desenvolvimento de interface de ETL, programas de carga, quality assurance, mapeamento e limpeza de dados    YKP  08/2002 a 10/2003 && Desenvolvimento de Portal de Gerenciamento de Revendedoras na AVON (SIR): Módulos de Logística e Financeiro; Planejamento e execução de Testes; Levantamento de requisitos funcionais; desenho de solução; construção;    Accenture  05/2000 a 08/2002    Cons. Técnico  • Consultor Técnico na Indústria de Telecom na Brasil Telecom, TIM, Oi/Telemar, GVT: Levantamento de requisitos e mapeamento em projeto de Enterprise Application Interface/SOA; Construção de Interfaces em projeto de co-billing; planejamento de testes integrados; projeto de infraestrutura/rede/datacenter; elaboração de propostas; atividades de mentoria com estagiários.","August 2006 to Present && October 2003 to August 2006 && August 2002 to October 2003 && May 2000 to August 2002","Tech Consulting && analista de sistemas && Analista de Sistemas && Cons. Técnico","São Paulo, SP","ibta São Paulo, SP && FGV && FIAP São Paulo, SP && USP FEA São Paulo, SP && USP São Paulo, SP","2011 to 2012 && January 2003 to May 2005 && January 1997 to December 1997 && 1990 to 1995 && 1983 to 1989","MBA in Engenharia de Software && Pós-Graduação && Pós Graduação in Análise de Sistemas com Ênfase em Banco de Dados && BACHARELADO in ECONOMIA && BACHARELADO in FÍSICA","Acumulo mais de 20 anos de experiência profissional na área de Tecnologia de Informação, tendo atuado em vários projetos, principalmente na indústria de Telecomunicações. Desempenhei os papéis de desenvolvedor, líder técnico, analista de testes, analista de negócios, analista de processos e analista de projetos. Atualmente, trabalho na Hewlett-Packard Enterprise, desempenhando atividades de gerenciamento de projetos no time de delivery de ""Fraud Risk Management & Lawful Solutions"", prestando serviços de consultoria técnica para a TIM do Brasil."
"27","Additional Information Looking for challenges to apply current knowledge and to grow personally and professionally.","Microsoft Office (10+ years), SAP SD (3 years), Mainframe and DB2 (5 years), Project Management (PMBoK) (7 years), ABAP (4 years)","Henkel Ltda - São Paulo, SP && Bradesco S.A. - São Paulo, SP","- Responsible for SAP SD - OTC (Order to Cash) area within Mercosur (Argentina, Brazil and Chile);  - Work side-by-side with business to propose quick wins, enhancements and projects for the processes and for the system;  - Design, build, test, go-live, training and post go-live maintenance;  - Manage projects (PMBoK based);  - Negociate business priorities, estimate deliverables;  - System integration. && -Design integrated solutions for core banking processing;  - Responsible for architecting the solutions for accounting processes;  - Gather business requirements and translate into business requirements, checking among all available 'building blocks' the reusability;  - Functional and technical design specification;  - PMBoK ad TOGAF framework based;  - Manage 3rd party teams of consulting and developers to deliver projects.","December 2012 to Present && March 2006 to December 2012","Business Analyst && Solution Architect","São Paulo, SP","Fundação Vanzolini São Paulo, SP && Universidade de São Paulo São Paulo, SP","January 2013 to December 2015 && January 2006 to July 2012","Specialist in Quality and Productivity && Bachelor in Physics","Apply current knowledge and learn more each day. I have no boundaries with technologies."
"29","Additional Information Passionate about technology, software development, software engineering, electronic gadgets and 1/10 R/C cars (and 1/1 too!). My friends and my wife (are suspects!) say that I cook very well, I make a very good Brazilian barbecue and I would like to show this extra experience to the new co-workers.",".NET Framework (10+ years), VB.Net (10+ years), VB6 (10+ years), WCF (8 years), SQL Server (10+ years), Oracle Databases (6 years), SOA (8 years), Javascript (10+ years), Asp.Net MVC (4 years), Asp.Net (10+ years), ASP 3 Classic (10+ years), OO (10+ years), Design Patterns (10+ years), JScript (6 years), WSO2 Middleware (7 years), TFS (8 years), MS MQ (10+ years), IBM Wp Message Broker (2 years), SOAP and RESTFull services (8 years), Data Management (10+ years), LINQ (8 years), ADO.Net Entity Framework (8 years), NHibernate (8 years), HTML5 (2 years), T-SQL (10+ years), PL/SQL (6 years), CSS (10+ years), Data Structure (10+ years), Database Design (10+ years), Team Management (5 years), Team Recruitment (5 years), Git (8 years), Subversion (8 years), Visual Source Safe (10+ years), Maven (4 years), C# (10+ years), Client Server (10+ years), Webservices (8 years), Microservices (4 years), WSDL (8 years), SOAP (8 years), REST (8 years), WPF (5 years)","Caixa Seguradora a CNP Assurances company - Brasília, DF && Ministry of Social Development of Brazil/Solução SE Ltd - Brasília, DF && General Law of the Brazilian State – AGU / CTIS IT Solutions - Brasília, DF && Caixa Econômica Federal (Brazilian Bank) / Politec Indra Company - Brasília, DF","Database designing;  Identify and troubleshoot SQL Server database;  Adjust and optimize data in standard and non-standard databases;  Improve query performance (tuning);  Coordinated a multidisciplinary team of .net developers.;  Software architecture and consulting in .NET and SQL Server;  High-performance and high availability application developer and Webservices using .NET C# & VB.Net for 4200 bank branches and 11500 points of sale distributed throughout the country;  Understand the needs of the company's business areas and turn them into parts of the systems.    Key achievements (In order of occurrence)  I am currently participating the digital signature project in the acquisition of life insurance. Will be delivered in production on 21/11/2016 in a pilot phase in 100 bank branches in 3 points of country. In 2 weeks, the expansion occurs for more 4100 points. We use the APIs of the American company DocYouSign;  I designed the architecture and developed the entire back-end (open and closed areas) using WCF Webservices from the company's new portal, including the One Time Password (OTP) solution using SMS. The front end uses SharePoint. The new site is www.caixaseguradora.com.br;  I participated successfully in the development of the company's current sales system. High availability system that accounts for 98% of the annual turnover of the company, something around BRL R$ 23 billion/year (~C$ 9.2 billion/year). && Consulting in SOA Architecture using Oracle SOA Suite, WSO2 Middleware, WSO2 ESB, and Bonita BPM.    Key achievements  I presented and deployed BPM process automation tools;  I installed and configured the Oracle SOA Suite package and the WSO2 ESB in the production environment of the Ministry;  Defined the process for publication in environments of approval and production of the services developed. && Development of DLLs for COM+ using VB.Net to be consumed in web applications made in Classic ASP. These DLLs consumes Webservices, integrating technologies previously not compatible;  Application web development in ASP Classic;  Migration of applications developed in Visual Basic 6/Classic ASP to ASP.NET with C#;  Database designing;  Migration from SQL Server database to Oracle database;  Development of T-SQL and PL/SQL stored procedures, functions, and triggers;  Optimization of calculation engines with C#;  Application architecture.    Key achievements  I was the first person to talk about SOA in the company in 2006 and to develop the first webservice for the federal government;  I identified a COM+ bug during this process, which was fixed by Microsoft Premier support and later included in the Windows Service Pack;  Conceived and designed, alone and discredited, the solution of digital transfer of documents between the public organs of justice using Webservices, becoming a success after deployment;  I created the solution of digital signature of judicial petitions in the scope of the public agencies of justice;  I promoted the success of the SOA architecture in the Brazilian justice infrastructure, currently widely used;  I worked in 2008 with the first big data structure in Brazil, with 3 petabytes of capacity, using Oracle Rac. && Database designing and application development in ASP Classic and Visual Basic 6;  Development of T-SQL for SQL Server and Sybase database stored procedures, functions, and triggers.    Key achievements  I worked hard to implement the skills assessment system of bank employees, where the results were used in the promotions or dismissals;  I participated in the development team of the CAIXA Corporate University website, awarded in 2003 as the best portal of Corporate Universities in Brazil.","February 2012 to Present && April 2011 to January 2012 && March 2005 to April 2011 && October 2001 to March 2005","Senior Software Architect and Consultant .NET & SQL Server / IT Business Analyst && SOA Architect (IBM SOA Architect Certified Professional) && Senior .NET C# / VB.NET Developer & SOA Architect && Senior Software Developer ASP / VB6","Brasília, DF","Brasilia Business School Brasília, DF && Catholic University of Brasilia Brasília, DF","2012 to 2015 && 1993 to 2007","3 years bachelor's in Business and Finance in Business and Finance && 5 years Computer Science Bachelor's (4 years studied but not concluded) in Computer Science, Computer Programming, System Analysis","None"
"30","None","ETL (6 years), OLAP (6 years), Oracle Business Intelligence (6 years), Microstrategy (4 years), Oracle Data Integrator (6 years), Informatica Powercenter (5 years), Data Modeling (6 years), Dimensional Modeling (6 years), Oracle Database (6 years), Hadoop (1 year), Phyton (1 year)","DWL && Condominio de Soluções Corporativas (CDS) && Guerreiro Consult && Uniceub DF","Architect of BI/DW  Creation and development of Business Intelligence area labor process;  Creating solutions and technical proposals;  Backup, Administration, Development and automation tools in Oracle Data Integrator ETL (11g) and Informatica PowerCenter (9);  Administration and Development in MicroStrategy OLAP tools (10), Oracle Business Intelligence (11g) and Pentaho;  Management and professional development of the Business Intelligence team;  Requirements survey focused on Business Intelligence;  Dimensional Data Modeling;  Training developers and administrators in Oracle Business Intelligence tools (OBIEE) 11g and Oracle Data Integrator (ODI) 11G;  Project management through the SCRUM Agile methodology; && ETL on ODI 10 e 11G (Install, Development and Administration), PowerCenter 9.1  OLAP: OBIEE 10 e 11G (Install, Development and Administration), Microstrategy 9  Integration between OBIEE and Essbase  PL/SQL  Dimensional Data Modeling  Knowledge of DBA concepts of Oracle DB 10 and 11G  Concepts of DW (DataWarehouse)  Training developers and administrators in tools OBIEE 11G e ODI 11G  Acting as a pre-sale in prospects  - Courses  Linux Administration - HeptaNovintec  ITIL V2 - Revision day - Voyager  Workshop Oracle Sales and Pre Sales - Oracle  Workshop Oracle GoldenGate - Oracle  -Participation (Clients):  Public: Banco do Brasil, Caixa, Correios, DATASUS, DST-AIDS, INEP - Instituto Nacional de Estudos e Pesquisas Educacionais(National Institute of Educational and Research Studies), BI-FNS (Data Marts and SIAFI), STSP - Secretaria de Transportes de São Paulo, TJDF - Tribunal de Justiça do Distrito Federal, TJGO - Tribunal de Justiça do Estado de Goiás, TJSP - Tribunal de Justiça do Estado de São Paulo, SEBRAE, MPT (Ministério Público do Trabalho).  Privates: Rapidão Cometa, SASCAR, SK INTELLIGENCE, Kawasaki && Network and equipment support with Operating Systems such as Windows, Linux and Mac OS;  Server management based at Windows Server 2003, through AD, DNS, Exchange and Outlook.  Execution of Backup, FTP controled by Linux, File Server, Subversion(SVN), FreePBX and also management of machines of an Internet service provider, known as ""IG"", related to Online gaming at ""Arenaturbo"".  Elaboration of manageable reports with objective to improve the system by using proactive solutions.  Experience at documenting and planning Configuration Items.  Other information  Native Language Portuguese  Advanced in English (CNA-DF)  Beginner in French (Aliança Francesa-DF) && Study of the software Requisite PRO  Support computers based in Windows environment","December 2015 to Present && July 2010 to December 2015 && April 2008 to April 2010 && August 2009 to August 2009","Project Leader BI/DW && Project Leader of BI/DW && Internship in IT && Internship in IT","Brasília, DF","IGTI Brasília, DF && Centro Universitário de Brasília Brasília, DF && Uniceub Brasília, DF","January 2016 to August 2017 && January 2017 && January 2008 to December 2012","MBA in Data Science - Big Data && MBA in Database && bachelor degree in Computer engineering","None"
"31","None","C# (9 years), .NET (9 years), ReactJS (1 year), SQL (9 years), Computer Programming (9 years), HTML (9 years), JQuery (7 years), Bootstrap (5 years), Windows Services, WCF, Rest Services, .NET Web Forms, .NET MVC, .NET Windows Forms, Entity Framework, Message Queueing, AngularJS (1 year), Amazon AWS","Sovos Compliance - Barueri, SP && Introgauge - Freelance && Mercado Libre && Squadra && Iteris && CWI && BSI && LTM [Loyalty programs company] && HYPNOTIQ [Publicity Agency] && None","Activities  ● Day to day duties were managed in a timely manner with a client response deadline  ● Client contact for complete analysis of the situation  ● Create technical specifications and test plans  ● Enhance existing system by analyzing business objectives identify possible threats and modify improvement   ● Ability to teamwork with support team day to day issue that need immediate resolutions, in addition contributed for future project developments.  ● Report project/task status to the Application Development Manager on a daily basis.  ● Technically manage complex and large scale project efforts in development, maintenance and enhancements of business system application  ● Works collaboratively with others across distributed offices    Involved Technologies  ● SQL 2014,Net Framework, Entity Framework, Web Services, WCF, and WEB.API, RESTfull and SOAP services, Windows Services, multithreading, and message queuing, HTML, Bootstrap, CSS3, JQuery, SVN, GitHub, JIRA. && Activities  ● Interact with product owner and business representatives to determine and satisfy needs.  ● Assist in performance tuning, balancing, improvement, automation and usability.  ● Report project/task status to the client on a weekly basis.  ● Responsible for developing the front end in ReactJS  ● Responsible for developing the back-end in .Net (Rest Service)  ● Responsible for modeling the database model    Involved Technologies  ● SQL 2016, .Net Framework; Entity Framework, log4net, oAuth 2.0, and WEB.API, RESTfull Services, Windows Services, multithreading, message queuing, HTML, Bootstrap, CSS3, JQuery, ReactJS, GitLab, JIRA. && Activities  ● Integration with many outsourced web api, and services  ● Discuss with team members better technologies and design patterns for the projects  ● Identify possible threats, and to anticipate possible errors   ● Development of a new feature, for generation of bank files in CNAB’s pattern  ● Development of a Self Updater for updating the company’s windows services automatically.  ● Development of a new product, called KPL HUB, which is a Marketplaces tool, to make it easier to integrate ERPs, to one or many Marketplaces automatically, or manually.  ● Proactively update stakeholders and maintain open and courteous communication.  ● Evaluate emerging technologies for use within the application    Involved Technologies  ● .Net Framework; Entity Framework, log4net, Json.NET, oAuth 2.0., Web Services, WCF, and WEB.API, RESTFull and SOAP service, Windos Services, Message Queuing, SQL 2014, HTML, Bootstrap, CSS3, JQuery, Google Recaptcha, ReactJS. && Client: GPS (Global Portfolio Strategists)  ● Financial Company    Activities  ● Development of new functionality to export data, to Excel spreadsheets, and PowerPoint presentations, using an ASPOSE library.  ● Develop system test plans, ensure software quality assurance standards are achieved.  ● Report project/task status to the Development Manager on a daily basis.  ● Participate in planning and implementing the projects.    Involved Technologies  ● .NET Framework, Visual Studio 2012 and 2013, Jquery, Ajax, Json, SQL 2012, Microsoft CRM dynamics, TFS, JIRA.    Client: Instituto Votorantim / GPSV:   ● Instituto Votorantim is a multinational company with social responsibilities    Activities  ● Help define scope of work  ● Development of new functionalities  ● Review and repair legacy code  ● Assist in project development including capturing functional and technical requirements  ● Act providing information, analysis, and recommendations in support of team efforts.  ● People development – Mentor and train new team members    Involved Technologies  ● WCF, SQL, Reporting Services, Jquery, .NET Framework, TFS    Client: Sapura  ● Oil Company  Activities  ● Development of reports, and charts using google charts library based on the data hosted in SharePoint Lists.  ● Work closely with business partners and technical staff to create technical solutions that meet business and technical requirements.    Involved Technologies  ● SharePoint, Jquery, Google Charts, TFS.    Client: Rede (Itaú)  ● Financial Company    Activities  ● Development of a portal which provides the user access to the database. The tool was developed to make it possible the employees to execute SQL commands, anywhere, without having to install SQL Server in every computer, and respecting their rights access to the database objects.  ● Development of a portal to manage log files in many servers, around the world. The tool came to avoid having to access many computers to access log files, and having it all accessible in one single place instead.  ● Regularly communicate project progress, issues, and risks to IS management and business owners  ● Create technical documentation such as design and specification documents, software architecture documents, and user instructions    Involved Technologies  ● .NET Framework, JQuery, WCF, SQL 2008, TFS && Client: Localiza  ● Car rental company  Activities  ● Development and maintenance of an existing system.  ● Re-Architect existing systems and optimizing system structures  ● Maintenance and migration of the company’s new logo, in many web pages, and services.  ● Work with client supervision to accomplish established requests, escalating to Manager when necessary and updating Manager on a regular basis.    Involved Technologies  ● C#, VB, ASP, SQL, JQuery, LINQ to SQL, WebServices, e WCF, TFS. && Client: Instituto Votorantim / GPSV   Instituto Votorantim is a multinational company with social responsibilities    Activities    Development of new functionalities, and maintenance of an existing social management project.  Evaluate patches, bug fixes and other changes to the application installation  Defines, executes and interprets complex/nested SQL queries  Design, develop, and maintain Microsoft SQL database schemas and scripts, including views, triggers and stored procedures  Regularly communicate project progress, issues, and risks to IS management and business owners  Periodically meetings with the client, for analysing and suggesting new functionalities to improve the project.     Involved Technologies  WCF, SQL, Reporting Services, Jquery, .NET Framework. && Client: Wal-Mart  Multinational markets network    Activities  Gather requirements, design, develop, test and deploy applications   Development of a new tool for perishable management.  Development of a new tool for managing the perishable inventory, and it’s reports.  Assist in performance tuning, balancing, improvement, automation and usability.  Participate in planning and implementing the project    Involved Technologies  .NET Framework, Linq, Web Services Jquery, Json, ADO, Report Viewer, SQL Server && Client: Itaú  Activities  Preparing required documentation, including both program-level and user-level documentation  Gathering requirements from users and creates specifications and develops code  Providing technical direction to non programmers to ensure program deadlines are met  Development and maintenance of web page of the New LJ project.  Works collaboratively with others across distributed offices    Involved Technologies  Visual Studio 2005 e 2008, C#, .NET, SQL Server 2008. Javascript. && Activities  Member of a small development team developing, responsible for testing, and documenting high quality software  Design, build, and maintain efficient, reusable, and reliable C# code  Projects Atitude de Líder. Client: Nestlé.  Responsible for modeling the data base, and the development of the web pages, in Web Forms.  Assist in supporting the solution by taking calls and troubleshooting issues    Involved Technologies  C#, .NET Framework, Visual Studio 2010, Visual Studio 2008, Web Services, WCF., SQL Server 2008. , Javascript. && Activities  Compiling and analyzing technical data  Translating detailed design into computer software  Testing, debugging, and refining the computer software to produce the required product  Enhancing software to reduce operating time and improve efficiency  Responsible for modeling the database, and for the development of websites for the projects from the clients Sothebys, Futcup, Coelho da Fonseco, and HM Engenharia.    Involved Technologies  C#, .NET Framework, Visual Studio 2010, Visual Studio 2008, Web Services, Crystal Reports., SQL Server 2008., Javascript.","October 2016 to Present && October 2015 to February 2017 && July 2015 to October 2016 && March 2014 to July 2015 && January 2013 to March 2014 && October 2012 to January 2013 && December 2010 to October 2011 && September 2010 to December 2010 && January 2009 to October 2010 && January 2008 to December 2008","Senior .Net Developer && Fullstack Developer && .Net Programmer && Consultant && Consultant && Consultant && Consultant && Consultant && Analyst Programmer && Junior .Net Programmer","São Paulo, SP","Universidade de Mogi das Cruzes São Paulo, SP","2007 to 2010","Bachelor Degree in Information Systems in Information Systems","None"
