"CandidateID","Additional-Info","Skills","Work-Experience__Company","Work-Experience__Job-Description","Work-Experience__Job-Duration","Work-Experience__Job Title","Location","Education__Institute","Education__School-Duration","Education__Qualification","Resume-Summary"
"7","Additional Information I am looking for an opportunity to develop business within the tech areas. Experiences include consultancy, marketing, presales and product management for IT and Telco aiming at new and disruptive technologies like SDN, NFV, cloud and Digital Transformation.","Marketing insigth (2 years), Product Management (8 years), Business Development (10+ years), Consulting (3 years), Systems Integration (10+ years), Presentation Skills (10+ years), Presales (10+ years), Sales (5 years)","Red Hat - São Paulo, SP && Huawei do Brasil Telecomunicações - São Paulo, SP && Ericsson - São Paulo, SP","Participation in customer strategic planning sessions supporting, in opportunities discovery, the Account Managers for Telecommunications and Data Center industries;  Business development aiming at Digital Transformation formulating strategies and concepts for the adoption of open-source software;   Customer engagements in ICT with focus in new and disruptive technologies: NFV - Network Functions Virtualization, SDN - Software Defined Network and Cloud;  Consultative services approach focusing in Red Hat solutions in RFx answers and unsolicited proposals, providing business and technical sales support to sales teams;  Partner engagements and solution build up for network functions virtualization and software defined networks portfolio. && Responsible to perform Customer and market insight of all aspects of the customers and assigned technology;  Responsible for the SDN and NFV portfolio, engaging with customers supporting sales teams and responding to change in a high pace technology environment;  Participation in events (FUTURECOM) and industry Summits, as speaker, promoting Huawei’s portfolio;  Owner for field-level go-to market solution, responsible for the exploration of market opportunities, product positioning against competitive solutions, cross-departmental team operations and project management for solutions;   Also responsible for bringing changes to the global solution sales landscape, implement market opportunities and drive leading or significantly increasing market shares;  Act as a group account-level solution SA (architecture design) owner, responsible for the successful delivery of business solution architecture providing business support to sales teams. && Position: Customer Solution Expert  Drive or participate in customer engagements from lead generation to contract fulfillment;  Responsible for the link of product development experts with sales organization;  Directly engaged with the solution in the assigned region, managing deals through its completion;  Responsible for analyzing, designing and developing commercially viable end-to-end propositions, based on business needs and identifying new revenue-generating opportunities;  Act as opportunity owner translating the customer needs into detailed technical offering;   Responsible for providing deep knowledge in technologies, products and services (Ericsson and partners);  Provide professional sales push, in timely and accurate manner, enabling Customer Units to answer RFP/RFQ/RFIs always adhering to principles and values of the customer and the company.    Position: Domain Expert  Responsible for supporting the Multimedia Sales Manager and Account Managers translating customer needs into multimedia solutions, leading to profitable business;  Responsible to support VPMM Organization with the introduction of new solutions;  Sales support and development of new business opportunities;  Specialist of Multimedia portfolio (Consumer & Business Applications, IN, Systems Integrations).    Position: Business Developer  Business development of Systems Integration projects, leading and supervising the delivery process applying models and strategy;  Responsible for the financials (cost and margin) of the services offers;  Secure that the sales work is thoroughly made and according to Ericsson processes.","February 2016 to November 2016 && November 2014 to February 2016 && March 2006 to November 2014","Domain Architect && Sr Marketing Manager && Customer Solution Expert","São Paulo, SP","ESPM - Escola Superior de Propaganda e Marketing && FEI - Faculdade de Engenharia Industrial","None && None","MBA && BSC","None"
"14","None","English – full proficiency, Spanish – elementary proficiency, Portuguese – native proficiency","Move2Cloud - São Paulo, SP && Vonage Brasil - São Paulo, SP && UolDiveo - São Paulo, SP && CMA – Consultoria, Métodos, Assessoria e Mercantil S/A - São Paulo, SP && Diveo do Brasil Telecomunicações Ltda. (now UolDiveo S.A.) - São Paulo, SP && Vicom S.A. (now BT - British Telecom) - Alphaville, SP","Act as Sales Technical Support, translating the customer needs to our company product portfolio. Technical Proposal, Technical Puzzle Solver, Technical Presentations, Pre and Post Sales and Customer Relationship.    AWS, Azure, Google Cloud Platform, Cloud Adoption, Workload Migration, IT Transformation, Sales Support, Cloud Operation, Data Center. && Responsabilidades  - Management of the Operation to support the Business Startup in Brazil. Support the Sales, Customer Care, Marketing and Finance teams on technology subjects and Brazilian market;  - Manage cross-functional third-party partners, which include Data Center Providers, Billing System Application, Web CMS Application and Telecom Carriers, to ensure the delivery of projects, solutions, SLA and KPIs;  - Track and Monitor the KPIs and SLA for the Technology Operation of the Business;  - Support the Office Backend technology. && Responsabilidades  - Management the Operation area of the Telecommunication Business Unit, with over 1200 customers and 4000 links/circuits, leader of more than 50 employees located in seven major cities, ensuring the SLA (service-level agreement) for those customers;  - In charge for the operation, maintenance and management of the backbone with 46 high capacity nodes and over 2000 PoP (points of presence);  - Support for the Telecommunication Business Unit in the Implementation of the Computer Associates Technologies Software Suite for Infrastructure Management;  - Support the Process & Systems Team, to review and deploy of the processes of the Telecommunication Business Unit;  - Technical management of USD 2 million/year for maintenance and support contracts. && Responsabilidades  - Manage the Operation of the Telecommunication and Data Center Business Unit, which include the areas of Customer Deployment, Real State, Facilities, Networks and Field Services. Leading this multidisciplinary team to support the Pre-Sales, Sales and Finance.  - Development and implementation of the process for Pre-sales, Technical Feasibility and Customer Deployment;  - Review of the Operations team process to ensure the SLA (service-level agreement) for the business unit products;  - Development and implementation of standardized products for Telecom and Data Center Networks for the business unit;  - Infrastructure restructuring in the high capacity nodes of the microwave radio backbone, and research for points-of-presence for the backbone expansion;  - Prospecting for new suppliers and technologies for improving the IP/MPLS Backbone, Metro Ethernet Backbone and Data Center Network;  - Network optimization based in microwave radio. && Responsabilidades  - Leader of the Change Management process, for a high availability Data Center and Telecom Backbone;  - Research and Planning for growth and changes of one High Capacity and High Availability Telecom Backbone;   - Technical Support for the Operation, Pre-Sales, Sales teams and Customers;  - Acted as interface for the Engineer Team and the Products Team, for development and release of new Products;  - Developing and managing trainings of new Technologies and Products for the Operations team.  Position History:  · Jan/2010 – Senior Network Engineer  · Dec/2005 – Senior Network Support Analyst  · Dec/2000 – Network Support Analyst  · Sep/1999 – Field Services Technician. && None","January 2016 to Present && July 2014 to March 2015 && February 2012 to May 2013 && August 2010 to February 2012 && October 1999 to August 2010 && September 1994 to September 1999","Cloud Solution Architect && IT Operations Manager && Telecom Operation Manager && Telecom Manager && Senior Network Engineer && Senior Field Services Technician","São Paulo, SP","FIA - SP São Paulo, SP && PUC - SP São Paulo, SP && ETEP - SJC São José dos Campos, SP","2007 to 2008 && 1998 to 2004 && 1990 to 1994","MBA in Project Administration && Bachelor in Electrical Engineer && Technician in Electronic","None"
"16","Additional Information IT professional with over 15 years experience in Business Intelligence, Data Integration, Database and Big Data. Very experienced in all Oracle BI suite, Oracle Data Integrator (ODI), ETL tools, data programming (PL/SQL) and data warehousing. Extensive knowledge and experience in Data visualization with great analytical capabilities and expertise in such areas:  - Enterprise Business Intelligence implementation methodology  - Enterprise wide data analysis, integration and integrity  - Conceptual, logical and physical data architecture and modeling - Data-driven Business Modeling for predictive analysis  - Data integration from variable sources  - Data profiling and quality  - Inman and Kimball database design approaches (Relational, Dimensional and Multidimensional)  - Balanced Scorecard and dashboard analytics  - Data visualization techniques to explain business rules    Business Intelligence  * OLAP: OBIEE 10g / 11g, BI Publisher and BICS (Cloud Service);  * OBI Apps: Financial, Procurement & Spend, HR and OCDM pre-built analytics.  * RDBMS: Oracle Database 9i / 10g / 11g with expertise in PL/SQL (triggers, functions, procedures, packages and indexes).  * SQL Development Tools: PL/SQL Developer, Toad and Oracle SQL Developer.  * Data Modelling: Expertise in Dimensional and Relational modelling using ERWIN and Oracle Data Modelling.  * Data Discovery: Currently using Big Data Discovery to execute proof of concepts and technical presentations. Relevant experience with Endeca, developing demonstrations, customer training and also proof of concepts.    Data Integration  * ETL: Specialist in Oracle Data Integrator (ODI) 10g /11g and exposure to Informatica Power Center 9;    Experience designing Data Architecture, Data Warehouse and Data Marts following Kimball's approach.","OBIEE (8 years), PL/SQL (10+ years), Oracle (10+ years), BICS (3 years), Oracle Data Integrator (7 years), Data Modelling (7 years), DW (7 years), Endeca (4 years), Big Data Discovery (3 years), ETL (7 years), Informatica Power Center 9 (6 years), Data Visualization Tools (DVCS, DVD, Oracle, Tableau) (2 years)","Oracle - São Paulo, SP && GE Oil & Gas && Prodesp && NET Telecom (Cable, Landline, mobile)","Supporting and spreading knowledge to partners enablement in OBIEE, ODI as Big Data Discovery Analytics;  • Demonstrations and POCs (distinctive data sources, ODI as data integration tool and Oracle BI for data presentation);  • OBIEE 11g, BICS and ODI instructor;  • Designing Data Architecture and Roadmap implementation for large customers;  • Understanding and using balanced scored card methodology (feature OSSM);  • Pre-Sales activities like presenting, developing proof of concepts in several customers in Brazil, Mexico and Colombia;  • Leading technical pre-sales team for BI and EPM (Hyperion Planning/ Essbase) presentations;  • Speaker of Big Data Analytics and Business Intelligence in many regions/events in Brazil;  • Building technical datasheets, battle cards, SWOT analysis, white papers for BICS, OBIEE and Oracle Data Integrator.    Accomplishments: In this period, I have been responsible for approximately 20 different proofs of concept using Oracle Business Intelligence 11g, BICS and Oracle Data Integrator;  In my most currently role, as Sales Territory Manager, I had 151% quota achievement FY13 with Top Talent Award and 196% quota achievement FY14 with two awards: a) Top talent; b) The most number of transactions (top performer with 22 new customers acquired).    ➢ GE Oil & Gas - www.ge-energy.com/about/oil_and_gas.jsp && I led an implementation in Brazil (part of a worldwide implementation) of OBI Analytics using ERP Oracle EBS R12 as source. The modules implemented were Financial Analytics, Procurement & Spend Analytics;  • Architecture composed by Oracle EBS R12, Oracle Business Intelligence Enterprise Edition, Informatica PowerCenter, DAC Server, Essbase and Oracle Database;  • Responsible to solve commons problems in BI Apps implementations such as bad performance, new table sources, inclusion of more filters, adjust on semantic layer (star-schemas model), new joins, to customize reports, graphs ensuring the governance. In-depth analysis in Data Load ETL workflows in Informatica with customization of Informatica flows and DAC metadata.  • Working with global team in daily contact with team distributed in India and USA;    Accomplishments: I led the implementation of two modules of Oracle Business Intelligence applications without delays on the agreed schedule;    ➢ PRODESP (Data processing Company of Sao Paulo State) - www.prodesp.sp.gov.br && Project implementation of Business Intelligence for Human Resources;  • Customer definition and implementation of E-LT strategy;  • Data warehouse design and implementation (dimensional modelling);  • Specification and design of E-LT mappings using Oracle Data Integrator 11g;  • Analysis of business indicators with client and development of OBIEE 11g semantic layer;  • Review and discussion of business requirements with customers;  • Experience in all SDLC: requirement gathering, documentation, developing, testing and customer training;  • Build proof of concept of Hyperion Essbase integrated with OBIEE 11g;  • Responsible for the deployment of the Physical Layer, Business Model and Presentation layers in OBIEE repository including design and definition of physical sources, logical tables, dimensions, columns and aggregation rules;  • Set ODI scenarios loads, evaluation of QA, ODI and OBIEE validation.    Accomplishments: I have done the implementation of payroll's project of all civil servants of Sao Paulo city;    ➢ Oi Telecom (One of the largest telecom operators in Brazil) - www.oi.com.br    BI/DW Architect Solutions - 2011/May - 2011/Nov  • Definition of Dimensional Data Model, DW Architecture using Oracle platform (Oracle DB, ODI & OBIEE);  • Interview users to collect and management of requirements;  • Details of systems involved, business rules, scenarios for the scope of contracted services in the RFP;  • ETL Data integration with several sources Sybase and SQL Server using Oracle Data Integrator;  • OBIEE Training for business users.    ➢ Net Cable TV services (Brazil's largest Cable TV operator, internet and Phone with revenues around US$ 500 million and 20.000 employees) - www.net.tv.br && May/2011  • Responsible for Business Intelligence Competence Center with 25 employees;  • Architect of main BI Projects: Revenue Dashboards, BI Voice On Demand, Retention & Churn reduction, Contact Center Telephony analytics and Marketing analysis with savings for the company about $ 5 million per year.  • Management of implementation of OCDM Models;  • Creation of OBIEE dashboards like as Customer Churn Prediction, Sales Growth Analysis;  • Data dimensional modelling, performance analysis and Tuning;  • Leader of project to Data Integration of CDR (Call Detail Record) of Embratel Company to billing systems.    ➢ TAM Airlines (Largest airline in Brazil) - www.tam.com.br    ETL Developer - 2007/Feb - 2007/Jun  • Analyst leading requirements (Use cases, Dimensional modelling, technical specifications);  • Lead the DWH/BI Governance, Functional Business Analysis and Requirements, Project Management Input, Technical Specification, Business Process Data Modelling, ETL, Data Profiling, Data Integration, Data Mapping, Metadata Management, Test Planning and Orchestration, Capacity Planning, Environment and Query Optimization.    ➢ CEVA Logistics S.A. (One of the world's leading logistics companies) - www.cevalogistics.com    BI/DW Developer - 2005/Jun. - 2007/Feb  • PLSQL Development (procedures, triggers, functions e packages) & OBIEE;  • Analysis of problems occurred in transactions in the database and corrective maintenance and evolution;  • Participation in new projects developing and implementing Ad-hoc reports, KPIs, WMS / TMS indicators;  • Analysis of performance, duplication of databases, generation of new bases for testing and approval;    ➢ Syncreon Logistics S.A. (Large logistics company for the automotive market) - www.syncreon.com    Systems Analyst - 2004/Aug - 2005/Jun    ➢ Spinelli S/A CVMC (Brazil's traditional brokerage stock exchange) - www.spinelli.com.br    Analyst Programmer Database - 2000/Aug - 2004/Aug    ➢ Auri Branco S/A (Private Company - manufacturing)    Trainee Data Processing - de 1999/Sep - 2000/Aug","November 2012 to Present && March 2012 to November 2012 && November 2011 to March 2012 && May 2011 to May 2011","Senior BI/EPM Solutions Architect && BI Senior Solution Architect && Sr. BI/DW Architect Solutions && Sr. BI/DW Coordinator - 2007/Jun","São Paulo, SP","University in Chicago && Oracle University && School of Computing and Business Administration Paulista && Objetivo College","None && None && None && None","Certificate in Financial Management && Certificate in Business Intelligence Foundation && Certificate in Business && None","Professional with over 14 years of experience working in large corporations. Extensive experience in whole lifecycle Business Intelligence projects working in the telecom, automotive and transportation industries. Complete view of processes and data architecture, very experienced in data integration, data modelling and reporting. Strong communication skills with great ability to communicate to C Level. Oracle Instructor (OBIEE, BICS and ODI). Ability to quickly learn advanced technical and functional product knowledge."
"17","Additional Information Curso de System Architect – Prodabel (2013);  Curso de Enterprise Architect – Prodabel (2013)","System Architect (1 year), Enterprise Architect (1 year), Microsoft Office (2 years), UML (1 year), Microsoft Project (Less than 1 year), RUP (1 year), Informática Básica (4 years), Inglês Intermediário (2 years), Tecnologia da Informação (2 years)","Prodabel - Belo Horizonte, MG && Colégio e Pré-Vestibular Soma - Belo Horizonte, MG","Documentação de requisitos; análise e documentação de casos de uso; análise, modelagem e melhoria de processos; uso das ferramentas case System Architect e Enterprise Architect para gerar documentações; validação de documentações; demandas no Mantis; reuniões e rotinas de projetos; processo de garantia da qualidade (MPS.BR). && Suporte aos professores em sala; manuseio e manutenção de equipamentos multimídia; auxílio no uso de sistemas; manutenção dos arquivos nos servidores de aulas.","August 2013 to December 2014 && February 2012 to December 2012","Estagiário de Análise && Estagiário de Informática","Belo Horizonte, MG","Pontifícia Universidade Católica de Minas Gerais Belo Horizonte, MG","January 2011 to December 2014","Bacharelado in Sistemas de Informação","None"
"21","Additional Information Java, Android, C/C++, Java, Delphi, Visual Basic 6, VB.NET, Assembly, AHDL.","Arquitetura de Soluções (3 years), Análise de Negócios (5 years), Análise de Sistemas (10+ years)","HSBC GLT/Scopus - Curitiba, PR && HSBC GLT/Scopus - Curitiba, PR && Nokia Siemens && Nokia Siemens && Bachmann Security && CNBB && None","Solutions' Architect since 2013  ➢ Senior Business Analyst.  Solutions Architect for London headquarters, working remotely from Brazil and responsible for the HSBC Legal solutions. Lead Business Analyst with internal certification. Project Manager's backup. Responsible for most of the Use Cases and all the non functional requirements. Currently responsible for technical and commercial proposals based on function points counts. && Quality Analyst.  ➢ Scrum Master.  3 months in India to train people and system rollout. Represented the project in steering committees with directors from Finland, Germany, USA and some potential customers. && Projects of Computer Forensics and Information Security following the best practices and the standards ISO 17799-2005, COBIT and ISO 9001. && Key Points:  ➢ Currently a Solution Architect.  ➢ Focal Senior Business Analyst at GLT HSBC.  ➢ Project Manager Backup.  ➢ International work experience. England, Mexico, India (NSN).  ➢ Certified SCRUM Master, Certified Business Analyst.  ➢ Experience with Information Security, and Computer Forensics. && None && None && None","2013 to Present && March 2011 to Present && 2008 to 2011 && 2009 to 2009 && 2005 to 2007 && 2004 to 2005 && 2001 to 2002","Arquiteto de Soluções && Consultant Specialist && Business Analyst && Teacher of High Performance Systems && Owner && System Analyst && Trainee","Curitiba, PR","UTFPR Curitiba, PR && PUCPR Curitiba, PR","March 2006 to December 2007 && March 1998 to January 2004","Pós Graduação in Gestão de Negócios && Bacharelado in Engenharia de Computação","None"
"22","Additional Information INFORMÁTICA  • Word, Excel, Power Point, Acess e Photoshop  • Formação de Excel Avançado 09/2016 Curso: VcSensei","Word Avançado (10+ years), Excel Avançado (5 years), Power Point Intermediário (8 years), Administração (5 years), Gestão da Qualidade (1 year), Digitação (10+ years), modelagem de processos (1 year)","FUNDAÇÃO PETROBRAS DE SEGURIDADE SOCIAL - PETROS && EMPRESA MUNICIPAL DE URBANIZAÇÃO - RIOURBE && LOJA VAREJISTA ESPAÇO MODA && TRIBUNAL REGIONAL FEDERAL DA && CASA DE FESTAS ESTAÇÃO ALEGRIA","Apoio na revisão e monitoramento de riscos; monitoramento de indicadores; apoio na avaliação de normas internas; elaboração de textos e atas, planilhas e gráficos; modelagem de processos utilizando a metodologia BPMN; operações com a ferramenta System Architect; realização de entrevistas com responsáveis pelos processos; ler e interpretar fluxogramas de processos. && Realização de rotinas processuais; atendimento ao público e telefônico; noções de protocolo e arquivo; cadastramento de obras na ferramenta Siscob; autuação e encaminhamento de processos, faturamento e medição de obras; consulta banco de dados; organização de documentos; elaboração de memorandos, ofícios e documentos; acompanhamento de obras (escolas, hospitais e conjuntos habitacionais). && Empresa familiar com foco em vestuário feminino, realização de atividades tais como apoio nas atividades de venda, estoque, organização de mercadorias e da loja, atendimento ao cliente, design de vitrine, entre outras pertinentes ao negócio. && Registro e movimentação de expedientes no sistema; cadastro e movimentação de processos; elaboração de ofícios, memorandos, correspondências e etiquetas; carimbo, numeração, montagem e envelopamento de processos; organização e arquivamento de documentos; atendimento ao público e telefônico; digitação de planilhas, etc. && Monitoramento dos brinquedos, jogos e crianças, identificar as crianças e servi-las, animação no momento da confraternização de parabéns, organização e limpeza da casa de festas antes e após os eventos, etc.","June 2015 to September 2016 && August 2013 to June 2015 && 2012 to 2012 && May 2011 to December 2011 && 2011 to 2011","ESTAGIÁRIO && ESTAGIÁRIO && FREELANCER && ESTAGIÁRIO && FREELANCER","Rio de Janeiro, RJ","UNIVERSIDADE FEDERAL DO RIO DE JANEIRO && ESCOLA TÉCNICA DO ESTADO DO RIO DE JANEIRO","September 2016 && December 2011","GRADUAÇÃO in Administração && Administração","Atuação na área de gestão/administração."
