"CandidateID","Additional-Info","Skills","Work-Experience__Company","Work-Experience__Job-Description","Work-Experience__Job-Duration","Work-Experience__Job Title","Location","Education__Institute","Education__School-Duration","Education__Qualification","Resume-Summary"
"17","Additional Information Dynamic, versatile Telecommunications Engineer with 30+ year’s experience. Recognized as a team-player and high-achieving-performer that is consistent in completing assignments on-time and under budget. An advanced-level troubleshooter; able to effectively and efficiently resolve issues, and meet and achieve challenging goals and objectives. Direct and decisive leader with ""hands-on"" management style; results-oriented individual with an exemplary track record of success in safety and regulatory compliance, quality control, customer service, operations installation, maintenance and repair, BPM and PMBok. Exceptional technology skills combined with proven ability to drive technical and analytical strategy, manage and nurture talent, deliver sales growth, form strategic partnerships, and successfully implement and oversee complex projects. Outstanding strategist distinguished for proven leadership and team-building skills and excellent conflict resolution abilities; demonstrated management skills that enhance productivity and drive sustained organizational performance","Management, Coordinator, Specialist, engineer, Electronics, Telecommunication Specialist, Satellite Specialist, Network Engineer,Maintenance, research, electronics, hardware, components, development, SDH, microwave radios, satellite telecom systems, wireless networks, power electronics, optical telecommunication, multiplex, digital telecommunication, rectifiers, telecom radios, international experience, PMBoK, BPM (10+ years)","IQOR - Valinhos, SP && Tel-NT Brasil - Valinhos, SP","Coordination, design and development of processes for massive repair of cable TV boxes. Responsible for designing and building electronic high productivity testing system for cable TV decoders . Coordination and desing of the repair line, electronic repair lab and cosmetic cleaning and process, painting, polishing and graphics for the repair of STB. Command engineering team dedicated to the project, even accounting for the support the technical needs of the telecommunications repair laboratory as NPI System engineer && : Positioned in a new role, create by Jabil, for development and management (including optimization, operations and maintenance) of technology strategist leading the research and development of new technologies, products and services for consumer high volume repair. Enable ongoing business growth through service refinement and improvement.   • Developed high volume repair process: Process development for High Volume repair lines for Cisco Set Top Box, Ip-Phone, Memories; Dell LCD and FPD according manufacturer specifications.  R&D RF Specialist: Responsible to develop and build solutions for telecommunication equipments repair in order to growth the expertise and business. Develop of new test rigs and electronic boards to help the repair process with training.  • Ensure business sustainability and profit improvement: The growth of repair process to improve the profits with rationalization and development.  • Developed new Repair Technologies Forecast: Partnership with costumer to keep the expertise beyond the marked needs to be prepared for new business.   • Delivered operational Profits through in house new repair: Developed of new repair soluctions for Nec, Nortel, Alcatel, Huawei, Cisco, Digitel, GE and Hughes, Nokia, Siemens, Ericsson and others.  • Delivered burn-in chambers: Project and in-house construction of customized programmable burn-in chambers for Tekelec, Dell, LCD and CISCO Set Top Box repair projects.  • Developed new Repair Process for Switches and Routers: Repair process development with growth of technician’s expertise in data communication equipments for Cisco and Avaya.   • Satellite Communication Equipment Repair Process: Developed of repair process for satellite communication equipment like Hughes Ku-band Vsat Stations and Codan C-band SCPC Power Transmitters.    • Technical Instructor for new technologies: Designed the Teaching guidelines for Technicians to follow new repair process and technologies. Formal training delivered for 30 Senior Technicians.","June 2012 to August 2016 && January 2010 to May 2012","Business Development - Coordenador de Projetos de Engenharia - Eng. Project Coordinator && NPI Engineer","Campinas, SP","FAEL Campinas, SP && Faculdade Claretiana Campinas, SP && Faculdade Salesianas Campinas, SP && ETEC Campinas, SP","2016 to 2017 && 2014 to 2016 && 1988 to 1989 && 1981 to 1984","MBA in Processos GErenciais && BA in Information technolgy management && Electronics Technology in Electronics && Electronics Technician in Electronics","None"
"22","Additional Information Skills  Solid experience of more than 16 years in the area of information technology:  • More than 15 years working in BPO companies, including the largest in the world  • Progression: acting as technical, technical manager, project, solutions consultant then Pre Sales.  • Telecommunications specialist, TDM, R2, H.323, SIP, CDR, Billing  • High interaction with carrier provider, technical issues, billing and commercial matters.  • Solutions Consultant, Pre sales and cost assessment of architecture.  • Meetings, demonstrations, and workshops with customers, and a non-technical audience  • IT leading platform in BPO.  • Partner support.  • Skills in leadership, planning, organization, control, negotiation, assertiveness, communication and teamwork.  • Management of maintenance contracts and management of several simultaneous projects.  • Resource optimization and cost reduction  • Vast experience in Avaya platform.  • Management budget (CAPEX and OPEX)  • Preparation and analysis of Requests for Proposal (RFPs)","Avaya (10+ years), SIP (7 years), ACD, Telecommunications, Routing, ATM, Contact center (10+ years)","Aspect Software - Orlando, FL && Teleperformance - Contact Centre - São Paulo, SP && Teleperformance - Contact Centre - São Paulo, SP && Teleperformance - Contact Centre - São Paulo, SP && TELMART - São Paulo, SP && Atento Brazil - São Paulo, SP && Atento Brazil - São Paulo, SP && Atento Brazil - São Paulo, SP && Fênix Telecom","• Solutions Consultant responsible for Voxeo and Zipwire products in Brazil  • Working for CDPs, customers, and partners for Cloud Solutions  • Unified IP projects  • Partner Support  • Meetings, demonstrations, and workshops with customers and non-technical audiences  • Responsible for responding to functional and technical elements of RFIs/RFPs    Relevant achievements  • SC responsible for biggest Voxeo deal in Latam region, Governament Bank (new logo), with 4700+ IVR channels, 2 weeks of PoC with real environment, covering more than 200 items as features software, hardware and integration, one by one && • Solutions Consultant  • Search and evaluation of new technologies applied to business  • Design technical solution for project implementation  • Preparation of technical presentations  • Responsible for responding to functional and technical elements of RFIs/RFPs  • Working with customers and non-technical audiences  • Survey of cost of technological infrastructure (Capex, Opex and recurrent) && • Project Management  • Telecom Design Solutions (pre-sales)  • Capex / Opex spreadsheet investment  • Cost control and project resources  • Relationship with department purchases && • Interaction and monitoring of suppliers (third parties)  • Tier 3 Analyst, responsible for analyzing and solving problems of high complexity  • Realization of IT projects and search for new solutions for optimization and cost reduction  • Realization of technical reports && • ACD maintenance and implementation of contact center environments and corporate  • Realization of projects and consulting  • Implementation of first office's Royal Caribbean in Brazil && • Leadership team of 17 staff members, running 24x7  • Responsible for all administration of the IT platform, Atento Brazil, monitoring more than 2,800 high-end servers and more than 40 Avaya PBX across the country  • IT Consulting and Infrastructure for implementing new call center environment, including technical and operational viability. Responsible for all telecommunication implementations, sizing, installation and configuration  • Technical reporting and justification for reduction of contractual fines  • Training, technical overview for Contact Center staff as supervisors, coordinator and managers && • 2nd level analyst, responsible for administration and support of Avaya platform  • 3rd level analyst, responsible for supporting highly complex contact center installations and projects  • Analyzing and assessing the use of links and voice costs  • Technical reports  • Administration of a complex environment (1MM calls per day) through ATM networking with 5 sites interconnected working mode BSR (Best Service Routing) Avaya with more than 7,000 seats  • Management planning and corrective maintenance and upgrade of the platform  • High interaction with carrier provider, technical issues, billing, and commercial matters && • Administrator of the control room operating routines within the contact center environment  • Administrator of routines, reviewing applications for improvements in daily actions  • Administration and monitoring of ACD, CTI, IVR, Call Recording, backup and retrievals and Billing && • Implementation of cabling infrastructure  • Activation of offices, layout and installation for implementing network telephony and administrative offices  • Installation of Distributor General terminal block (DG)","September 2014 to Present && May 2012 to September 2014 && June 2011 to May 2012 && October 2009 to June 2011 && March 2009 to October 2009 && December 2006 to July 2008 && September 2004 to December 2006 && March 2000 to September 2004 && April 1999 to March 2000","Solutions Consultant && IT Pre Sales && IT Projects Specialist && Telecom Specialist && Avaya Business Partner && IT Consultant && Tier 3 Telecom Technical Support && Technical Analyst && Telephone Technician","São Paulo, SP","Universidade do Grande ABC São Paulo, SP","2001 to 2005","Bachelor of Computer Science in Computer Science","Marcelo Leite, holds a BS in Computer Science and has over 16 years of experience in the technology industry. In Contact Center Atento he worked for over 8 years in Telecom Specialist functions, as a NOC Engineer, and an IT Consultant for New Site's projects. He also worked at Teleperformance for more than five years, where he served as a Telecom specialist, Project Manager, and Solutions Consultant. Working C level for RFP sessions meetings, technical presentations, IT coasts in large scale projects.  Marcelo has been married for 9 years and is the proud father of twin daughters"
"24","Additional Information 1) Skills  1.1) PROFISSIONAL  * Relationship  * Negotiation  * Analysis  * Leadership    1.2) WORKED AREAS  * Information Technology  * Telecommunications  * PMO  * Corporate Governance    1.3) PERFORMANCE  * Team Work  * Client Relationship  * Client Point of View  * Continual Improvement  * Entrepreneurship","Liderança de Projetos (10+ years), Gerenciamento de Projetos (5 years)","GLOBAL HITSS - Rio de Janeiro, RJ && TIM CELULAR S.A - Rio de Janeiro, RJ && DATAMAT S.p.A - Rio de Janeiro, RJ && EMBRATEL - Rio de Janeiro, RJ && Policentro Consulprev - Rio de Janeiro, RJ","- Project Manager for ITO and Business Security areas;  - Leader of third parties development teams;  - Budget Control;  - Relationship management,  - Support to Operational and Strategical levels. && - Leader of third parties development teams;  - Revenue Assurance process control and planning;  - Budget Control  - Internal project leadership.  - Support to Operational and Strategical levels. && - Client Support;  - New business opportunities prospection;  - DATAMAT's solution deployment,  - Relationship Management,  - Change Management Leadership. && - Support to immediate management;  - Workflow development and deployment.    SYSTEM ANALYST  PIX Projetos em Informática - Rio de Janeiro - RJ    - Development, Deployment and Support dedicated client systems. && Development, Deployment and Support dedicated client systems.","2009 to 2013 && 2005 to 2009 && 2000 to 2004 && 1998 to 1999 && 1997 to 1998","PROJECT MANAGER (PMO) && IT SPECIALIST && SENIOR CONSULTANT && SYSTEM ANALYST && SOFTWARE DEVELOPER","Rio de Janeiro, RJ","CCMN - UFRJ Rio de Janeiro, RJ && PUC - Rio de Janeiro Rio de Janeiro, RJ && UERJ Rio de Janeiro, RJ","April 2002 to April 2003 && September 1999 to April 2001 && July 1995 to July 1999","Pós-Graduação in PROGRAMA DE PÓS-GRADUAÇÃO EM GERÊNCIA ESTRATÉGICA DE TECNOLOGIA DE INFORMÁTICA && Especialização in Pós-Graduação em Análise, Projeto e Gerenciamento de Sistemas, PUC - RJ (abril/2001) && Bacharelado in Matemática","None"
"25","None","Team Leadership (10+ years), Project Management (10+ years), Networking (10+ years), IT Management (10+ years), Cloud Computing (3 years)","Start-IDP - Rio de Janeiro, RJ && AJAR - Rio de Janeiro, RJ && Phorm UK - São Paulo, SP && Oi SA - Rio de Janeiro, RJ && Oi SA - Rio de Janeiro, RJ && AJAR - Rio de Janeiro, RJ","Start-IDP is a Canadian company focused on developing startup businesses.  Responsible for managing the technology strategy for the startups under our portfolio, sometimes working as CIO/COO, focusing on their IT infrastructure, development and tech team;   Provide valuable feedback to structure the companies for growth, maturity, transparency and IT governance and engage on technology partnerships that could bring synergy to their main core business;  Currently setting up our Fintech PCI-DSS environment at AWS using two AZs with mirrored services running Nginx, Tomcat and Galera Cluster using ELB and HAProxy. Implement SoftwareMarket’s Magento e-commerce and study new portfolio companies, based on IoT and BI. && Consultancy for Phorm  • Implement Phorm network and server infrastructure on datacenters where the company had business activities, such as China, Russia and the United States.   • Responsible for doing site survey and test datacenter infrastructure.  • Test server and network infrastructure amongst multiple datacenters for evaluation.  • Coordinate platform tests to evaluate if the system works as expected using public cloud, private or as a regular datacenter.  • Design and implement the server farm and network hardware to support Phorm systems.  • Perform research on new technologies concerning data acquision and processing for data transfers up to 100G.  • Present Phorm technical solution to stakeholders and technical specialists in ISPs in Russia and the United States. Lead the implementation team, manage the project and report to the stakeholders;     Consultancy for MUXI  • Providing consultancy and hands-on services for network consolidation and resilience between datacenters for MUXI (electronic transactions), as well as other solutions, such as implementing server and application monitoring.  • Manage the process for PCI-DSS compliance for key financial infrastructure and processes. && • Develop distributor and integrator channels for Phorm in Brasil;   • Assure project delivery at Brazil major ISPs, Telefonica, Oi and GVT;  • Make technical presentations for ISP executive stakeholders;  • Setup a supply chain in Brazil for local deployments mainly Telecom and IT equipment;  • Project manager for the solutions deployed and on negotiation with local ISPs;   • Manage the local Brazilian NOC. && • Lead Oi information Security team focused on Network and OSes  • Adequate new security features (hardening) to Oi main systems;  • Deploy 802.1x authentication for it’s corporate network;  • Assure internal SLA for all tickets;  • Manage third party contracts and staff; && Feb-2010 to Jan-2011  • Develop Oi’s Metro Network evolution to adequate to IPTV services and High Speed broadband  • Implemented the “Navegador“ Project (Phorm).    Sept-2008 to Feb-2010  • Promoted to Specialist/Consultant. New roles are to elaborate the view of the technology evolution of Oi’s IP network to the Engineering Master Plan (5 years).  • Elaborate technical documentation to drive the usage/implementation of new technologies for the IP backbone (NGN/IPTV/3G/WiMAX/Femtocell)  • Manage the integration of Oi's 5 different NGN vendors.  • Propose technological update of Oi’s network that promote revenue increase with reduction of Opex and Capex;  • Support other areas regarding IP technology (OSS, VAS, Fixed/Mobile);  • Identify technological alternatives to the development of convergent products taking advantage of the synergy between fixed and mobile networks  • Offer technological support to the development of new products and services  • Represent the Engineering Department at the Information Security Committee and the Environment Committee;    Nov-2005 to Sept-2008  • Senior Telecom Specialist at Oi LABs to test telecommunication solutions for corporate products and Proof of Concept to B2B Clients. Oi is the biggest Telecom carrier in Brazil.  • Develop WAN solutions involving regular Internet Access, using Dial, xDSL, Serial, Frame and ATM technologies, as well as more complex designs with QoS to provide Data and Voice priority on the MPLS backbone.  • Deploy solutions using Satellite and GPRS/EDGE technology for places with marginal or no cable connections.  • Manage co-workers from different areas to achieve the project goals on schedule;  • Provide support for Engineering Provisioning Department as well as 3rd Level Backbone support;  • Manage Checkpoint Firewall to provide VPN access from manufactures to test equipment at the LAB;  • Keep control of the many dial and data circuits in the LAB, as well as Infrastructure connections and IP address usage;  • Work closely with the Marketing and Sales team to provide effective and “on-time” solutions for our clients;  • Some of the projects I was involved: Oi International MPLS interconnection with US carrier, Global Crossing, GPRS solution for ATM machines for ABN AMRO BANK and TECBAN, QoS over Satellite for Banco do Brasil, QoS over Frame Relay for BUNGE, QoS over xDSL for Caixa Economica Federal. && Consultant to IPNET Soluções LTDA  • Contact and establish a partnership with a NYC IT Company for a Cluster solution to Petrobras based on Intel Itanium2 Platform  • Project a solution to run Mesoscale Atmospheric Circulation computer simulation to LIGHT, using Opteron 64bits server.  • Develop a solution to re-arrange the fiber-optics backbone at ONS.  • On-line mass storage solution for surveillance video recording  • NAS and iSCSI solutions up to 46TB  • Server consolidation from many different platforms, cutting colocation costs, electric power consumption and reducing TCO with infrastructure and management.  • Solution of database optimization using solid state disks, with possible enhance in performance by 20 times.  • Post-Sales support for Bradesco Seguros Backbone (Enterasys);  • Project manager for Sul América Seguros Network Outsource project.","March 2016 to Present && May 2013 to Present && August 2011 to May 2013 && January 2011 to July 2011 && November 2005 to December 2010 && January 2004 to October 2005","Partner / CTO && Solutions Architect/Consultant && Network Deployment Manager && Network Security Lead && Telecom Consultant && IT Consultant/Project Manager","Rio de Janeiro, RJ","Pontificia Universidade Católica do Rio de Janeiro","None","Masters","AREAS OF EXPERTISE  • Broad knowledge and success in leading network and server infrastructure projects for large, high-profile organizations and startup developments.   • Success developing, testing and launching innovative solutions to achieve specific client needs.   • Skilled team leader and trainer with a history to leading teams to manage projects and achieve established goals.   • Highly skilled communications expert with experience presenting complex technical information and recommendations to stakeholders and upper management. Fluent in English and Portuguese.   TECHNICAL PROFICIENCIES  Telecom and IT infrastructure (hardware/Software/Cloud), Business development, Strategic Technology Planning. Budget and cost management. Team development and management.    IEEE Member […]"
