"CandidateID","Additional-Info","Skills","Work-Experience__Company","Work-Experience__Job-Description","Work-Experience__Job-Duration","Work-Experience__Job Title","Location","Education__Institute","Education__School-Duration","Education__Qualification","Resume-Summary"
"0","None","Strong experience in project development, architecture solution definition between heterogeneous applications, coordinating teams in software factory, Java development team training and SOA integration services, preparation of schedules, distribution of tasks, and has acted in pre- Sales for the submission of SOA solutions and evaluation of RFPs. (10+ years), 6 years using the SOA approach, with the practice of Oracle Fusion Middleware 11g products (Oracle Service Bus, Oracle SOA Suite, AIA and ODI). (6 years), 3 years in project implementation in business process architecture, with practice in the product Oracle Business Process Management (Oracle BPM Suite 11g, ADF and Oracle BAM). (3 years), 1 year using APIs architecture, with the practice of Oracle products Manage API, Oracle API Catalog and Oracle API Gateway. (1 year), 4 years of experience and understanding of J2EE and XML technologies (XPath, XSLT, WSDL, UDDI, SOAP, XSD, DTD). (5 years), 2 years of work with the eTOM Business Process Framework in the implementation of SOA projects insurance and telecommunications companies. (2 years), 7 years in methodologies (ITIL, TOGAF and Scrum / Kanban) in the implementation of JEE & SOA projects. (3 years), 9 years of working with and configuring one or more of the J2EE servers: JBoss, Websphere, Weblogic, Glassfish, Tomcat. (9 years), 6 years definition of architectural solutions in SAP implementation projects working on modules (FI / MM / CO / FSCD / BW) integration with PI XI / RFC in legacy systems: 4GL, MQSeries and Oracle Database to insurance company. (6 years), 8 years of development experience with Java Message Service (JMS), Hibernate and JPA. (8 years), 4 years in the development and maintenance project in COBOL language (DMSII, COBRA, edix). (4 years)","Deloitte Touche Tohmatsu - São Paulo, SP && Vertigo Tecnologia - Rio de Janeiro, RJ && Accenture - São Paulo, SP && GSW Soluções Integradas - São José dos Campos, SP && EAI Brazil - São Paulo, SP && Inexsoft - São Paulo, SP && eWave - São Paulo, SP && Foursys - São Paulo, SP && Attachmate - São Paulo, SP","Responsabilidades:  I work as a Senior Analyst Specialist in the technical leadership role, responsible for the Infra Middleware area, providing technical support in troubleshooting solutions involving Oracle Fusion Middleware (AIA & ODI) in integrations with ERPs (BRM, Siebel and EBS) for the Customer Serasa & Experian. && Responsibilities  I working as a senior consultant in technical leadership role, responsible for defining and implementing the integration architecture solution using MuleSoft as AnyPoint Platform Studio / Cloudhub, Java Developers for integration with RFC / SAP and Oracle Cloud Service for Travel and Expense design, meeting all areas global company AB Inbev. && Responsibilities  I worked as a Senior Consultant based on the SOA solution architect, responsible for implementing the SOA architecture and Management APIs using Oracle SOA Suite 11g and 12c, Oracle Service Bus, Oracle API Manager, Oracle API Gateway, Oracle API Catalog for integration with health systems Finance and implemented in .NET and Java.    Achievements  Define and guide project teams to SOA architect of project implementation in Prodam client.    Skills  Knowledge in Oracle Fusion Middleware 11g and 12c tools used for the project. && Responsibilities:  I worked as a consultant in technical Leader function, responsible for the definitions of enterprise architecture solution geared to download and upload fault history files following the requistos Wireless Service Unit equipment, as well as implementing integrations Payment Gateway USA & Europe , using Oracle SOA Suite 11g, Oracle Service Bus, and Adapters for integration with systems JAVA / .NET / SAP with FI-Financial module (RFC and IDOC).    Customer: Embraer && Responsibilities:  I worked as a consultant in the role of Application Architect, the definitions of architecture and troubleshooting of the NET.UNO design applications with integration of Amdocs CRM, Embratel, Sigma with Legacy systems using Weblogic Server 10.3.6.0, Oracle SOA Suite 11g, Oracle Products Service Bus, Oracle Data Integration and Oracle Golden Gate.    Customer : NET Telecom && Responsibilities:  I worked as a consultant in the role of Solution Architect, Technical Leader responsible for definitions of architecture solution integrations of legacy products: (Protection and Monitoring, Commissions, Health, RE, AUTO and Claims). Using Oracle SOA Suite 11g, Service Bus, BPEL, PI and XI Adapters for integration with SAP modules in (CO / MM / FI / FSCD / BW).     Customer : Porto Seguro && Responsibilities:  I worked as a consultant in the role of Solution Architect, Technician for factory SOA projects (SP) services in the products Oracle SOA Suite 11g, Service Bus, BPEL and Adapters for integration with SAP, BPM Suite and BAM) Lider. Responsible technical definition of SOA, drafting guides reference architecture, method for identification of services for SOA lifecycle, implementation guides, OSB, BPEL and BAM architecture architecture, and pre-sales activities in the preparation of proposals effort estimation in projects JEE and SOA architecture.     Customer : Porto Seguro / SP, CASSI / DF, Claro / SP and T-System / SP. && Responsibilities:  I worked as a consultant in the role of Solution Architect, Technical Engineer responsible for designs factory SOA (SP) services, development and deployment project for NETCOMBO HDMAX and Programming Guide Products J2EE and SOA platform, using tools: Oracle Weblogic Service Bus 10.0, Weblogic Integration 9.2.2, 9.2.2 dataservices Aqualogic, Oracle 10g, Weblogic Portal 10.0.2 using WorkSpace Studio 1.1.     Customer : NET Telecom and Finance BV. && Responsibilities:  I worked as a consultant in the role of Systems Architect, responsible for the development and deployment of R2 design for automation exchange contracts on J2EE platform using tools: Eclipse IDE Europe, Ajax, Servlets, JasperReport, iReport, XML, JSF, Spring Framework, JAB Framework (Java Altec Brazil), Ajax4J, DAO, JDBC, Webphere 6.5, Oracle 8.1.     Customer : Grupo Santander Brazil.","February 2016 to Present && August 2015 to January 2016 && January 2015 to July 2015 && July 2014 to December 2014 && October 2013 to July 2014 && August 2012 to September 2013 && May 2011 to July 2012 && October 2010 to April 2011 && November 2009 to September 2010","Senior IT Specialist && Technical Lead & Solution Architect && Senior Consultant && SOA Solutions Architect && SOA Application Architect && SOA Solutions Architect && SOA Solutions Architect && Project Coordinator && Systems Architect","São Paulo, SP","UFPA Belém, PA","1989 to 1994","Tecnólogo em Processamento de Dados in Computer Engineering","Seeking a position of Solution Architect, challenge in the field of information technology, with an opportunity for advancement where my education and work experience will have valuable application. I have over 24 years of IT experience, strongly working in software development.    I believe that a deep knowledge must have a solid foundation of work experience within the organization that respects the development and mobilization of society.    My goal is to prove my faculties and credible skills in the area of Computer Science and Software Engineering, I am so confident of my willingness to take on a new challenge that could be using my talents and skills in an innovative and productive context."
"2","Additional Information − Computer skills  − Large experience in Rollout and Swap projects  − PMI member","Em liderança, em acompanhamento e gerenciamento de projetos (10+ years)","Nowadays && Digital Microwave corporation && Nortel BTS && Splice do Brasil - São Paulo, SP && TELASA do Brasil, Alagoas","Regional Manager. Managing O&M and NI, including BSS, MW, fibber optics ring, IPPath.  Responsible for the implementation of new projects and sites.  - Swap coordination for Ericsson, Alcatel and Nokia. Support for others regions in the same company.  - Rollout coordination for Nortel, Ericsson, Alcatel and Huawei. Over than 1.000 sites.  - Regional Infrastructure account manager. Responsible to coordinate the contract and the special situations that involve site and contract terms.  - Main responsible for operational indicators. Prepare the statistics to fix the main issues that were responsible to decrease the indicators.  - Consultant for Swap projects.  - Focal point for NOC.  - Quality supervisor. && Telecommunication equipments vendor    - National after-sales support. Responsible to give support after sales to main customers in Brasil.  - Account manager for AMERICEL, providing technical solutions and installation quality manager.  - On the job Trainer  - Product manager  - Support to on-site engineering teams.  - Customer support during on-site troubleshooting. && Telecommunication solution provider    - Wireless Team Leader.  - Wireless support integration.  - Drive Test reports and solutions.  - Wireless implementation designer.  - Rollout Team Leader  - Installation supervision of sub-contractors. Accomplish tasks of quality supervision and support, site engineering, commissioning, integration, upgrades, acceptance with the customer, troubleshooting and technical support of Nortel BTS, Microwave and fiber optics equipments. && providing solution for the optical ring between São Paulo Belo Horizonte and Rio de Janeiro.  − Site survey and pre-project for Embratel a Long distance call operator.  − Site commissioning for TELESP and CTBC in São Paulo.  − Troubleshoot supervisor for company customers.  − Support to on-site engineering teams.  − Customer support during on-site troubleshooting. && O&M Responsible for the metropolitan area of Maceió  − On the job Trainer  − Quality supervisor Equipments Field implementation.  − Field troubleshoot and deployment of these products","1998 to 1998 && 1998 to 1998 && 1996 to 1998 && 1992 to 1996 && 1985 to 1990","Telecom Specialist / Regional Manager && Account manager && Promon Engineer && Technical account manager && Installation supervisor","Maceió, AL","Engineering College Rio de Janeiro, RJ && Technical in electric equipments Federal High School","1998 && 1984","BTS in Mechanical Engineer && Education","None"
"4","Additional Information I am looking for an opportunity to develop business within the tech areas. Experiences include consultancy, marketing, presales and product management for IT and Telco aiming at new and disruptive technologies like SDN, NFV, cloud and Digital Transformation.","Marketing insigth (2 years), Product Management (8 years), Business Development (10+ years), Consulting (3 years), Systems Integration (10+ years), Presentation Skills (10+ years), Presales (10+ years), Sales (5 years)","Red Hat - São Paulo, SP && Huawei do Brasil Telecomunicações - São Paulo, SP && Ericsson - São Paulo, SP","Participation in customer strategic planning sessions supporting, in opportunities discovery, the Account Managers for Telecommunications and Data Center industries;  Business development aiming at Digital Transformation formulating strategies and concepts for the adoption of open-source software;   Customer engagements in ICT with focus in new and disruptive technologies: NFV - Network Functions Virtualization, SDN - Software Defined Network and Cloud;  Consultative services approach focusing in Red Hat solutions in RFx answers and unsolicited proposals, providing business and technical sales support to sales teams;  Partner engagements and solution build up for network functions virtualization and software defined networks portfolio. && Responsible to perform Customer and market insight of all aspects of the customers and assigned technology;  Responsible for the SDN and NFV portfolio, engaging with customers supporting sales teams and responding to change in a high pace technology environment;  Participation in events (FUTURECOM) and industry Summits, as speaker, promoting Huawei’s portfolio;  Owner for field-level go-to market solution, responsible for the exploration of market opportunities, product positioning against competitive solutions, cross-departmental team operations and project management for solutions;   Also responsible for bringing changes to the global solution sales landscape, implement market opportunities and drive leading or significantly increasing market shares;  Act as a group account-level solution SA (architecture design) owner, responsible for the successful delivery of business solution architecture providing business support to sales teams. && Position: Customer Solution Expert  Drive or participate in customer engagements from lead generation to contract fulfillment;  Responsible for the link of product development experts with sales organization;  Directly engaged with the solution in the assigned region, managing deals through its completion;  Responsible for analyzing, designing and developing commercially viable end-to-end propositions, based on business needs and identifying new revenue-generating opportunities;  Act as opportunity owner translating the customer needs into detailed technical offering;   Responsible for providing deep knowledge in technologies, products and services (Ericsson and partners);  Provide professional sales push, in timely and accurate manner, enabling Customer Units to answer RFP/RFQ/RFIs always adhering to principles and values of the customer and the company.    Position: Domain Expert  Responsible for supporting the Multimedia Sales Manager and Account Managers translating customer needs into multimedia solutions, leading to profitable business;  Responsible to support VPMM Organization with the introduction of new solutions;  Sales support and development of new business opportunities;  Specialist of Multimedia portfolio (Consumer & Business Applications, IN, Systems Integrations).    Position: Business Developer  Business development of Systems Integration projects, leading and supervising the delivery process applying models and strategy;  Responsible for the financials (cost and margin) of the services offers;  Secure that the sales work is thoroughly made and according to Ericsson processes.","February 2016 to November 2016 && November 2014 to February 2016 && March 2006 to November 2014","Domain Architect && Sr Marketing Manager && Customer Solution Expert","São Paulo, SP","ESPM - Escola Superior de Propaganda e Marketing && FEI - Faculdade de Engenharia Industrial","None && None","MBA && BSC","None"
"8","None","Proficient in Windows (Word, Excel, Power Point, Visio, MS Project and Access) (10+ years)","United Health Group / Amil && ity of Rio de Janeiro – Health Department && FALCONY CONSULTING - Work performed for Publicar Brazil (media company) && FALCONY CONSULTING - Work performed for VALE (Mining company) && FALCONY CONSULTING - TV Globo && FALCONY CONSULTING - Work performed for Queiroz Galvao (Oil & Gas company) && FALCONY CONSULTING - Group Zayd (construction company) && CONTAX - CALL CENTER && Oi (telecommunication company)","• Health economics analysis;  • Implementation of new technology systems such as:  Medical Care Guidance (MCG) to assist doctors in hospitals using Evidence-based Care Guidance  Medical Intelligent Group (cost indicators for materials and medicine to each hospital)  • Monitoring of medical costs;  • Process mapping and process modelling to Pre-Authorization area. && • Strategic Projects Coordinator for the Health Department;  • Modeling and mapping business processes;  • Development of KPIs to be cascaded through the business;  • Responsible for the financial indicators and monitoring the budget for the Board. && • Project scope: Organisational restructure and process redesign (PDCA methodology);  • Project outcomes: increased efficiency and productivity, maximising revenue for the business; Management Consultant Work performed for Health Department - City of Rio de Janeiro Feb 2009 to Jan 2010  • Project scope: Organisational and process restructuring following the PDCA methodology.  • Project outcomes: Process efficiency and cost reduction. && Project scope: Organisational restructuring and processes alignment for the Logistics area.  • Project outcomes: Standardisation of their management model and alignment and integration of the logistics processes end-to-end, using the PDCA methodology. && Accountable for annual budget, project control and performance indicators. && • Project scope: business process mapping and modeling for the Petroleum projects.  • Project outcomes: People productivity and cost reduction. && • Financial planning, budget (CAPEX and OPEX) and controller of the Group's construction business;   • Strategic planning and 5YP, including planning of new businesses units;   • Procurement of materials and services for the construction projects. && • Preparation and implementation of knowledge management database;  • Preparation of the monthly President's report to shareholders;  • Responsible for new projects in the Quality department, from Definition phase through to Planning, Implementation and Integration with BAU activities;  • Approval of project management plans;  • Redesigning processes towards standardisation and efficiency;  • Responsible for overall content quality (IGQ) across the business, with the preparation of new quality models annually, deployment and monitoring of monthly indicators;  • Implementation of PMO for the Legal department. && Responsible for the feasibility study of new projects through market analysis and definition of the target audience;   • Coordination of strategic planning for new technologies through market analysis and benchmarking;   • Development and deployment of training materials for all Planning employees;   • Preparation of the budget (CAPEX/OPEX) for the Board;   • Preparation of the monthly performance report for the Board;   • Standardisation and improvement of Board management processes;   • Responsible for the Regional Quality Program developing processes, goals, action plan and quality indicators;   • Implementation of PMO for the Legal department.","February 2015 to Present && August 2010 to February 2015 && January 2010 to August 2010 && September 2008 to February 2009 && June 2008 to September 2008 && September 2007 to May 2008 && February 2007 to September 2007 && October 2005 to February 2007 && August 2001 to October 2005","Project specialist && Senior Health Advisor && Finance Consultant && Management Consultant && Acting Finance Manager && Management Consultant && Acting Planning Manager && Quality Coordinator && Planning Coordinator","Rio de Janeiro, RJ","Fundacao Getulio Vargas && Pontifical Catholic University of Rio de Janeiro","February 2002 to December 2002 && January 1995 to August 2001","International Executive MBA && Bachelor of Engineering in Civil and Production","• Experience in leading teams;  • Experience in strategic planning, market analysis, performance dashboards and indicators;  • Experience in process mapping and standardisation;  • Expertise in planning, quality control, change management and project implementation;  • Experience in PMO set up and governance."
